"date","username","tweet"
"2009-07-18","medeamaterial","noalsilencio pero la ue no es el mundo p julianortegam y quã dirã­an que en medellã­n hay clases q arrancan a las 6am"
"2009-07-18","pandamedellin","hola a todos somos el fan club de panda en medellin colombia siempre apoyando pxndx"
"2009-07-18","periodistica","en contacto con el bajo mundo de medellã­n y encontrã ndole gustillo a lo sã rdido â"
"2009-07-18","radioacktiva_","hoy gallinita agradecemos a todo este cacareo en medellã n y bogotã pidan canciones las ponemos acã rtwitter hoy gallinita agradecemos a todo este cacareo en medellã n y bogotã pidan canciones las ponemos acã rtwitter"
"2009-07-18","raigohead","suena creep de stp muero ron medellin"
"2009-07-18","ramirolopera","maitte estarã fuera de medellã­n por motivos laborales porfa si puedes grabas y me incluyes en los proyectos o actividades gracias"
"2009-07-18","rosacris","eco de soreygarcia domingoelm maã ana medellã­n va por su cuarto delm http domingoenlamanana.com"
"2009-07-18","rtwdave","new blog post skateboarding in medellin http bit.ly y8m7w"
"2009-07-18","sandrapi","http twitpic.com askvv sã bado soleado en medellã­n"
"2009-07-18","sebastiangr","esperando al concierto de the ataris emociã n indescriptible nunca pensã poder verlos y menos en medellã­n d esto es real"
"2009-07-18","sherwinkrug","yr since medellin columbia all clear giving blood again life south center dunwoody"
"2009-07-18","shir_gilvasco","este calor es para una cerveza la gafa playa y vacaciones claro con el inconveniente que estoy en medellã­n por aca nada de mar plop"
"2009-07-18","soreygarcia","domingoelm maã ana medellã­n va por su cuarto delm http domingoenlamanana.com"
"2009-07-18","superlitio","firma de autã grafos y show acãºstico ciudad medellã­n lugar tower records centro comercial el tesoro fecha sã bado agosto â 00am final car audio medellã­n ciudad lugar aeroparque juan pablo ii fecha viernes de agosto"
"2009-07-18","thedamo","rooshv congrats on finishing your new book what's the subject looking forward to hearing thoughts medellin and colombia"
"2009-07-18","tifis","augustoserna say the word yo quiero ir para medallo creo que irã el otro mes si todo sale bien"
"2009-07-18","travel_deal","air ord mde cheap flights from chicago to medellin starting american airlines roundtrip flight goin http bit.ly 5k2ve"
"2009-07-18","valdezvalley","delm medellã­n en el food mart florest a las 30am domingo la maã ana tipo brunch:p mã s info con johnrestrepo"
"2009-07-18","viktorlozano","johnrestrepo domingoelm medellã­n va por su cuarto delm http domingoenlamanana.com domingo julio am"
"2009-07-18","vuelosplus","vuelo panama city pty a medellin colombia mde del al 368â baja un http tinyurl.com nfue8v vuelo panama city pty a medellin colombia mde del al 280â baja un http tinyurl.com ny7bd2"
"2009-07-21","abcamilo","de salida para el acogedor centro medellã­n quã mamera pero toca hace rato no hacã­a un dã­a gris y fresco en medellã­n menos mal ya estaba muy aburridora la sudadera todo el tiempo"
"2009-07-21","agenciaingenio","proyecto de participaciã n melissa en colombia moda medellã­n julio"
"2009-07-21","alebak","por fã­n algo bueno hizo la pichurria de alcalde medellã­n"
"2009-07-21","alibabasexshop","ali baba sexshop medellin colombia"
"2009-07-21","alzate1011","making some changes in www.gtour2009 com adding more photos the galery of medellã­n"
"2009-07-21","americanbryan","layover in medellin"
"2009-07-21","averraco","1er simposio internacional de ingenierã­a diseã o producto eafit medellã­n http www.eafit.edu.co diseno"
"2009-07-21","betodurand","susanayelvira peye bogotã maã e medellã­n corroncho bquilla y asi toca preguntarle a sunshine83__ como seria en bucara"
"2009-07-21","camiloq","que calor tan berraco hace en medellã­n me devuelvo para la capital capitalina triste pero"
"2009-07-21","caritoisaza","about medellin colombia beautiful http bit.ly 34lzge"
"2009-07-21","carlosmariomont","que exito la propuesta de cambiar en medellã­n los vehiculos tracciã n animal por motor y caballos a descansar fincas"
"2009-07-21","citytv","aterciopelados desde medellã­n para el concierto nacional http ow.ly hpml"
"2009-07-21","ciudadanocomun","medellin crossing streets for the avendia populated is hot of thousand demons medellã­n recorriendo calles por la avendia el poblado hace calor de mil demonios"
"2009-07-21","colombiareports","un juzgado de medellã­n condenã a la naciã n por muerte seã ora martha janeth correa murillo durante operaciã mariscal en l"
"2009-07-21","coloresmari","cmd c pe5pe rbolivar rori recuerda esto lo ãºnico bueno de bogotã es la salida para medellã­n y va uno a ver ve horas fuera de casa lugares medellã­n donde la gente escucha aterciopelados por quã serã serã que donpe estã ya en medellã­n pa nos acompaã e como siempre"
"2009-07-21","danielup","en el concejo de medellã­n se habla cã mo construir una ciudad digital maã ana a las 9am transmite telemedellã­n http tinyurl.com cya62d"
"2009-07-21","davidceg","just got home from running around medellin for a lil about to eat and chill maybe ill light up fat head tonight karinacoloda fuck cali medellin is where its at homie"
"2009-07-21","digitalscribble","i wonder how my pal down there in medellin is doing with his digitalwriting demo work this week hope he writes"
"2009-07-21","dvs_88","plaqueta hay una comida corrida en coahuila entre monterrey y medellã­n que a mã­ me raya cabrã n se llama la cotorra del lado izquierdo"
"2009-07-21","elespectador","independiente medellã­n se refuerza con panameã o brunette hay pino el centroamericano ha destacado como golea http bit.ly ir3kq"
"2009-07-21","elreticente","la alcaldia de medellã­n le cambio los coches o zorras a sus dueã os por motocarros y demã s les prestaron plata que bueno"
"2009-07-21","eltiempo","dura condena a la naciã n por excesos en operaciã contra las milicias comunas de medellã­n http bit.ly axwiu"
"2009-07-21","erickthered","radioacktiva_ y radioactiva cã mo se va a dejar ver en el partido colombia vs ecuador medellã­n"
"2009-07-21","fanultra","juanestwiter vamos a colombia la semana que viene nuestra hija va al colegio en medellin tu ciudad queremos mucho gente colombiana"
"2009-07-21","guillermo7301","gallinita la nueva estã en medellã­n tata_betancur"
"2009-07-21","jennygiraldo","ya casi estã lista la nueva sede del mamm en el sur de medellã­n bienvenidos http tinyurl.com mckfqq"
"2009-07-21","jesus_hoyos","acabo de hablar con oracle colombia para mi charla en medellin la semana que viene hablare sobre crm y saas mas detalles pronto"
"2009-07-21","joyqpolo","johana se fue pa medellin"
"2009-07-21","jpruizs","donrul pues el hombre trabaja allã es de canada pero viviã en colombia un tiempo lo conocã­ medellã­n blog ã l www.ryanrowe.com"
"2009-07-21","juanchulas","alejoserrano oiste medellin cuando pues te dejas ver por aqui"
"2009-07-21","kikearlia","saliendo a medellin y luego otro avion pa vnzla"
"2009-07-21","leopineda","bigmancho donpe si es una chimba mas cuando uno va en la bici estan invitados el domingo de agosto a competencia medellã­n"
"2009-07-21","medallo","ultimate cachuleta xtrema master veedores discuciã n en http bit.ly 2at9eh microsoft libera tres drivers para linux http bit.ly r7zwf de julio http bit.ly pgzvj sierra nevada del cocuy o gã ican http bit.ly rblnh luca bacchetti barcelona summer chart http bit.ly vvoez messenger cumple aã os http bit.ly 1ydjcg"
"2009-07-21","melodiel","blue_collar_u just got off of skype continuing negotiations to do a one page business plan seminar in medellin colombia opbp"
"2009-07-21","miningtweets","marketwire tao minerals announces appointment of chief financial officer medellin colombia marketw http bit.ly 2cvaju"
"2009-07-21","noe_z","some remarks on soderbergh's che which i loved http bit.ly gy6vh like the references to medellã­n"
"2009-07-21","noticiascaracol","mã s de â zorreros medellã­n cambiarã n sus carretas por motocarros con una inversiã mill http cli.gs y5bsa"
"2009-07-21","panamanews","new post deportes brunette hay pino se incorpora al independiente medellã­n http cli.gs jplbh"
"2009-07-21","peepetra","juanestwiter vamos a colombia la semana que viene nuestra hija va al colegio en medellin tu ciudad queremos mucho gente colombiana"
"2009-07-21","raeioul","atenciã n medellã­n http www.flickr.com photos raouldraws"
"2009-07-21","rafaocana","habla medellã­n ese acento tan familiar"
"2009-07-21","serglog","chandaxi gracs este caso es para medellin y no encuentro nada en concreto eso de la poliza me serviria pa joderlos"
"2009-07-21","silenceway","stralunato meliremo polã­tica pãºblica en cultura medellã­n falta contenido y profundidad pero una menciã n es algo http ly uzc"
"2009-07-21","systeme_d","rachel_arthur colombiamoda was really something there's this weirdest ranch club called mango's u must c just outside medellin"
"2009-07-21","tettay","hoy almorcã en el hotel medellã­n royal un corte de carne res con pimientos morrones tomates secos mozarella y espã rragos estuvo rico"
"2009-07-21","thisismarcela","les recomiendo seguir a eliana_velez es nueva en el twitter y una estudiante de fotografia medellin bastante talentosa xd"
"2009-07-21","trafico889","a vuelta de rueda viaducto miguel aleman desde eje pte medellin hasta calz tlalpan"
"2009-07-21","vuelosdesdemex","vuelo mexico city mex a medellin colombia mde del al 652â baja un http tinyurl.com mcsdug"
"2009-07-21","vuelosplus","vuelo medellin colombia mde a santiago chile scl del al 469â baja un http tinyurl.com lz3o9e vuelo santiago chile scl a medellin colombia mde del al 344â baja un http tinyurl.com lowtfx"
"2009-07-24","andresuseche","back in manizales short film meeting tomorrow riosucio for party and medellin the day after more meetings with filmmakers"
"2009-07-24","andru_lii","te amooo idiotaaa marimarrrrrrrrrr plz com to medellin y_y voy a llorarrrrrrrr hp amychanjonas te vienes para medellin a la feria de las flores vvdd"
"2009-07-24","angelamars","annamaria152 yo ese puente estoy en medallo por eso proponia un fin de semana septiembre annykita yo voy en plan medio familiar pero dejarã mucho tiempo pa los twitteros de medallo quiero sabado la noche el lleras"
"2009-07-24","annykita","k4ryl el acuario de medellã­n estã en parque explora esta primer y segundo nivel del es bonito algo mã s por conocer"
"2009-07-24","camilo_villa","angelamars uy un untraditional followfriday gracias que cuando venã­s pa medellã­n pareces precandidata de tour por colombia jeje"
"2009-07-24","ciudadenlinea","mapa con todas las notarã­as de medellã­n http www.ciudadenlinea.net medellin notarias"
"2009-07-24","clauqui","k4ryl yo lo ãºnico que he hecho cuando ido a medellã­n ha sido montar en metro y cable tengo ir con mã s tiempo p"
"2009-07-24","donpe","k4ryl medellin estaciã n universidad del metro al lado queda el parque norte y jardã­n botã nico"
"2009-07-24","elreticente","listo por fin las fotos del fotopaseo al centro de medellã­n http is.gd 1kxoz puros colores y gente acciones"
"2009-07-24","federicoruiz","superlitio medellã­n autã grafos y show acãºstico en tower records el tesoro sã bado de agosto a las del medio dia"
"2009-07-24","felipevalencia","calle on my bday en medellin i'm so there"
"2009-07-24","gringa_paisa","k4ryl vivi en medellin anos y bogota de a edad k4ryl tengo muchas de mis mejores memorias en medellin covenas tolu villa leiva cristalena puerto berrio horas trenes la magdalena"
"2009-07-24","hoycolombia","behind the scenes new film â œmoravia en medellin http bit.ly fgikj una mujer muriã en medellã­n por la gripa tipo ah1n1 http bit.ly 12sgxf"
"2009-07-24","jamoriginal","de hoy en ocho dã­as nos verã n la feria empresarial â œel cielo florece medellã nâ lugar parque biblioteca santo domingo p.m"
"2009-07-24","joeabello","feels like vinnie chase post medellã­n and pre gatsby because i'm not at comic con this year"
"2009-07-24","josesantosxx","la ostioneria del mercado de medellin es neta"
"2009-07-24","juanchulas","clauqui k4ryl medellã­n es una chimbaaaaa"
"2009-07-24","k4ryl","clauqui nah en medellin hay muchas cosas por hacer aunque sã lo estar ahi ya es una nota a mi me encanta estoy feliz de volver"
"2009-07-24","macwoody","at medellin looking forward to friday night rumba http schmap.me x3wjtq"
"2009-07-24","malfi","la version mexicana del galã n fabio ronda las calles de medellin probablemente presta servicios personales"
"2009-07-24","matacandelas","â hoy viernes son las dos ultimas funciones de los ciegos en medellin luego arrancamos para floridablanca y despuã s bogotã simbolista"
"2009-07-24","medallo","internet explorer malaktivigita kiel mi faris http bit.ly 4qfn2y se acerca una actualizaciã n visible del pagerank http bit.ly rtkkx â casquilleras o seductoras http bit.ly rya4y"
"2009-07-24","omarpa","medallo alla vamos"
"2009-07-24","rockombia","festival de clã sicos en supernatural medellã­n http bit.ly uwwqc"
"2009-07-24","ruanmepe","i'm in medellin and our friend recipient of the letter live santiago"
"2009-07-24","scstonestreet","new blog post next medellin colombia http:stephenstonestreet.com"
"2009-07-24","starrnat","needs to find good place go out in medellin tonight"
"2009-07-24","superlitio","medellã­n firma de autã grafos y show acãºstico lugar tower records centro comercial el tesoro fecha sã bado agosto â 00am siguiente parada medellã­n final car audio lugar aeroparque juan pablo ii fecha viernes de agosto medellã­n firma de autã grafos y show acãºstico lugar tower records centro comercial el tesoro fecha sã bado agosto â 00am siguiente parada medellã­n final car audio lugar aeroparque juan pablo ii fecha viernes de agosto"
"2009-07-24","talentolatam","jã venes en medellã­n hacen marcha para la no violencia http bit.ly fnsqw"
"2009-07-24","trafico889","choque mãºltiple en viaducto miguel alemã n dir poniente a la altura de medellã­n el carril extrema izquierda a vuelta de rueda la circulaciã n en viaducto entre medellã­n hasta tlalpan"
"2009-07-27","almatranquila","con dario ruiz gomez manuel mejia vallejo y marta traba iba al patio del tango en medellin alli se veia el retrato de carlos gardel"
"2009-07-27","amaliebruun","in medellin for colombiamoda"
"2009-07-27","anavallejoc","quien sabe donde dan clases de portugues en medellin"
"2009-07-27","andrewdwatson","having a google chat with friend in medellin colombia trying to learn spanish someday i won't feel retarded when speak it"
"2009-07-27","astrametatron","smartfemme en medellin un limosnero promedio se gana alrededor de al dã­a"
"2009-07-27","babesection","lina marulanda fotos sensuales en bikini es una modelo y presentadora colombiana nacida medellã­n el http url4 eu 9dso"
"2009-07-27","camiloq","me entero que en medellã­n la gente solamente se puede casar iglesias bueno bodas religiosas nada de fincas ni lugares paganos"
"2009-07-27","clointimo","back from medellin getting organized shipping orders calling stores ready for market trying on the new samples boss"
"2009-07-27","colombiareports","el museo de arte moderno medellã­n presentã a mammo http bit.ly wodct"
"2009-07-27","dabuiles","compro una boleta para calle medellin quien pide menos"
"2009-07-27","dapina","en minutos se estrena disneylandia medellã­n la colecciã n siempre multicultural y contestataria del brasileã o fraga el invitado int buen comienzo para colombiamoda que muestra la otra cara de medellã­n quebrada labermejana en el barrio moravia y otros proyect"
"2009-07-27","diancosi","radioacktiva_ hey existe una direccion mail de radioacktiva medellin"
"2009-07-27","elcuchu","esperando ok del anunciante para enviar originales a el colombiano de medellã­n"
"2009-07-27","esferatur_rio","ta de sã o paulo para cali novo voo e medellã­n na colã mbia http bit.ly fbwyz"
"2009-07-27","flaviamoda","gente o aqurio de medellin ã lindo pena que acabou a bateria da cã mera"
"2009-07-27","futbolred","millonarios junior y medellã­n son punteros de sus grupos en la copa postobã n http bit.ly otubf"
"2009-07-27","hernanvarela","listo el canal twitter de la cã mara comercio medellã­n para antioquia clic aquã­ inscribirse http twitter.com camaramedellin"
"2009-07-27","infolocalcomfe","anavallejoc en el centro internacional de idiomas y culturas ciic ubicado medellã­n propiedad la universidad ant"
"2009-07-27","jlush709","jayonrait i suggested the jump shark episode was documentary where they went to columbia film medellin"
"2009-07-27","linaceballos","medallo parce estoy contigo jeje"
"2009-07-27","lscolombia","new blog post lifestyle medellin http bit.ly 4eo36"
"2009-07-27","mafebf","tefyyepesita jajajajaja los retos con lo mejor q hay d pa medallo ps viste el de indi sebastianyepes claro sebas te estaremos acompaã ando como siempre medellin nos espera d buenisimoo pa medallo otra vez gente alla nos vemos"
"2009-07-27","marcap6","well it seems like the weather is gonna be fantastic for feria de las flores in medellã­n"
"2009-07-27","maximusentropy","me voy para medellã­n a la feria de las flores remates en el 1er parque laureles con perros pedro y guaro john recomendado"
"2009-07-27","medallo","you never know http bit.ly 17qdgv el papã simio http bit.ly 2h17hi"
"2009-07-27","medeamaterial","yo sã­ sigo a medallo desde hace rato me sirve como un twitter rss hasta cosas interesantes veo por ahã­"
"2009-07-27","milenaqs","que calor mucho en medellã­n y creo muchas partes del mundo"
"2009-07-27","nadimcomics","me quiero tomar una foto con la cabeza entre las nalgas de gorda botero que estã en medellã­n"
"2009-07-27","orichalbaud","artantoni o amamos medellin xd take meee"
"2009-07-27","ramirolopera","cerro nutibara pueblito paisa medellã­n http trunc.it 12p25"
"2009-07-27","sebastianyepes","hola listo pa darle la ultima vuelta al ensayo este jueves voy medellin nos vemos por alla"
"2009-07-27","smartfemme","daniel_gomez_ uy levã ntame un trabajo de esos allã y salgo una pa medallo ya estoy hecha p"
"2009-07-27","soytatabetancur","njulian hermoso ninguna de las que nos presentamos en medellã­n pasamos a semifinalistas pero bueno gracias por el apoyo besos a todos los que me preguntaron si soy finalista lamento decirles no al parecer ninguna de las nenas nos presentamos en medellã­n"
"2009-07-27","thebabesection","lina marulanda fotos sensuales en bikini es una modelo y presentadora colombiana nacida medellã­n el http url4 eu 9dn7"
"2009-07-27","trafico889","hay carga vehicular en medellin entre insurgentes hasta el viaducto"
"2009-07-30","adapar","luisramirez medellã­n"
"2009-07-30","alejagonzalez","sebastianyepes mono como va todo x medallo mira k tengo sentimiento de nostalgia me acorde muchas cosas con la banda y da tristeza"
"2009-07-30","alejandrogih","esta es una pequeã a muestra de porque no me quiero ir medellin nunca disfruten http tinyurl.com labxbx"
"2009-07-30","alejoserrano","juankg mano esa mã­a me costã lucas y para pior en el mac center de tesoro medellã n pronto es tamaã o"
"2009-07-30","ami_gf_","dynation hola daddy no olvides que bolivia te ama algunas de tus cangris iremos a recogerte medellin colombia quiero mucho dynation hola daddy no olvides que bolivia te ama algunas de tus cangris iremos a recogerte medellin colombia quiero mucho"
"2009-07-30","anavallejoc","el planetario de medellin tendra una pagina web_ y se empiezan a repetir experiencias medellin es muy bonito pero aqui somos los mismos"
"2009-07-30","andphe","â º colombiaphp buscano lideres en ciudades para los grupos de research bogota cali medellin quien se le mide php co"
"2009-07-30","andradedirak","superlitio la prã xima semana en medellã­n con su calidosound el de agosto x unplugged live y radioacktiva confirmado gira jack daniels con the mills ahora en medellã­n coming soon amigos de esperen nuevas noticias"
"2009-07-30","augustoserna","a tomar fotos se dijo nos vemos voy pal toque de radioactiva en medellã­n no olviden ingresar al grupo http bit.ly 19whyv gallinita caracolradio escuche avianca explica incidente en vuelo bogotã medellã­n que intentã aterrizar dos veces rã­o http bit.ly klyje"
"2009-07-30","bako_music","nos vamos pa medellã­n que emociã n y placer"
"2009-07-30","betodurand","â medellin"
"2009-07-30","canalrcn","nos tomamos la feria de las flores en medellã­n el canal rcn presente con todo su talento vamos por tã­ colombia"
"2009-07-30","caracolradio","escuche avianca explica incidente en vuelo bogotã medellã­n que intentã aterrizar dos veces rã­o http bit.ly klyje"
"2009-07-30","ciudadenlinea","medellã­n laboratorios laproff s.a ha sido ubicado en el mapa http www.ciudadenlinea.net sitio"
"2009-07-30","coloresmari","todo lo que pasa en medellã­n y antioquia se ve noticias caracol si cã mo no"
"2009-07-30","cortnigrange","she call her pu y medellin that good eaw damn myfabolouslife lls"
"2009-07-30","cronopiana","el clima en medellã­n estã insoportable haga su popio dã­a sin carro urge empezar a dar soluciones"
"2009-07-30","dancodec","medellin"
"2009-07-30","dapina","piano en vivo para acompaã ar a ciudad acuario la coleeciã n del joven talento de medellã­n camilo alvarez colombiamoda"
"2009-07-30","dariopalacio","anda alborotado el chimbã rio hoy en medellin que cosa tan hp"
"2009-07-30","destnee_","cutemarieclaire josegregorio el 1âº de agosto en medellin abriendo la feria las flores lt por quã mi paã s no hay algo asã"
"2009-07-30","diegopulecio","hoy acustico maã ana ensayo el sabado cierre del evento mas talento musica en corferias domingo medellin feria de las flores algo"
"2009-07-30","drayru","jackmulligan camilo_carreno de hecho esos jeans si fueron todo un ã xito en medellã­n el tipo cerrã por presiã n social no ventas"
"2009-07-30","dreaming_in_kr","sebastianyepes espero k te vaya super en medellin y disfrutes al maximo aun sigo escuchandote d kieroooooo"
"2009-07-30","ecuainm_oficial","www.ecuadorinmediato.com presidenta de cã mara comercio medellã­n pide a gobiernos colombia y ecuador r http bit.ly dteux"
"2009-07-30","empleatecotodas","asesor comercial empresa comerci medellin rionegro colombia http bit.ly 30vwdv empleo"
"2009-07-30","fedemarin_","y recorde que estoy muriendo por ir a colombiamodas t_t en mometnso como etsa epoca muero medellin xd yo no conozco ni cali medallo y dicen que alla ai viejas re buenas"
"2009-07-30","flwbarranquilla","buscano lideres en ciudades para los grupos de colombiaphp research gt bogota cali medellin quien se le mide"
"2009-07-30","frankiejazz","viernes de agosto frankie jazz en medellã­n caraudio http htxt.it nx6q"
"2009-07-30","fundaciongabo","iii encuentro nacional de comunicadores y periodistas serã el agosto medellã­n colombia ver mã s gt http bit.ly 38czwm"
"2009-07-30","futbolred","ante chicã independiente medellã­n buscarã la tercera victoria consecutiva http bit.ly 1heimd"
"2009-07-30","heyanabelle","ahora siempre veo las plenarias del concejo de medellin con musiquita fondo http santiagolondonouribe.org"
"2009-07-30","hiacostandres","skid row en medellã­n oime alguien sabe si sebastian bach todavia canta ahi sino no pega mucho la ida s juanchulas musicasomos skid row en medellã­n http bit.ly pbnnk oh my fcuking lord"
"2009-07-30","infolocalcomfe","hablemos de medellã­n hoy hã bitat y vivienda en â gestiã n del desarrollo humano integral http bit.ly 27pezu"
"2009-07-30","jesus_hoyos","evento de oracle crm en medellin http bit.ly vyzji"
"2009-07-30","juanchulas","juanestwiter juanes parcero medellin es una chimbaaaaaaaaaaaaaa jujujuju veni a fera de flores medallo pues musicasomos skid row en medellã­n http bit.ly pbnnk"
"2009-07-30","juliand","linaceballos quã twittero de medellã­n estã disponible now para hacerle unas preguntas periodismodigital que tenga cã mara y micro"
"2009-07-30","latamperiodismo","fnpi_org iii encuentro nacional de comunicadores y periodistas serã el agosto medellã­n colombia http bit.ly 38czwm"
"2009-07-30","lauriramirez","ahora si voy pa medellã­n como lo a pensar xd"
"2009-07-30","linaceballos","quã twittero de medellã­n estã disponible now para hacerle unas preguntas periodismodigital que tenga cã mara y micro"
"2009-07-30","lopezquekk","intenten entrar con una contraseã a invalida su facebook esto es mã s pirata que el hueco de medellã­n http tinyurl.com kog5e6"
"2009-07-30","maruluzar","dapina piano en vivo para acompaã ar a ciudad acuario la coleeciã n del joven talento de medellã­n camilo alvarez colombiamoda"
"2009-07-30","mdeliimon","josegregorio es el 1âº de agosto en medellin abriendo la feria las floreeeeeeeeeeeeeeeeeeeeeesssssssssss"
"2009-07-30","medallo","hoy me cambiaron la llave http bit.ly vroru diraäµo kiun mi å atas http bit.ly 1x8ebo au revoir simone still night light http bit.ly v9xxf"
"2009-07-30","musicasomos","skid row en medellã­n http bit.ly pbnnk skid row en medellã­n planillados http bit.ly vly8f"
"2009-07-30","nexjuan","estebanpalillo abogado concejal mã s joven de medellã­n ahora dt profesional felicitaciones palo"
"2009-07-30","noticiascaracol","homicidios en medellã­n se han elevado un por ciento la cifra tiene alarmadas a las autoridades de ciud http cli.gs 85y6n"
"2009-07-30","radioacktiva_","tata_betancur radioacktiva_ y en medellã­n tambiã n es banda sorpresa asã­ serã una para el planetarock"
"2009-07-30","raigohead","telemedellin medellin jul telemedellã­n la candelaria el sector con mã s homicidios http bit.ly eskjz medellin jul telemedellã­n la candelaria el sector con mã s homicidios http bit.ly eskjz"
