"date","username","tweet"
"2009-02-25","caracolradio","incremento de criminalidad en medellã­n http tinyurl.com cl7596 roban equipos de la national geographic en medellã­n http tinyurl.com dx3pro"
"2009-02-25","cardila","con muchas espectativas por mi inicio en el proyecto medellin"
"2009-02-25","cooperativa","independiente y defensor sporting firmaron tablas en medellã­n http tinyurl.com d7b6tq"
"2009-02-25","criticadigital","â lava perrosâ de medellã­n en el corazã n buenos aires la ciudad colombiana es un destino soã http tinyurl.com d9pnh5"
"2009-02-25","elreticente","alguien sabe el link del video clinica sicarios guatemalteco medellin que hambre pero mientras mi hermano prepara la comida ya casi desayuno trato de escribir sobre el miedo se nos avecina en medellã­n viendo en la noticias un robo de comida jardin infantil pienso las palabras koreano que visito medellã­n y casi lo atracan a demã s de los ladrones que en estã ciudad son muchos las entidades como metro y epm no te permiten grabar medellã­n es antiaudiovisual esta es la ciudad donde vivo trabajo el audiovisual roban equipos de national geographic en medellã­n http is.gd kq0m metrallo"
"2009-02-25","federicoruiz","y bueno aunque camilo es de bogotã resultã conociendo a la chica lo del negocio ella http www.ricoverdeo.com pa medellin ok"
"2009-02-25","futbolred","prensa uruguaya alaba el juego prã ctico e inteligente de defensor en medellã­n los matutinos charrãºa saludã http tinyurl.com cnwd57 polilla da silva dice que le dio de su propia medicina al medellã­n jugamos una forma muy similar a como j http tinyurl.com alulcu"
"2009-02-25","gerente","raigohead retweeting caracolradio roban equipos de la national geographic en medellã­n http tinyurl.com dx3pro colombia es pasiã n"
"2009-02-25","glr_networks","col incremento de criminalidad en medellã­n http tinyurl.com cl7596 col roban equipos de la national geographic en medellã­n http tinyurl.com dx3pro"
"2009-02-25","letraescarlata","empatã medellã­n nos conviene entre menos puntos hagan los demã s mejor para nosotros a ganar contra sao paulo en marzo"
"2009-02-25","lopongoaca","que no se pueden parrilleros hombres en medellin apartir de manaã a"
"2009-02-25","manuelj","maldita sea establecimientos pãºblicos tienen que cerrar a la am en medellin http ur1 ca 1xcy"
"2009-02-25","medallo","i said a hip hop the hippie http tinyurl.com bq6f4u top i love d.c http tinyurl.com ase9la el pã nico http tinyurl.com dzo9gc y ahora http tinyurl.com d32l7e miss kittin amp the hacker vuelven luego de aã os con su nuevo album two http tinyurl.com cm9rtp sonar festival lineup http tinyurl.com c4qkyt una cruz en la frente http tinyurl.com b733me actualizaciã n de sepsis http tinyurl.com bz4rma mapa para gps parque arvã http tinyurl.com d7s237 soundpool http tinyurl.com astq9m el gigante incã modo http tinyurl.com avzaup memoria fotomaratã n copacabana http tinyurl.com abxtnj cooperativas de trabajo y salud http tinyurl.com cdhned en noches asã­ http tinyurl.com de4fsz thomas dybdahl http tinyurl.com brvvvp"
"2009-02-25","medeamaterial","quien en medellã­n se apunta a hacer algo asã­ vamos la cascada y conseguimos los materiales http tinyurl.com cqfm6b nã­a que venã­a tanto extranjero a medellã­n hasta me metã­ en couchsurfing hospedo gente casi dã­as al mes raigohead retweeting caracolradio roban equipos de la national geographic en medellã­n http tinyurl.com dx3pro colombia es pasiã n"
"2009-02-25","noticiascaracol","deportes santiago escobar terminã muy molesto con su medellã­n http tinyurl.com bjlssh"
"2009-02-25","raigohead","pasen a tejelo uno de los ãºltimos recodos cultura popular en medellã­n allã mã­nimo estaâ n las cã maras natgeo http snurl.com cnz4a retweeting caracolradio roban equipos de la national geographic en medellã­n http tinyurl.com dx3pro"
"2009-02-25","revistasemana","semana.com senador le pide a uribe que se repita operaciã n oriã en medellã­n http tinyurl.com asyfy5"
"2009-02-25","shir_gilvasco","me duele cada centimetro de mi cuerpo medellã­n es un caos y hace calor mmmmm quiero una coca cola con gansitoo"
"2009-02-25","sigaflamengo","08h15 medellã­n e defensor empatam ajudam o sã paulo http tinyurl.com cg5u8l terra esportes"
"2009-02-25","yahoodeportes","la prensa uruguaya alaba el juego pr xe1 ctico e inteligente de defensor sporting en medell xed n efe http tinyurl.com c5rykr el defensor sporting empata en medell xed n y se afianza la cima del grupo efe x3c p x3e http tinyurl.com agdtcc"
"2009-02-25","yassef","lfc este jueves en medellã­n y el sã bado bogotã http tinyurl.com b3evcl"
"2009-02-26","albornoz","elreticente un post sobre los dã­as que se nos avecina en medellã­n bienvenidos nuevamente a la ciudad de miedo http is.gd kxre"
"2009-02-26","alejoserrano","uh que no vaya a llover esta noche en el concierto de chente acã medellã­n"
"2009-02-26","anavallejoc","lluvia suave plic fuerte como la que esta cae en medellin pla ple"
"2009-02-26","arriendos","alquilo bodega medellin http tinyurl.com cso53k"
"2009-02-26","bnamericas","infrastructure colombia medellã­n to present us 568mn highway concession project in march colombian city med http tinyurl.com bs7qh3"
"2009-02-26","buoka","mitosurbanos en medellã­n un taxista salvã a hector lavoe de que lo matara traqueto"
"2009-02-26","cachafla","medellin considerada la mejor ciudad para vivir en el http tinyurl.com 6t28cf"
"2009-02-26","cardila","en medellin"
"2009-02-26","carolunita","hoy es el concierto de cadillacs en medellã­n me muero aquã­ nada que ponen fechas"
"2009-02-26","despegar","medellin no lo dejes pasar desde usd vuela por amã rica http www.co.despegar.com paginas alertatarifas co atco20090224083135 htm"
"2009-02-26","elreticente","hace un calor hãºmedo en medellã­n un post sobre los dã­as que se nos avecina en medellã­n bienvenidos nuevamente a la ciudad de miedo http www.juandavidescobar.com"
"2009-02-26","futbolred","medellã­n tendrã tres novedades para enfrentar a independiente santa fe se trata de luã­s carlos arias william http tinyurl.com d3add8"
"2009-02-26","ginigatuna","raigohead mitosurbanos manu chao se mantiene en medellã­n el parque del periodista jajaja genial"
"2009-02-26","informativoli","avianca anuncia novas rotas diretas ligando cali e medellin ao panamã http timesurl.at 6c64d6"
"2009-02-26","johnrestrepo","dios llueve en medellã­n para el concierto de vicente shit"
"2009-02-26","juanchulas","mamasita estas en medellin que bien d bestdelbalon ahh si el mito que dice diablo se aparecio en mangos medellin y dejo coma a una vieja"
"2009-02-26","juanmadrigal","willygil hey how was medellin vacation or business"
"2009-02-26","mariapaulal","patton vino para otros narcos salen en una revista como si hubieran venido gente empresaria de medellin"
"2009-02-26","medallo","vmware virtualizacion en dispositivos moviles http tinyurl.com bcczqd el regreso de nathan fake http tinyurl.com ccekbn garnica â cae nieve en caracas http tinyurl.com cu45va manejo de quemaduras tã rmicas con injertos http tinyurl.com bdm7mh windows urivista http tinyurl.com bmhxfr how to usar nuestras urls sin el www http tinyurl.com b4ret7 mine http tinyurl.com b8hlt6 â sorpresa http tinyurl.com cyyxpl sobre el tapete rojo de pequeã as cabezas resplandecientes http tinyurl.com boj5yw sponsored hoy inicia temporada de integraciones u en la kasa http tinyurl.com dbuqft bioquã­mico nobel richard roberts de visita en medellã­n http tinyurl.com d6ko6n el alcohol â afecta de verdad al rendimiento sexual http tinyurl.com ar442d len faki en berghain part http tinyurl.com bdjye2 alex under muscle tracks http tinyurl.com comqw8 konrad black mezcla el proximo de watergate http tinyurl.com brkp27"
"2009-02-26","plop_09","karyva la verda no creo que en medellã­n haya tal cosa yassef aa osea never mind medellin yassef arghh remal a rico que fuera en medallo un aã o de estos eso es deluxe"
"2009-02-26","raeioul","bestdelbalon abadiavernaza en medellã­n se apareciã mangoâ s"
"2009-02-26","raigohead","mitosurbanos manu chao se mantiene en medellã­n el parque del periodista"
"2009-02-26","rbolivar","de regreso a medellã­n en el vuelo la gente muy cansada en el vuelo de gente dormida medellã­n bogotã am"
"2009-02-26","sigasaopaulo","10h15 medellã­n e defensor empatam ajudam o sã paulo http www.gazetaesportiva.net nota html gazeta online"
"2009-02-27","alternativos","en marzo medellã­n serã escenario de seminario sobre arte contemporã neo â el las instalac http tinyurl.com d2jaxg"
"2009-02-27","caycedo","alguien q comparta vivencias de los cadillacs an medellã­n"
"2009-02-27","coloresmari","maã ana sã bado cafã conversado a la 1pm desde el jardã­n botã nico de medellã­n y travã s altair caigan nos van visitar sub30"
"2009-02-27","datalove","rdeseartepaz marzo medellã­n http www.colomboworld.com galeria red redeseartepaz.html"
"2009-02-27","k4ryl","maysan2 nop sã lo estrellas s dann medellin y el porton"
"2009-02-27","lometogo","walking around central medellin and discovered plazuela de san ignacio http tinyurl.com cf7mco very sweet lively"
"2009-02-27","lopongoaca","quien me puede colaborar haciendo una conexion conmutada desde ciudad diferente a medellin un reply o dm y le doy los datos gracias"
"2009-02-27","marionel","twitters paisas que hay pa hacer maã ana sã bado en medallo"
"2009-02-27","medallo","como perder tu trabajo por postear en facebook http tinyurl.com dh2gby renace como el fã nix http tinyurl.com bcr4lh febrero de http tinyurl.com awzff2 dominguero de trabajos labores y oficios en copacabana http tinyurl.com bq2qrw ni se me importa http tinyurl.com cz5hw8 warao es rey en venezuela http tinyurl.com cwjxxt hoy 3er aniversario intelligent division con dustin zahn http tinyurl.com ad5wgg quot el cliente de john grisham http tinyurl.com beqx9x quot el cliente de john grisham http tinyurl.com cthkpl publicidad alimentariaâ http tinyurl.com bwphw7 cuentas de twitter proyectos google yahoo microsoft sun http tinyurl.com dkrgmq cursos gratis de informatica en el sena virtual http tinyurl.com b4sots mp3 seph live ezoo radio http tinyurl.com cvu4fx facebook la red social favorita http tinyurl.com c8yan6 se vienen las laptops con sistema operativo http tinyurl.com cznt64 intel wimax para todo japon http tinyurl.com apfv83"
"2009-02-27","notixcommx","new blog post aclaman unas mil personas a vicente fernã ndez en medellã­n http tinyurl.com aodwcy"
"2009-02-27","radioacktiva_","estrenando el planeta rock en twitter fm bogotã medellã­n"
"2009-02-27","radiocapsula","foro interamericano cultura es desarrollo en medellin marzo inscripciones aqui http www.culturaesdesarrollo.org inscripciones.html"
"2009-02-27","realsantamarta","en marzo medellã­n serã escenario de seminario sobre arte contemporã neo â el las instalac http tinyurl.com d2jaxg"
"2009-02-27","victorarias","se va a caer el cielo en medellã­n esperemos que de aqui las ya haya caã­do"
"2009-02-27","wradiomexico","aclaman unas mil personas a vicente fernã ndez en medellã­n http tinyurl.com cqp78e"
