"date","username","tweet"
"2009-07-08","uschideaustria","juanestwiter local newspapers called antioquia the most famous region of drugs and violence medellin worldâ s capital local newspapers called antioquia the most famous region of drugs and violence medellin worldâ s capital"
"2009-07-08","vero_cs","lopongoaca es el voyeur del twitter en medellin"
"2009-07-08","yamd","jesus_hoyos how's medellin sir"
"2009-07-08","yojodo","maã ana voy a medellin solo pore tres horas pero peor es nada"
"2009-07-11","adanvecindad","antoniors cuando sales a medellã­n compa"
"2009-07-11","agnte","arrived medellã­n just passing through the city looks great"
"2009-07-11","albertopaezb","char favorabilidad cali jorge i ospina el de medellã­n alonso salazar con y bogotã samuel moreno"
"2009-07-11","andreopolis","jorge uribe en el concierto de amor por medellin http yfrog.com 5ah9ktj la en concierto amor por medellin parque explora puerto candelaria en concierto amor por medellin"
"2009-07-11","aracena","oevl ya manana salgo de bogota via venezuela medellin gt cartagena santa marta paso el borde por cucuta maracaibo coro nos vemos"
"2009-07-11","bigmancho","maldita sea yo creo que voy a estar maã ana en medallo mas temprano de lo esperado"
"2009-07-11","camilo_villa","un dia muy bonito en medellã­n me voy a jugar fãºtbol d"
"2009-07-11","caracolradio","investigan el hallazgo de dos cuerpos desmembrados en medellã­n http bit.ly absga"
"2009-07-11","coloresmari","y ya me descaeguã el calidosound de superlitio en medellã­n lo parcho"
"2009-07-11","domingoelm","johnrestrepo me complace anunciar prã ximo encuentro delm en medellin este de julio quã lugar y hora prefieren"
"2009-07-11","eltiempo","misterioso hallazgo de costales con restos humanos en barrio manrique medellã­n http tinyurl.com l4v8tk"
"2009-07-11","emergugue","johnrestrepo me complace anunciar prã ximo encuentro delm en medellin este de julio quã lugar y hora prefieren"
"2009-07-11","glr_networks","col investigan el hallazgo de dos cuerpos desmembrados en medellã­n http tinyurl.com nbqmq5"
"2009-07-11","intlswagger","is official ready to go back colombia this party sooo lovely sheesh ron medellin and chicas from cali bogota cartage"
"2009-07-11","isiporq","una vista preciosa desde medellin no hay mucha calidad pero si calidez http post.ly 1e51"
"2009-07-11","jesus_hoyos","a comer con la gente de sas aca en medellin"
"2009-07-11","johnrestrepo","me complace anunciar prã ximo encuentro delm en medellin este de julio quã lugar y hora prefieren"
"2009-07-11","juanchulas","ayer se hablo bueno con rosacris noalsilencio lopongoaca y annykita sobre medellin bogota cheveres los amigos rolos jujujuju"
"2009-07-11","lausalazar","alexidelano vuelve a medellin te queremoss d saludos k"
"2009-07-11","linal2","ojosverdess jaja es un grupo de una ciudad colombiana que se llama medellã­n estã n bien lokos"
"2009-07-11","manlio98","en medellã­n"
"2009-07-11","medallo","mp3 luciano â live on ibiza global radio july http tinyurl.com nambwf mp3 tiefschwarz â tsugi podcast july http tinyurl.com m5swsu los hipopã tamos de pablo escobar http tinyurl.com lswvbm mnf vandelklang amp joed kleem â roundtrip http tinyurl.com mxf426 estado de la blogosfera hispanohablante conferencia mariano amartino http tinyurl.com n39u2e"
"2009-07-11","medetweet","juanchulas excelente ahora vamos a hacer una reuniã n invite los demã s twitteros de medellã­n twitteros de medellã­n en campuspartyco â"
"2009-07-11","modulor","gustaborracho todo depende del aeropuerto a mi me revisan la maleta en medellã­n porque ven muy tranquilo jeje"
"2009-07-11","mpgonzalezc","gracias a todos los que participaron y me colaboraron ultmos numeros de la loteria medellin fueron ganador reclama tu premio felicidades al ganador de la rifa los ultmos numeros loteria medellin fueron pilas a reclamar su premioooooooo"
"2009-07-11","mpolo1979","linaceballos buena pintura me imagino que viste la exposiciã n de picasso en medellin"
"2009-07-11","mryancey","my bro is sitin here selin me on us startin a wholesale flower biz.yes flowrs.not the poppy but actual flowers from medellin columbia"
"2009-07-11","noticiascaracol","deportes despuã s de una mala campaã a en el pasado torneo independiente medellã­n da su primer paso e http cli.gs nsqap"
"2009-07-11","radiocapsula","actualizando los perfiles de kafeina y el blog con la informaciã n del concierto calle agosto en medallo www.kafeina.net concierto de calle en medellã­n con providencia y kafeina http www.last.fm event"
"2009-07-11","santiagovillega","julian_amaya es dificil convocar en medellã­n porque no hay tanta gente como aquã­ pero sere un evangelizador del grupo la tierrita"
"2009-07-11","swaggsmcfly","watchin cocaine cowboys yea i know i'm late but i've been pablo escobar n medellin cartel documentaries"
"2009-07-14","_alejortiz","yoconfieso que lleguã un poquitã­n rolo a medellã­n"
"2009-07-14","amaluld","en medellã­n regalan leche mmm mmmm"
"2009-07-14","anavallejoc","bein69 en medellin colombia xphree medellã­n es hora de otro flashmob"
"2009-07-14","angelamars","allyfar jejejejeje un poco no mas ah ser que las de medallo vengan cuando tu estas aca"
"2009-07-14","aracena","ayudandole con un blog a una org dedicada la primera infancia que estan en sectores mas vulnerables de medellin http bit.ly hevuc agenda en medellin twitter beer viernes delm domingo algo mas ya en medallo papa quien me ayuda a hacer un aguardiente la manana o ferias patronales del twitter badejapaiscamp"
"2009-07-14","augustoserna","de regreso a medellã­n por 1ra vez en la vida no estuve mã s 20min un aeropuerto aunque vuelo con mucha turbulencia y una durisima"
"2009-07-14","camial29","radioacktiva_ marylin manson es uno de los rockeros la efemeride mis datos camilo alzate cel cc medellin"
"2009-07-14","camilojones","aca en medellin"
"2009-07-14","camilonova","meezies people from medellin are considered to be more innovative and accepting of new technology than bogota"
"2009-07-14","caracolradio","escuche aumentan en un por ciento los homicidios medellã­n http bit.ly ulrlr escuche claudia desde medellin la solidaridad a olga no se hace esperar ella afrece c http bit.ly pmb3p"
"2009-07-14","ciudadanocomun","medellã­n constructores violan el alineamiento que tiran la linea con un caucho http bit.ly decaw"
"2009-07-14","colombianmember","radioacktiva_ pacho pa los que vivimos fuera de bogota y medellin diferentes radioacktiva_ pacho y pa los qu bogota medellin que diferentes pues"
"2009-07-14","colombiareports","medellã­n colombia historia y representaciones imaginadas http bit.ly ha1e1"
"2009-07-14","cpartynews","rtt valdezvalley:publicacion de johnrestrepo medellin presente en cparty una foto excelente la comunidad paisa visita"
"2009-07-14","cruijffjohan","defensie ontslaat yuri van gelder gelukkig kan hij nog terecht bij het medellin kartel zolang ze maar niet ontdekken dat ie ook turnt"
"2009-07-14","cualquierzungo","gondwana en medellã­n agosto ay dios me va a dar â dio un ataque de felicidad"
"2009-07-14","dahiacano12","juanestwitter te adorto mandale un saludoi a medellin extraã amos vuelve por favor ama tu tierra querida bye bb"
"2009-07-14","dariopalacio","presentaciã n de vargas lleras en medellin mega producciã web y vã­deo"
"2009-07-14","davidperez2","sã lo en dos ciudades del mundo se hacen desfiles de autos antiguos medellã­n y rionegro antioquia fuente:museo"
"2009-07-14","de_exportacion","radioacktiva_ si buenas saludos desde buenos aires para los gallos en bogota y al cara de hueva medallo jeje"
"2009-07-14","dhers","atrapado en una reuniã n mexico medellin miami y yo valencia venezuela rompiendoilusiones"
"2009-07-14","dianix_bsb","sebastianyepes wow super y cuando te pasas x medellin"
"2009-07-14","dlovatocolombia","andrevelasquezm jeje no soy de bogotã medellin me llamo diana pero si dile a todos que nos sigan en twitter hah besuus"
"2009-07-14","dniela","juanestwiter me encanta tu musica muy bonitas fotoos d soy de medellin pero vivo en espaã‘a un besaaazo"
"2009-07-14","ebotero","samuraiblanco reportando sintonia algunos inconvenientes en el viaje de pereira a medellin pero ya casa gracias por preguntar"
"2009-07-14","elespectador","productores regalan litros de leche en medellã­n genaro pã rez negã que el caso su empresa los pr http tinyurl.com mfr7yy"
"2009-07-14","elpaiscali","confirman casos mã s de contagiados por ah1n1 los nuevos se reportaron en bogotã medellã­n itaguã­ tun http tinyurl.com n7xdyt"
"2009-07-14","fanultra","buena_nota boom del emprendimiento en medellã­n http bit.ly s6ang"
"2009-07-14","german_vargas","listo para una entrevista la emisiã n de esta noche del noticiero cosmovisiã medellã­n ya lleguã a medellã­n y estoy preparando mi discurso para el gran lanzamiento hoy en hotel dann carlton"
"2009-07-14","goturismocolomb","visite medellin colombia feria de flores a partir del julio planes con todo y para todos mã s info logisticadeviajes gmail.com"
"2009-07-14","guaguau","madame_web digiste avianca tranquila llevã dã­as con una maleta casi pã rdida y quieren que la reclame ahora en medellã­n"
"2009-07-14","infolocalcomfe","medellã­n serã vitrina de la arquitectura mundial vã­a el mundo http bit.ly bt40o rama judicial no estaba lista para enfrentar bandas afirmã alcaldã­a de medellã­n vã­a el tiempo http bit.ly bt40o"
"2009-07-14","jcardenas","productores regalan litros de leche en medellã­n http bit.ly 4ypnt resiliencia capacidad para sobreponerse al golpe de una crisis uno los temas certamen en medellã­n http bit.ly 13uo4p"
"2009-07-14","jesus_hoyos","mpastrana enviane tu tel y te llamo estare llamando desde medellin"
"2009-07-14","jhonatansm","gatomimoso jajaja pana yo lo invito solo tiene q venir a medellin"
"2009-07-14","jorsuarez","el clima de medellã­n esta perfecto para cualquier actividad hoy vamos a salir y disfrutar"
"2009-07-14","josemanuelr","decaforo en creame escribele a diego.sanchez at creame.com.co y medellin global johnvalencia medellinglobal.com fanultra decaforo la gente de http www.crea me.com.co y www.medellinglobal.com hacen un buen trabajo en medellin perlatoro medellã­n serã sede de la vii bienal iberoamericana arquitectura y urbanismo en el aã o ojo modulor simbiosisgroup"
"2009-07-14","juanchulas","anavallejoc xphree medellã­n es hora de otro flashmob medellã­n es una chimbaaaaaaaaaaaaaaaaaaaaaaaaaaaaaaaaaaaaaaaaaaa juanestwiter feria de las flores julio al agosto quienes viene a medellã­n quiebnes mamasita ohhh siiii todos estan invitados a venir medellã­n en feria de flores"
"2009-07-14","jucaro1280","buenos dias desde medellin colombia me gustaria boletas para el toque"
"2009-07-14","jufevi","juliand tengo une en medellin acabo de confirmar y sigue sin abrir s"
"2009-07-14","kimmarq","estos dias medellã n tiene el mejor clima y uno metido todo dia en una oficina perritos que buscan hogar en medellã n http tinyurl.com mzy97g"
"2009-07-14","king_ade_","lmao how many ladies get da line bosnaud loso said she got that good coochie call it medellã­n raw genius i tell u"
"2009-07-14","lavila","nozuan â medallo sin mi noooooo p"
"2009-07-14","leerprensa","adn ediciã n medellin http bit.ly rdqmw"
"2009-07-14","lopaisa","medellã­n tiene aire de feria con el lanzamiento oficial la las flores y tradicionales eventos como www.lopaisa.com"
"2009-07-14","lopezquekk","el frio de bogotã y calor medellã­n obviamente me iba a enfermar que pereza"
"2009-07-14","loserkid745","thats some good jaw pop quiz score she calls her pussy medellin that raw"
"2009-07-14","lulusitah","this is my favorite picture from yesterday's visit of swiss ministry to medellã­n http www.daylife.com photo 0gixfxm7jb3bt"
"2009-07-14","malon213","radioacktiva_ hey yo quiero ir al concierto de la aquã­ en medallo me van a invitar o ke parceros"
"2009-07-14","mangostina","casi no me gustan los dã­as frios en medellã­n pero despues del calor infernal q sentã­ ayer hoy cae perfecto este dã­a"
"2009-07-14","marialeramirez","que bien lamarialeja perlatoro medellã­n serã sede de la vii bienal iberoamericana arquitectura y urbanismo en el aã o"
"2009-07-14","marialunada","abadiavernaza ole quã mã s un saludo desde medellã­n fabricadecosas me contã algo que interesa conversar con vos"
"2009-07-14","marselle","essa do soderberg me lembrou a 5âª temporada de entourage com o fracasso filme vince medellin"
"2009-07-14","mdeliimon","no puedo creer que se arme lã­o x la reparticiã n de mil litros leche en medellã­n"
"2009-07-14","medallo","dã­a del orgullo sgae http tinyurl.com msafuw youtube dejarã de soportar ie6 http tinyurl.com kwfzrp top cã mo nos gastã bamos varias cajas enteras de fã sforos al jugar http tinyurl.com l3tf7u dewalta â vakant live july http tinyurl.com mcjj4t http tinyurl.com m995bh este sã bado deetron amp samuel l session en medellã­n http tinyurl.com n5rwku este domingo en munich greenfields outdoors verano http tinyurl.com klmsqk tresor history short documentary berlin http tinyurl.com l5ym2m â por el derecho a no decir nada http tinyurl.com mupq7r microsoft prepara office online http tinyurl.com ntysqu el codigo de lawrence lessig en espaã ol http tinyurl.com nag4b9 simposio informã tica en salud universidad de antioquia medellã­n http tinyurl.com ksqhom"
"2009-07-14","meezies","people from medellin are considered to be more innovative and accepting of new technology than bogota"
"2009-07-14","modulor","steffigoes eso se nota he estado en medellin y visto el cariã o que le tienen allã algarcia a ver me parece un buen artista juanes y respeto muchã­simo la labor que ha hecho en medellã­n parque de paz por ej josemanuelr que bien medellin es una ciudad muy apropiada para bienal de arquitectura"
"2009-07-14","moniechavarria","disfrutando el dã­a mã s caliente del aã o en medellã­n y la visita de varios familiares amigos que estã n fascinados con esta bella ciudad"
"2009-07-14","nc_zorro","medallo de agosto"
"2009-07-14","noticiascaracol","regalan litros de leche en barrios pobres medellã­n una las mã s importantes empresas lã cteos del http cli.gs 64vqz deportes cali se entrena con la mente puesta en el medellã­n tras empate ante envigado eq http cli.gs zamen"
"2009-07-14","noticiasdot","new blog post medellã­n prepara la inauguraciã n de colombia moda http bit.ly 1arzq"
"2009-07-14","nozuan","mientras sigo en la cama con maluquera planeo viaje pa medallo jseros y a venezuela julian_amaya alguien mã s"
"2009-07-14","omargomez","para los calores que estan haciendo en medallo guykawasaki how to stay cool in bed on a hot night http om.ly qpy"
"2009-07-14","p_brady","not exhilarating medellin photos to wade through today"
"2009-07-14","paulina44","fighter_hals ahã­ si pailas yo ando sin plata como pa salir a medellã­n fighter_hals en medellã­n ni idea depronto info de algo bello pero"
"2009-07-14","perlatoro","medellã­n sede de la vii bienal iberoamericana arquitectura y turismo mayor informaciã n www.culturaemedellin.gov.co biau2010 medellã­n serã sede de la vii bienal iberoamericana arquitectura y urbanismo en el aã o"
"2009-07-14","piris","comiendo turron risaraldense comprado en medellin"
"2009-07-14","portafolioco","resiliencia capacidad para sobreponerse al golpe de una crisis uno los temas certamen en medellã­n http tinyurl.com mr2qdf"
"2009-07-14","pressrelated","press release bancolombia s.a announces unconsolidated results for the month of june medellin colombi http bit.ly bjjmc"
"2009-07-14","radioacktiva_","bueno aquã­ estamos en el estudio de bogotã doble u diego y cristiano cardona medellã­n la hueva santiago aprendiendo twitter"
"2009-07-14","radiosantafentc","en medellã­n regalan leche a gente humilde de la comuna productores antioqueã os repartieron mil l http tinyurl.com nwxgmc"
"2009-07-14","raigohead","pedro_carreno mucho loco este man por allã en la sabana saludos desde tropical medellã­n cã mo van tus cosas y ajã el trabajo de dama compaã ã­a tipo geisha en medellã­n es bien fuerte si no miren esto lo hacen pãºblicamente http twurl.nl q34kud"
"2009-07-14","rosacris","antoniors estoy en medellin haciendo nada quiero hacer algo jajaja"
"2009-07-14","rubilina","â quã lindo dã­a en medellã­n de todo mi gusto"
"2009-07-14","sabrina0427_","dontetto negros ojala les deje d llover y sea todo un exito la presentacion ak desde medallo mejor las suertes"
"2009-07-14","siempredepaseo","somos una empresa dedicada al alquiler de fincas cabaã as y hoteles en medellin colombia url http www.siempredepaseo.com tel"
"2009-07-14","silvanamtt","www.myspace.com elsinsentidomedellin lt myspace del street team el sin sentido medellin"
"2009-07-14","soreygarcia","rubilina â quã lindo dã­a en medellã­n de todo mi gusto"
"2009-07-14","tettay","perlatoro medellã­n serã sede de la vii bienal iberoamericana arquitectura y urbanismo en el aã o"
"2009-07-14","tienenhuevo","que bandera jejej juanchulas medellã­n es una chimbaaaaaaaaaaaaaaaaaaaaaaaaaaaaaaaaaaaaaaaaaaa juanestwiter"
"2009-07-14","trafico889","a vuelta de rueda viaducto entre eje central hasta medellin buen avance en medellin entre insurgentes hasta eje sur"
"2009-07-14","ubuntutweets","ingforigua sisas por ahi cierto puberto de medellin necesitaba el serial pa instalar ubuntu p http tinyurl.com nneqc7"
"2009-07-14","valdezvalley","publicaciã n de johnrestrepo medellã­n presente en campus party una foto excelente la comunidad paisa visita bogotã"
"2009-07-14","vero_cs","allyfar jejeje cuando vengas a medellin o yo vaya barranquilla vamos"
"2009-07-14","vuelosplus","vuelo medellin colombia mde a sao paulo brasil del al 471â aceptable http tinyurl.com nemlaf vuelo madrid espana mad a medellin colombia mde del al 868â aceptable http tinyurl.com nkbuh4 vuelo medellin colombia mde a pasto pso del al 364â barato http tinyurl.com lkka8q vuelo medellin colombia mde a sao paulo brasil del al 471â aceptable http tinyurl.com nemlaf"
"2009-07-17","aracena","perdon a lo twitteros se me fue el yoyo voy al parque del poblado medellin colombia tweet waro"
"2009-07-17","caracolradio","escuche hospitalizado en medellã­n el ex futbolista renã higuita http bit.ly lszut"
"2009-07-17","carobotero","catirestrepo de hiperbarrio nominada como mujer talento en medellin felicidades http www.otexto.net p"
"2009-07-17","cibezane","ex goleiro da seleã ã o colombiana de futebol higuita foi internado em um hospital medellã­n com fortes dores cabeã a"
"2009-07-17","colombiasoccer","colombia soccer independiente medellin deportivo cali http bit.ly 19smv6"
"2009-07-17","debuenafuente","no por favor mã s pepe el hipopã tamo en medellã­n mataron a un niã o entrando al colegio y pocos publicaron algo pesã"
"2009-07-17","elkinvar","linaceballos entren ya en vivo desde medellã­n colombia puntolink gt http ustre.am 4bv0 programa muy interesante"
"2009-07-17","eltiempo","el arquero renã higuita se encuentra hospitalizado en medellã­n http bit.ly vlkgg"
"2009-07-17","jcardenas","gas vehicular le genera pã rdidas a epm concejo de medellã­n solicitã intervenciã n organismos control http bit.ly pecmo"
"2009-07-17","josue8atorres","nuevamente en medellin after que elegancia parce"
"2009-07-17","kikearlia","medellin segun una cajera de exito hablamos sexy uh http mypict.me bajn"
"2009-07-17","linaceballos","entren ya en vivo desde medellã­n colombia puntolink gt http ustre.am 4bv0 programa muy interesante"
"2009-07-17","medallo","cosmos pã gina http bit.ly qvhsj cannabis para el uso industrial no todo es fumar http bit.ly 277h8 el blog antes del blogger http bit.ly der2q barraca music podcast los updates live at http bit.ly ifs2s"
"2009-07-17","omarpa","aun en reunion con mis nuevos clientes medallo proximamente"
"2009-07-17","portafolioco","gas vehicular le genera pã rdidas a epm concejo de medellã­n solicitã intervenciã n organismos control http bit.ly qjbkn"
"2009-07-17","ranchomateo","good times in medellin colombia fiesta chicago gran cupula celebrates colombian cultur http bit.ly 70vuz"
"2009-07-17","revistasemana","semana.com higuita recluido en hospital de medellã­n renã uno los grandes del balompiã col http bit.ly j9mf2"
"2009-07-17","senalcolombia","culturama regional medellã­n http a.gd 7662e2"
"2009-07-17","trafico889","a vuelta de rueda en viaducto partir medellin hasta tlalpan"
"2009-07-17","ultraleetj","is going out for dinner with his cousins family las palmitas awesome restaurant at the heart of medellã­n"
"2009-07-17","vuelosplus","vuelo medellin colombia mde a san andres island adz del al 269â baja un http tinyurl.com m86d3l vuelo panama city pty a medellin colombia mde del al 372â baja un http tinyurl.com lsht64"
"2009-07-18","adri_lu","tengi ganas de viajar a medellin"
"2009-07-18","agenciapinocho","los disgustos de una flaquita en medellã­n no encuentra brasier su talla http agenciapinocho.blogspot.com la reportera debuta"
"2009-07-18","andyvital02","concierto de the ataris en medellin wohoo"
"2009-07-18","angelcondatos","http bit.ly 4elkmd colombia vendettas del narcotrã fico disparan homicidios en medellã­n violenciamed medellã­n la historia se repite con otros matices al final el resultado serã mismo una generaciã n muerta a bala http bit.ly wj7pq estrenando libros descubri una promociã n ediciã de bolsillo por en comlibros medellã­n cra"
"2009-07-18","arepavalley","antoniors delm medellin ediciã n http bit.ly oxh6o"
"2009-07-18","atanquez","cristy rios hoy en medellin el lunes desde cuqalquier lugar del mundo la otra semana ves bogotã http bit.ly ujvdc"
"2009-07-18","bravadoliving","be like vinny chase and fly to medellin colombia for less than http tinyurl.com ko23ua"
"2009-07-18","buticut","steffigoes cuando yo estoy pensando en ti lala me voy para medellin y si bogotaaa que bogota q na cubaaa"
"2009-07-18","camiloescobar","johnrestrepo domingoelm medellã­n va por su cuarto delm http domingoenlamanana.com"
"2009-07-18","carloscaliche2","laneros pero no en medallo lancafe"
"2009-07-18","cholotv","independiente medellã­n vs amã rica de cali en vivo julio http bit.ly txboq"
"2009-07-18","ciudadenlinea","medellin estampados dany ha sido registrado en el mapa http www.ciudadenlinea.net sitio"
"2009-07-18","clointimo","another beautiful spring day in medellin colorful birds chirping ladies selling big avocados arepas and empanadas on the street"
"2009-07-18","cronopiazul","serã que mi tã cnico se demorarã mucho trayendo de medellã­n al petit noire"
"2009-07-18","datalove","medellin caliente vino asado parche"
"2009-07-18","debuenafuente","el senador jorge enrique vã lez quiere ser alcalde de medellã­n y ha enfilado sus baterã­as en contra los concejales alonsistas"
"2009-07-18","dejesumensaje","miss_anfetamina jajajaja si eso decã­s vos estando en medellã­n imagã­nate yo que ando apartadã quã calor tan hp u_u"
"2009-07-18","djfreshnyc","http twitpic.com aqruz medellin colombiaaaaaaaa"
"2009-07-18","domingoelm","maã ana medellã­n va por su cuarto delm http domingoenlamanana.com"
"2009-07-18","donpe","johnrestrepo sã­ the ataris en medellin quien va a ir bogotã"
"2009-07-18","eberhardine","juanestwiter hoy oia por la radio un reportaje sobre medellin y el fundador del programa de voz los secuestros.impresionaba mucho"
"2009-07-18","ebotero","transmitiendo desde la via las palmas medellin rumbo a el carmen de viboral probando conexion internet movil comcel funciona bien"
"2009-07-18","ebriceno","juanggallego domingoelm maã ana medellã­n va por su cuarto delm http domingoenlamanana.com"
"2009-07-18","elizyarcos","con ganas de descansar todo el puente y en medellã­n"
"2009-07-18","emergugue","me pego los viajes a conciertos en bogotã y de acã medellã­n no voy bravo â _â johnrestrepo domingoelm maã ana medellã­n va por su cuarto delm http domingoenlamanana.com"
"2009-07-18","eritis","que calor en medellin"
"2009-07-18","femibasquet","sud clubes perdiã c entrerriano y quedã 4âº bronce univ de medellã­n http www.fibalivestats.com matches 93tvxxtg6l85g"
"2009-07-18","freddier","medellã­n no olviden que maã ana hay delm http domingoenlamanana.com"
"2009-07-18","gacelacardona","que cantidad de gallinitas entrevistamos hoy en bogotã y medellã­n"
"2009-07-18","i_lyde","im working on my new mixtape its been 3yrs since the last one so get ready called medellã­n cartel it will be out soon"
"2009-07-18","iamyeye","abelpv nadie a hablado conmigoo no tengo brief estoy en medallo y deprimida fuck"
"2009-07-18","j_succar","que rico medellin bueno es estar otra vez en tierra caliente"
"2009-07-18","johnrestrepo","geosdigital cuã ndo venã­s a medellã­n emergugue the ataris en medellã­n domingoelm maã ana medellã­n va por su cuarto delm http domingoenlamanana.com domingoelm medellã­n va por su cuarto delm http domingoenlamanana.com"
"2009-07-18","juanggallego","domingoelm maã ana medellã­n va por su cuarto delm http domingoenlamanana.com"
"2009-07-18","juliand","antoniors delm medellin ediciã n http bit.ly oxh6o"
"2009-07-18","lausalazar","rhawtin medellã­n is waiting u"
"2009-07-18","maitte","domingoelm medellã­n va por su cuarto delm http domingoenlamanana.com"
"2009-07-18","medallo","richie hawtin amp dubfire essential mix http bit.ly 179klh jon gaiser live at dâ edge sao paulo http bit.ly vipqn visita a la casa de abuela http bit.ly tctgs click2tray servicio para probar aplicaciones libres en lã­nea http bit.ly 9xu0c the ataris http bit.ly seu8 elecciones http bit.ly we53f links for del.icio.us http bit.ly emo4f noticia que no sabiamos deetron amp samuel l session http bit.ly 2fypk si de repente http bit.ly crzmd"
