"date","username","tweet"
"2009-07-30","sebasyepesbgta","deseandole mucha suerte a sebas en medellin sebastianyepes incomodo que nos roben las ideas por decirlo asi un beso gigante y mucha suerte medellin"
"2009-07-30","serchc","juankmilodorado oiga sebas se va el martes para medallo tonces de pronto nos tomamos algo sabado"
"2009-07-30","shir_gilvasco","medellã­n esta que arde calor se sufre de"
"2009-07-30","skf115","http twitpic.com c645o heading up to san pedro valley view looking north out of medellin early today"
"2009-07-30","sonilink","hay como quisiera irme a la feria de las flores y conocer medellã­n"
"2009-07-30","soytatabetancur","radioacktiva_ y en medellã­n tambiã n es banda sorpresa"
"2009-07-30","soyunisex","xphree melissa tejada igual de medellin"
"2009-07-30","stephyrua","iii encuentro nacional de comunicadores y periodistas serã el agosto medellã­n colombia ver mã s gt http bit.ly 38czwm"
"2009-07-30","telemedellin","betu_asaber medellã­n y se viene la feria telemedellin medellin jul telemedellã­n la candelaria el sector con mã s homicidios http bit.ly eskjz medellin jul telemedellã­n la candelaria el sector con mã s homicidios http bit.ly eskjz medellã­n jul telemedellã­n maã ana prohibido circular por itagã ã­ http bit.ly 17lqu8"
"2009-07-30","terracolombia","playa cuerpos y agua benditos vistos en medellã­n galerã­a de fotos http bit.ly 4u6h0l"
"2009-07-30","themillsband","confirmado gira jack daniels con the mills en medellã­n coming soon amigos de pronto mã s detalles"
"2009-07-30","trafico889","buen avance sobre medellin entre insurgentes y el eje sur"
"2009-07-30","vercolombia","i'm getting over the gripa flu but just in time for feria de las flores flower festival medellin good times to come"
"2009-07-30","viejosaulo","by empleatecotodas asesor comercial empresa comerci medellin rionegro colombia http bit.ly 30vwdv empleo"
"2009-07-30","vuelosdesdemad","vuelo madrid espana mad a medellin colombia mde del al 625eur baja un http tinyurl.com nnb9pq"
"2009-07-30","where21084","jacevedop not so fun acevedo con cara de envidia ya van aã os que no me doy la vuelta por medallo"
