"date","username","tweet"
"2010-06-29","carocarito2","mrfrank1 carocarito2 trebolclan1 gracias amor igual te queremos medellin nos hace mucha falta bendiciones de parte d trebol clan.muaa"
"2010-06-29","caromejia","jaimevalderrama apoderate de un escenario en medellin seriamos tan felices ddd hace mucho que no vienen desde enero d"
"2010-06-29","coletivocuia","augustonunes julho ã porradaria nessa caralha.tem underflow com rdp e 60sa na seletiva pro medellin porra roda de polgo o que hã"
"2010-06-29","copdeb","maurodbd le hice una pequeã a adaptaciã n tu tweet para que se acomodara al contexto universitario de medellã­n p"
"2010-06-29","crislon79","vivianasanti en cambio medellin hace calor tarde soleada"
"2010-06-29","damntatis","estarã en medellã­n y no podrã estar el concierto de zoetheband seguirã cuando se presenten rock al parque fail"
"2010-06-29","daniela_cortez","entrevistandrea holaaa te esperamos en medellin el club lamagiadeannie queremos carocruzosorio aaaa que bn ya estas en twitter saludos desde medellin"
"2010-06-29","danielasierravo","oficialmente la chica mã s elevada de medellã­n fb"
"2010-06-29","danielup","el cafã espresso en bogotã sabe tres veces mã s rico que medallo fact si vos sos de medellã­n y estã s en cpbogota utilizã tambiã n el hashtag medellinencpartyco"
"2010-06-29","defyuri","jjafroreggae de medellin se quiser o contato grita forte abraã e sucesso jjafroreggae mir coar movimento independente revolãºcionã rio comandos armados de medellin fazem um trabalho bem legal tudo apã s jjafroreggae tã em medellin se sim vale procurar o corpades um dos fundadores luiz fernando ã oriundo do mir coar"
"2010-06-29","diegofrancop","en medellin la ciudad de eterna primavera http myloc.me 8bulz"
"2010-06-29","doricoromeo","john y eduardo en medellin bendiciones ã xitos mis amigos"
"2010-06-29","economiacomco","soldados se visten de bicentenario recorriendo las calles medellã­n http goo.gl fb ejajt"
"2010-06-29","egamers","asã­ se viviã la liga interactiva postobon en medellã­n â ahora vamos a barranquilla http bit.ly bvdmfz"
"2010-06-29","eldontavo","medellincultura empezã el congresocultura en medellã­n y acã estamos trabajando quã gran evento telemedellin en medellã­n no los olvidamos bogotã se vive la fiesta nacional digital durante campus party http bit.ly d9t6s7 danielup si vos sos de medellã­n y estã s en cpbogota utilizã tambiã n el hashtag medellinencpartyco"
"2010-06-29","elempeliculado","sentado en el jardin botanico de medellin respirando"
"2010-06-29","elgeektor","angelita_marin igual que medellin sin mi tu dime jajajaja"
"2010-06-29","elroleins","mi espã­ritu hippie y fogatero adolescente se siente triste porque silvio rodrã­guez va a tocar en medellã­n no puedo verlo yoconfieso"
"2010-06-29","erikamabet","carocruzosorio bienvenida a twitter vas ver que la pasar muy bien saludos desde medellã­n para andre y ti bendiciones juanes te ves muy lindo en el corto dl video.hoy saliã rcn.sigue disfrutando d medellã­n eso oxigena tu ser y esa esencia q da ã xito"
"2010-06-29","estebanpalacio","scheiãÿe ich habe meine sprach vergessen mã ss ganz viel arbeite danke deutsche schule medellin"
"2010-06-29","etyomilleomar","laurisrestrepo hoy hablaron alla mi amor ya se comenzo todito con el favor d diosito pronto en medallo muaaah grax baby love u jesy_kita milenagiraldo leidyloza laurisrestrepo medallo donde estan mis sexysolteraas"
"2010-06-29","f3lixthecat1984","que hpta semana se viene para medellin y uno sin dinero asistir a todos los eventos pero vamos ver como hago fb"
"2010-06-29","fabvila","santana hall sao paulo brasil auditoria adida medellã­n colombia si estan en algunas de esas ciudades gosenlo"
"2010-06-29","factorgroup","con exito culminã nuestra participaciã n en la v feria de servicios empresariales organizada por anif medellã­n"
"2010-06-29","fonsecamonica","jhpelaez hasta el domingo pero viernes en medallo nada que coincidimos no me llamaron buabuabua mujeres w si jejjeje"
"2010-06-29","hastaabajocol","rk728hasrd hey mi pana saludos reportandome desde la ciudad de eterna primavera medellin colombia"
"2010-06-29","hernandgr","sttmed movilidadmedellin el metro de medellã­n solo esta prestando servicio para sur hacia norte tiene problemas mecã nicos"
"2010-06-29","horadelregreso","maã ana con jhpelaez sylvanagomez y amaluld en medallo ahi nos vemos"
"2010-06-29","intriago_cesar_","bueno serã irnos pa medallo papa"
"2010-06-29","isabelsalazarj","amaluld yo quiero a medellin piensenme mucho"
"2010-06-29","iwozik","i've just have lost two hours trying to find cheaper airfare columbia my gut tells that the idea of new year in medellin wasn't so good"
"2010-06-29","jardincosmico","si te gusta la astrobiologã­a mã ndame un directo invitarã a algo muy interesante en medellã­n"
"2010-06-29","jbuscalia","rafaeldme tu usuario es porq sos de medellin http myloc.me 8bsbe"
"2010-06-29","jennympwecuador","vaya promocion dolres para ir medellin colombia o eso si ke es gangaa"
"2010-06-29","jessii_9009","aqui jejeje muaa etyomilleomar jesy_kita milenagiraldo leidyloza laurisrestrepo medallo donde estan mis sexysolteraas"
"2010-06-29","jjafroreggae","meu novos amigos de medellin http tweetphoto.com beto e eve em medellin ja na correria das gravaã ãµes rolou um buraco vms ver algumas coisas cidade http tweetphoto.com"
"2010-06-29","john_mixgaleano","jbalvin http twitpic.com 211u0m q bien pero en medellin hay un club veces mas garnde y no solo de mujeres respetan kieren a b http tweetphoto.com jowell1 bien jowell bendiciones yelsid gran esponente colombiano diractamente desde medellin co"
"2010-06-29","jorgepedro","rico el helado de nata los cubanos del mercado medellã­n"
"2010-06-29","jpablonio","fncisco interesante todo lo de modding muy buena la conferencia campusero medellã­n"
"2010-06-29","jrinconh","bluelephant ojalã sean dã lares de los que hacen en medellã­n"
"2010-06-29","juanchulas","stiverp danielup si vos sos de medellã­n y estã s en cpbogota utilizã tambiã n el hashtag medellinencpartyco"
"2010-06-29","juansolor","bueno ahora les contarã el resto de la tardiada en medallo medellã­n siempre me ha gustado gusta y gustarã el clima la gente emprendedora energia del todo se puede ahora estamos en la calle del diseã o medellã­n serã que nos tomamos algo solo para facilitar el shoping"
"2010-06-29","julianaa_x3","sara spainiards are like the people from medellin they think they're shit lmfao ok wtf she's stupid"
"2010-06-29","julianagaleanoo","nicolasmayorca y despues una por medellin ingratooo"
"2010-06-29","krolinithap","medellin colombia and can not speak your language very well traducir.casi my whole"
"2010-06-29","la_geoloca","que sueã o tan berraco eso me pasa por trasnochar y madrugar en medellã­n"
"2010-06-29","lamegamedellin","wepaaaaaa la mega medellin al aire ya llega el megafono"
"2010-06-29","lamelli_131","mandame saludos sandra medellin y de mi parte atu hija ninelconde live on http twitcam.com 10xpr colombia medellin ninelconde live on http twitcam.com 10xpr hola me llamo sandra y soy de medellin por fa dime podemos ser amigas mandame un abraso ninelconde live on http twitcam.com 10xpr"
"2010-06-29","larubiatuitea","victor_ibanez uuummm entonces medellã­n estã mã s o menos bien pero podrã­a estar super jjejeje"
"2010-06-29","legardal","con ganitas de ir a medallo el puente ojalã q si"
"2010-06-29","leidyloperah","noelschajris noelll y porque no viniste a medellin es justo"
"2010-06-29","leslyvalbuenac","feliz porque me voy a medellin al concierto de silvio"
"2010-06-29","linis_gonzalez","randynotaloca randy cali y medellin te esperan para acompaã arte en tu cumpleaã os lindo dia en la ciudad de medellin"
"2010-06-29","lopongoaca","juemaquina_ jajaj guevon y yo te mando quesitos de medellin vos no hace nada hablas mucho p"
"2010-06-29","losmanires","kicobautista asi podras comparar lo que dices en nueva york y medellin te da envidia la seguridad aqui vzla no hay"
"2010-06-29","luz_ines","en medellin parece q han cambiado algunas normas d trã nsito los lentos y las motos van x el carril de la izq uno adelanta por der fb"
"2010-06-29","macovhana","saludos a todos los musicos que participarã n en el congreso medellin para eka migue y toda la banda"
"2010-06-29","malalita_","noelschajris por quã no te das una pasadita medellã­n"
"2010-06-29","mambru72","imajino q en agosto betancur__e mambru72 y cuando vienes a hacer visita aqui medellin colombia"
"2010-06-29","mandrackprod","promoã ãƒo oficial par de ing.na faixa medellin no rancho guarulhos http bit.ly ab3gmp"
"2010-06-29","marce_alzate28","maximelainc saludooos maxii medallo presenteee"
"2010-06-29","mauromosquera","congreso de cultura en medellã­n para los que no se van puente fitopaez no dejã transmitir su prã ximo concierto en medellã­n seremos una ciudad de pobres corazones"
"2010-06-29","maximanpr","marcelacangri maximelainc saludooos maxii medallo presenteee colombia mano arriba"
"2010-06-29","melithemermaid","maã ana a medellin por fin lo maluco es q me toca hacer un informe de libro"
"2010-06-29","mrfrankofficial","carocarito2 trebolclan1 gracias amor igual te queremos medellin nos hace mucha falta bendiciones de parte trebol clan"
"2010-06-29","mxchristian","medellã­n llegando y corriendo a junta de revisiã n pendientes con el equipo sap"
"2010-06-29","naranjalia","mardazul mardita vives en medellã­n como decã­a nuestro profesor la parroquia"
"2010-06-29","nforonda","medellincultura empezã el congresocultura en medellã­n y acã estamos trabajando quã gran evento"
"2010-06-29","norelys_oficial","paospain mjaramillolujan hola pao como estã n los preparativos de wild on medellã­n"
"2010-06-29","paoespanapress","preparando el plan de medios reykon_el_lider llega miss canada a colombia e entertainment se toma medellin feliz"
"2010-06-29","pelucavieja","nanda_ en realidad chupar piã a es un eufemismo afectado medellã­n jalã bamos trompa"
"2010-06-29","pepelobo78","no hay que inventar otros paã­ses han pasado por estoâ vean la conferencia de sergio fajardo ex alcalde medellã­n colombia arnemx no hay que inventarle mucho ya lo hizo fajardo en medellã­n el problema la clave estã una autoridad local fuerte"
"2010-06-29","perlatoro","necesito a alguien que pueda tabular unas encuestas y digitarlas si tienen info por dm en medellã­n gracias"
"2010-06-29","radiosantafentc","capturan dos hombres con material explosivo en medellã­n las ãºltimas horas la policã­a metropolitana del valle http bit.ly c5szxr"
"2010-06-29","radiotiempo1059","los personajes mã s influyentes en el mundo â quiã nes son opina ya radio tiempo medellã­n"
"2010-06-29","rake0606","yoconfieso q por venirme a vnzla dejã proyectos sin concluir y puede ser nadie me vuelva qrer en medellã­n pero creo valiã la pena"
"2010-06-29","rent_paula","augustonunes julho ã porradaria nessa caralha.tem underflow com rdp e 60sa na seletiva pro medellin porra roda de polgo o que hã"
"2010-06-29","revistanumero","xx festival internacional de poesã­a medellã­n http bit.ly 975pct"
"2010-06-29","rochio_lophdz","en tlaxcala cierre de campaã a medellin candidato prd la presidencia comunidad ocotlan"
"2010-06-29","roodie_manaus","augustonunes julho ã porradaria nessa caralha.tem underflow com rdp e 60sa na seletiva pro medellin porra roda de polgo o que hã"
"2010-06-29","sarisacosta","club de fans jbalvin en medellin http twitpic.com 2122tb"
"2010-06-29","savemejebus_","silvio en medellin si seã or los milagros existen este jueves me esperan casiopea"
"2010-06-29","simon_posada","hyperconectado mazanti o masanti el que hizo la biblioteca rey de espaã a en medellã­n"
"2010-06-29","sofiagalvez","entrevistandrea carocruzosorio que bien cari bienvenda a este mundo no te arrepentiras muchos besitos desde medellin andre gracias entrevistandrea que esta presiosa k felicidades por su matri y cuando nos visita en medellin haaa a ti eres hermosa gracias"
"2010-06-29","sttmed","movilidadmedellin el metro de medellã­n solo esta prestando servicio para sur hacia norte tiene problemas mecã nicos"
"2010-06-29","takumi_ma","tranversal barrio cordoba medellin quien sabe como llegar"
"2010-06-29","telemedellin","en medellã­n no los olvidamos bogotã se vive la fiesta nacional digital durante campus party http bit.ly d9t6s7 medellinencpartyco"
"2010-06-29","trebolclanof","mrfrank1 carocarito2 trebolclan1 gracias amor igual te queremos medellin nos hace mucha falta bendiciones de parte trebol clan"
"2010-06-29","udsnoexisten","rivas_santiago negrito buscarã con mi dealer de libros a ver quã me bota voy empezar hacer la vuelta o andrã s rã­os en medellã­n"
"2010-06-29","unicehap","agencia de noticias dinã micas cotidianas vitales en sistema metrocable medellã­n http bit.ly 9j0asp via addthis"
"2010-06-29","vale1030","lamegamedellin jaz me pones por fa kiss and tell de justin bieber favor y una saludito a todas las belibers medellin"
"2010-06-29","valenrpo","pendiolo medellin"
"2010-06-29","velezvero","mi papã otra vez en medellã­n yo porquã no pataleta"
"2010-06-29","verdediverso","mientras no haya libertad sexual nunca se podara hablar de polã tica marcha lgbtih medellin"
"2010-06-29","vetetoto","oiga y ni un saludito pa lala_cs toda una ternurita con el parche de medallo"
"2010-06-29","victorgmz","zoetheband aca en medellin todas las de memorex y reptilectric"
"2010-06-29","warioverdosis","mc_hc qe paso papa activao desde medallo"
"2010-06-29","yairaarroyave","este puente para medellã­n yupii que se me quite rã pido esta gripaaaa"
