"date","username","tweet"
"2014-08-03","_fabiomateus_","lo que se tragã el medellã­n"
"2014-08-03","_victor_daniel","lo que se ha comido el medellin estã noche"
"2014-08-03","akolatronicorla","sunset at the mahalo atardecer en medellin colombia con mis parceros juliotattooartistâ http rq2i2tg2rd"
"2014-08-03","andreorrego1205","gracias a medellin_travel elteatrico la obra sãºper buena"
"2014-08-03","carlopezortiz","flores pa mi once caldas va ganando en medellã­n"
"2014-08-03","carlosbarrioss_","medellin once caldas ðÿ ž"
"2014-08-03","daniguisaov","comeria mil perros sen un dia solo para escuchar eres mã­a http akso3pfpou medellã­n romeosantosencolombia sonymusiccol"
"2014-08-03","dczapata2","esos del medellin se han comido como cecemil goles"
"2014-08-03","diegon_10","no critiquen a fernando torres si han visto la delantera del medellin"
"2014-08-03","fckrvenezuela","anoche kr kevin roldan en luxury medellin http kszesnkvp0"
"2014-08-03","geydentm","a travã s del cielo medellin colombia adventurepeople allshots_ bestoftheday moonnigthâ http n9ljilnfcg"
"2014-08-03","hugogallardosg","localizan bolsas con restos humanos en medellã­n de bravo ver http 97puv3q0gq"
"2014-08-03","isa_gual","medellin http pr0gjelydg"
"2014-08-03","ivanchofr","que entre marino garcã­a deberã­a ser bueno para medellã­n"
"2014-08-03","juankayala97","medellã­n merece un gol hace rato fpc"
"2014-08-03","kvillalbac","medellã­n once caldas partidazo creo que es uno de los mejores partidos he visto en ãºltimos aã os del fãºtbol colombiano"
"2014-08-03","maulo2011","no lo define medallo"
"2014-08-03","maurojose1987","robar todas las flores de la ferias y regalartelas eso si es amor medellin"
"2014-08-03","mcamilaves","que asquito de partido el del medellin"
"2014-08-03","rodrigolacal","independiente medellin estã fallando todo se escuchan silbidos en el estadio"
"2014-08-06","_tebanbedoya","trancon el medellin hpta me isieron bulin"
"2014-08-06","alcaldiademed","tutotuto2009 hola augusto medellã­n una ciudad para todos http a47ozgesly hacemos parte de la transformaciã n"
"2014-08-06","amanghuban4","medellin_lin jomblo berkwalitas tu cirinya bahagia coba follow humorbanjar dijamin tetap tapi kawa eaa d"
"2014-08-06","caticasanchez","andando por bogotã me doy cuenta de que no tengo ni idea cuando es el cumpleaã os medellã­n"
"2014-08-06","colonossantafe","agucdmx daogobmx 072avialcdmx urge desazolve d coladera n calle r medellã­n esq a nã poles gã ndara olor terrible http hcfwm8mrbq"
"2014-08-06","cristiandeadend","medellin me espera en dã­as a los que odian ya pueden apuã alar por allã"
"2014-08-06","diegojguzmanu","enmicolombia medellã­nemociona medellin feriadelasflores plaza mayor medellã­n http 9fdtcsdled enmicolombia feriadelasflores medellin medellã­nemociona plaza mayor medellã­n http 4ruqagapum"
"2014-08-06","donoscarrj","hoy en medellã­n concierto de romeo si el que canta como julieta"
"2014-08-06","elcolombiano","este ford tambiã n desfilarã maã ana por las calles de medellã­n feriadelasflores http sox9qfg6dq"
"2014-08-06","hagalau","el color de la mãºsica es medellã­n blues festival http eg1yaomavs vã­a hagalau"
"2014-08-06","historyla","juandavidrive12 hola juan llegan los hotrods a medellã­n no te pierdas el desfiletopgear maã ana partir de las 10am"
"2014-08-06","johana_avella","desearã­a tanto estar en medellin theking"
"2014-08-06","laurafanscamila","camilamx y si le mandan un beso a esta camilera de medellã­n"
"2014-08-06","lemurianoqf77","gaymedellin parque de las luces en medellã­n colombia â quã tal les parece el lugar http vn6yxscmwc hermoso pronto volverã"
"2014-08-06","mariae22","primera estaciã n de una noche reparadora amigos at grupovideobase in medellã­n antioquia ax1e8itnhy"
"2014-08-06","orgullolgbt","gaymedellin jhoncitoarango cual es ahora el mejor sitio publico para encontrar gente lgbt en medellã­n"
"2014-08-06","possosan","feliz miercoles selfiel man medellin sexy night http nmjg3csmmo"
"2014-08-06","sebastianesp","ðÿ’ªðÿ’ª bodytech bodyfitropadep in medellã­n antioquia w others vmx76ya4wz"
"2014-08-06","stephanny1997","para medellin se dijo"
"2014-08-09","_msxdefying","laura_afc_ against medellin right lol my stream isn't working i'll watch the next game santa fe play"
"2014-08-09","1253cesar","ya en medallo para ver al mas grande"
"2014-08-09","1396marin","noche de locos en medellin feliz y loca sabado salerosa19 ðÿ http jbq9peppjj"
"2014-08-09","aldy10sabalza","santa fe medellin en juego"
"2014-08-09","anesma","flores para silletas feriadelasflores medellã­nemociona medellã­n vereda el placer santa elena http go7ko5ki3v flores para silletas feriadelasflores medellã­nemociona medellã­n vereda el placer santa elena http owkgchmxyw"
"2014-08-09","belen_galeas","el servicio que toda peluquerã­a deberã­a tener ðÿ medellã­n definitivamente amo esta ciudad jaja http t7krgf68g6"
"2014-08-09","bogotainforma","segundo tiempo santa fe independiente medellã­n en el campã­n http fuiw4ctngx"
"2014-08-09","carodavilall","guardiansofthegalaxy let's do this ohyeah d at cine_colombia in medellã­n antioquia ms9h7mqggh http 8n8sncaf9h"
"2014-08-09","claucjdj","dashberlin en medellã­n y yo mi casa noooooo metalencia26 vivis_bello ðÿ µ"
"2014-08-09","colombia_vavel","el juego se detiene portero del medellã­n leandro castellanos con muestras de dolor ya calienta bejarano http zzrzj2zsir fuerte remate desde muy lejos de cã rdoba medellã­n al rner la terminã enviando el guardameta vargas http zzrzj2zsir"
"2014-08-09","corpo_store","llegã la hora de ponerse en forma sportwear ropadeportiva tel medellã­n cel http pgbxxuqspl"
"2014-08-09","diego_molano","gracias hectorwalterost y cooperecimed por reciclar en feriadeflores medellin bavaria_sa pilsencerveza http l00cpxlqjp"
"2014-08-09","edgomz","moon luna medellin saturday lunatic lunatico d felices lunas http ag2lx4ijrp"
"2014-08-09","emergencyjag","varios heridos en accidente de transito la via bogota medellin sector cocorna http 17ip3rvrdh"
"2014-08-09","gilbert54_mejia","necesita mas orden de juego el medellin"
"2014-08-09","golgolgolnet_","medellã­n se queda sin una de sus figuras para el partido frente a santa fe http es38tkhkqs soygolgolgol"
"2014-08-09","gomez_j26","esos papasitos que hay en medellã­n deberã­an vivir pereira ðÿ‘œðÿ ðÿ"
"2014-08-09","hansa_tours","bandeja paisa colombianfood medellin http 0blioffarx"
"2014-08-09","jaimefutbol210","medellã­n estã encima pero cano hoy no tiene la artillerã­a clara nada que mete y el dim cae a los minutos en bogotã"
"2014-08-09","javiervfs","santa fe vs independiente medellin daniel torres scores for liga postobon santa fe vs independiente medellin wilson morelo scores for liga postobon"
"2014-08-09","jose1992c","el mejor jugador del encuentro santa fe y medellin es tomar peres"
"2014-08-09","juanaute","tarde luna feriadeflores medellin santaelena atardecer http zkeijlhayh"
"2014-08-09","juanpamendozam","miren lo que acabo de comprar fuleco centro comercial unicentro medellin http 1mnad4qkaf"
"2014-08-09","kilmerperalta","mi capotico lindo te amo santi payasito medellin colombia http 5fuzv5ewxj"
"2014-08-09","luchoteescucho","rumbo a medellã­n despuã s de la etapa v colombia para cubrir juego maã ana nacional millos por sistemaoxigeno"
"2014-08-09","mandobarros","la luna de medellin hoy"
"2014-08-09","mauro_design","visitando a unos de los mejores productores medellã­n kevinadg chanelgenio ghost_colombia â http zonanwuxxf"
"2014-08-09","nachosanchezo","metro medellã­n â hoy que entendemos por cultura y cã mo se expresa es tiempo de un cambio en esa empresa su visiã n lo pãºblico"
"2014-08-09","natibotero11","mas emocionante quedarse en la casa un sã bado que el partido del medellin"
"2014-08-09","nicopuentes","conduciendo hacia medellã­n hora estimada de arribo pm con el gps social waze_es"
"2014-08-09","pecas_alvarez","hermosa noche en mi medellã­n del alma http f12syeqqc4"
"2014-08-09","ptrcolombia","violinista retirado metro medellã n gt ðÿž http xkggxbahi2 norma â nomãºsicanocultura lt a quã vamos noticia imk7swnu31"
"2014-08-09","radnalco","asã­ se vive el festival nacional de trova con radiandoando desde medellã­n feriadelasflores alaire en vivo http 38skftgl5j"
"2014-08-09","redapnacional","varios heridos en accidente de transito la via bogota medellin sector cocorna http aznc6nqnyg"
"2014-08-09","sebastianbale","jfcadavid pero medellin le falto la profundidad por derecha que da alcatraz garcia"
"2014-08-09","suaba616","mas miedo da el mordisco de un anciano sin puente que los ataques del medellã­n"
"2014-08-09","wbeimarlodice","medellã­n ataca sin claridad santa fe espera y busca contragolpes min"
"2014-08-12","andreac50018633","â cuã l es la ciudad mã s bonita que has visitado medellin http ft74zsbdac"
"2014-08-12","arroba_kathe","expotatuaje aun tenã­a el cabello rojo medellin suspencion http zdylhgyuow"
"2014-08-12","camiloquiroz55","yo pensaba que las ðÿ lindas estaban en medellã­n hasta vine a fort lauderdale ºðÿ"
"2014-08-12","danielvalenciay","http ty7sj29vzj encuentros y desencantos con el metro de medellã­n:â cultura medellinnovation medellinemociona medellincultura"
"2014-08-12","drpesteban","comic comicconcol serã en medellin nooooooooooooooooooooooooooooooooo"
"2014-08-12","edna_rgs","miciudadtudestino medellin via primavera encuentras moda diseã o culturaactividades al aire libre bazares mercados copaairlines miciudadtudestino medellin via primavera encuentras moda diseã o culturaactividades al aire libre bazares mercados copaairlines_co"
"2014-08-12","eloomedellin","cucas_world medellin_eloo jajajajajajajajja deveras eres momia style nacã­ siendo trendy y morirã jajaja los amooo"
"2014-08-12","faraujoj","anochece en medellã­n con su cielo azul elã ctrico atardecer sinfiltro http fxymvxdpdl"
"2014-08-12","gustavovacosta","deslumbrado por esta hermosa ciudad medellã n sin dudas al top de ciudades que conocã­ hasta ahora la tierra g10"
"2014-08-12","inversionangel","dos empresas de bogotã una chile y manizales llegan a medellã­n buscar inversiã n inversionangel ruta_n"
"2014-08-12","latino_power","estamosdeplan este sã bado desde medellã­n mandelbajo amp betados punk junto a ellos utgard demons subversiones 9pm cover 10k djchiflamicas este sã bado desde medellã­n mandelbajo amp betados punk junto a ellos utgard demons subversiones 9pm cover 10k davidllanueva este sã bado desde medellã­n mandelbajo amp betados punk junto a ellos utgard demons subversiones 9pm cover 10k larealdelsonido este sã bado desde medellã­n mandelbajo amp betados punk junto a ellos utgard demons subversiones 9pm cover 10k diegomarino_ este sã bado desde medellã­n mandelbajo amp betados punk junto a ellos utgard demons subversiones 9pm cover 10k revistaplanb este sã bado desde medellã­n mandelbajo amp betados punk junto a ellos utgard demons subversiones 9pm cover 10k chuckygarcia este sã bado desde medellã­n mandelbajo amp betados punk junto a ellos utgard demons subversiones 9pm cover 10k shockcomco este sã bado desde medellã­n mandelbajo amp betados punk junto a ellos utgard demons subversiones 9pm cover 10k rotela_co este sã bado desde medellã­n mandelbajo amp betados punk junto a ellos utgard demons subversiones 9pm cover 10k rumbabogota este sã bado desde medellã­n mandelbajo amp betados punk junto a ellos utgard demons subversiones 9pm cover 10k niqotsa este sã bado desde medellã­n mandelbajo amp betados punk junto a ellos utgard demons subversiones 9pm cover 10k arteconexion este sã bado desde medellã­n mandelbajo amp betados punk junto a ellos utgard demons subversiones 9pm cover 10k lparteconexion este sã bado desde medellã­n mandelbajo amp betados punk junto a ellos utgard demons subversiones 9pm cover 10k donka107 este sã bado desde medellã­n mandelbajo amp betados punk junto a ellos utgard demons subversiones 9pm cover 10k alixialesmes este sã bado desde medellã­n mandelbajo amp betados punk junto a ellos utgard demons subversiones 9pm cover 10k elparlante este sã bado desde medellã­n mandelbajo amp betados punk junto a ellos utgard demons subversiones 9pm cover 10k ana_cathe este sã bado desde medellã­n mandelbajo amp betados punk junto a ellos utgard demons subversiones 9pm cover 10k este sã bado desde medellã­n mandelbajo amp betados punk junto a ellos utgard demons subversiones 9pm cover 10k http q5cg1kjesd"
"2014-08-12","lauram165","estoy que me medellin"
"2014-08-12","leeoogarciaa","toco pasar por santa marta medellin bogota y ahora vamos pa cali que travesia vea pues"
"2014-08-12","madhres","uhprensagrafica ya ven no hay duda que mas personas colaboran busquen en otra parte el cartel de medellin jajajajj"
"2014-08-12","mariate07072991","dontetto medellin"
"2014-08-12","matigaona_","caminando por medellin"
"2014-08-12","mexicomunismo","de agosto conferencia prensa en cencos medellin colonia roma cdmx acto polã­tico uacm plantel http pbutudxqfv"
"2014-08-12","nachogarcias","ferrobirosa dificil yo estoy en medellin cuna del pibe valderrama cierto q se iban de ferias como va eso"
"2014-08-12","nicoangel111","deportivo independiente medellã­n fin de semana los ex poderosos http vpl1znt3ka"
"2014-08-12","rochivargasfore","dã­as como hoy deseo vivir en medellã­n o tener a alguien que me maneje hasta rionegro exhausta"
"2014-08-12","santiagocancion","amigos esta serã nuestra ruta de la caravanaradiã nica medellã­n y entregaremos boletas http juhufcjozj vã­a radionica"
"2014-08-12","vicentemur_10","mucho extranjero en esta ciudad al paso que vamos tendremos el espaã ol como segunda lengua medellã­n"
"2014-08-15","adan_medellin","felices aã os de existencia a mi dolorosa pasiã n querido atlasfc vamos con todo rojinegros"
"2014-08-15","amarycuidar1","misiã n millones apertura en colombia reuniones de lanzamiento medellã­n pereira cali y bogotã http fz9t0nni4z"
"2014-08-15","carolinamh__","partidos que rcn le va a transmitir nacional en menos de un mes medellin"
"2014-08-15","carooo_135","isabellascurain al fin vierneeeees mi isa bonito de semana para ti tambiã een hoy ya son dos semanas desde que te conocã­ en medellã­n"
"2014-08-15","charbelramirez","extraã o ir a piscina con mis amigos de medellin si me leen los y mucho"
"2014-08-15","clarosportsco","cronoescalada nocturna definirã este sã bado en medellin el tã­tulo de la vueltaacolombia camargo ganã novena etapa vcol camiloporrast"
"2014-08-15","cleansprite","he said lets go to medellin"
"2014-08-15","dannymontielsaa","en medellin http gvaixjave1"
"2014-08-15","darcysalome","lo mas feliz es estar en medellin la feria de las flores mukk lindo"
"2014-08-15","emarzelaroa","medellin city me esperaa"
"2014-08-15","esteban7788","plaza botero medellã­n al fondo el edificio coltejer mã s alto de la ciudad y sã­mbolo los paisas http vtiwglesnz"
"2014-08-15","fcyudyariaspop","unyoguienpatines el libro de yudyarias ya estã disponible en medellã n misushilight del c.c santafe"
"2014-08-15","fractalteatro","â el mejor plan para esta noche vamos a teatro en fractal de medellã­n iniciã la dã cima fiesta las http u6rpmhpfwn"
"2014-08-15","gaboperiodista1","el reciã n nombrado ministro consejero de posconflicto ã scar naranjo hizo una escala en medellã­n su viaje hacia la habana telemedellin"
"2014-08-15","graffitidela5","festival de arte urbano medellã n se pinta vida y convivencia este es el listado las personas que continãºan http gqsb8u5isa"
"2014-08-15","guitarjocy","pa medellã­n de la mano dios eres mi guã­a y sustento http lnjy4sdnjl"
"2014-08-15","hsbnoticias","ladrones hurtan vacunas para niã os y mujeres embarazadas âžœ http 50iau9ilkc antioquia medellã­n salud"
"2014-08-15","iamdjfelo","tonight do not miss the best urban party medellin ðÿ ž imdjgangster djfelomixxx http jjmssaa6cr"
"2014-08-15","ian_musicareal","giraltpablo directvsports sos el mejor del programa de lejos saludos desde medellã­n"
"2014-08-15","imorlandomp","en medellin elcanserbero junto a rmsrap representando venezuela concierto habeatatmusic â http esfz1hgrhz"
"2014-08-15","isabellapereid","ya lista para irme buen fin de semana todos medellin a voy ðÿ âœˆâœˆ ya lista para medellã­n ðÿ ƒðÿ ðÿ‘œðÿ‘œâœœâœœâœœâœˆâœˆðÿš ðÿš"
"2014-08-15","italocalderon1","quisiera quererte con sentimiento hacerte el amor elegancia y seducirte maldad â en medellã­n colombia http yjghgzjqvy"
"2014-08-15","jaalvarezs","numeral767 buenas noches por favor me informan el estado de la vã­a medellin cali"
"2014-08-15","jnhidraulicas","mantã n tu carro siempre como nuevo http 3r7ke0osgr talleres jnauto medellin medellinsegura"
"2014-08-15","juandavidpalomi","radionica hola estoy un poco desubicado escuche algo de algunos conciertos en medellin me podrian informar bien sobre el evento"
"2014-08-15","karolcortess","medellin gran banda asdfghjklã lt"
"2014-08-15","lacaperuputa","tengoganasde que sea maã ana pero yaa apoyemos la escena viva el metal nacional colombiano medellin rockalparque20anos"
"2014-08-15","llane","aquã­ con el pablopiso21 celebrando los 20k concierto en medallo esta noche gracias por su cariã o http o7ua0uoxea"
"2014-08-15","luna_medellin","deseo una nieve desde lo mã s profundo de mi estã mago"
"2014-08-15","manoloanimalx","repost from animalxlifestyle with repostapp realðÿ‘œvenida a medallo sin bombiada en animalxâ noâ http thjmeimaiz"
"2014-08-15","maratonmedellin","la maratã n de las flores medellã­n tiene su hotel sede http im6vlgsw4p"
"2014-08-15","marolismenco","riko mcaa si quiere te acompaã o a medallo jjajajaj dannasanchez408 ok no pero dare permiso"
"2014-08-15","milanjramericas","we proudly announce the u12 mjc team weah that will also represent our program in medellin children from usa http elgccn2xdd"
"2014-08-15","mori_medellin","alguien sabe q pasã el lomas verdes trã fico"
"2014-08-15","numeral767","merypompis buenas noches a continuaciã n relacionamos el estado actual de la vã­a bogotã medellã­n http wq6x0ylsff"
"2014-08-15","obed_medellin","i like this pic for some reason s http toqwgpwnqt why is it like so boring"
"2014-08-15","pablopiso21","calle pero elegante jaja listos con luisafernandaw para dejar el alma en canciones hoy medallo http rar8fnhhmj"
"2014-08-15","phamtonvox","interesante y ãºnico serã el show de metal medellã­n bogotã que se vivirã este sã bado en rockalparquefes"
"2014-08-15","publikolors","litografia medellin gran descuento hoy http rcrgxwcbzw whatsapp solo dios uraba qscty3pxv9 litografia medellin gran descuento hoy http rcrgxwcbzw whatsapp solo dios uraba cv0op4ovka litografia medellin gran descuento hoy http rcrgxwcbzw whatsapp tumaco aston villa colombia l4ffm3llhw litografia medellin gran descuento hoy http rcrgxwcbzw whatsapp tumaco aston villa colombia tmbjhxthmz litografia medellin gran descuento hoy http rcrgxwcbzw whatsapp tumaco aston villa colombia lhv4qfglys litografia medellin gran descuento hoy http rcrgxwcbzw whatsapp tumaco aston villa colombia bg8mhr0k1n litografia medellin gran descuento hoy http rcrgxwcbzw whatsapp tumaco aston villa colombia 4mofuvaaqy litografia medellin gran descuento hoy http rcrgxwcbzw whatsapp tumaco aston villa colombia wnvno4d5x1 litografia medellin gran descuento hoy http rcrgxwcbzw whatsapp tumaco aston villa colombia jmpx2fore9 litografia medellin gran descuento hoy http rcrgxwcbzw whatsapp tumaco aston villa colombia owr3baq9z7 litografia medellin gran descuento hoy http rcrgxwcbzw whatsapp tumaco aston villa colombia xc3sstz7o4"
"2014-08-15","rafatenorio2205","ya en medellin parque de los pies descalzos http cqwxykbawr"
"2014-08-15","reeycb","muchos exitos maã ana jalvarezflow en bellasartes medellin te quiere y apoya http 3hkd7i6slp"
"2014-08-15","roures1","medellã­n el orden social http xwn91a451p vã­a fdoquijano"
"2014-08-15","sca_presidencia","desde la academia nos inspira construir estudiantessca ant maã ana en biblioteca belã n medellã­n cnt_unal eafit arquitecturaupb"
"2014-08-15","torreeldorado","vuelo avianca av9342 bogota bog_eldorado aeromedellinrng medellin despegã a las 47pm aterrizarã 12pm con a319 confirmado vuelo avianca av9336 bogota bog_eldorado aeromedellinrng medellin despegã a las 37pm aterrizarã 02pm con a320 confirmado"
"2014-08-15","villabonajose","mi nuevo cuarto omeee the charlee hotel in medellin colombia http 2cjtwc8gcb"
"2014-08-15","yadir14","â œ revistasoho en medellã­n estã n cansados de la misma rumba vayan a este sitio gt http wrdib76uxbâ"
"2014-08-15","zonaactivapuj","â en baloncesto femenino univalle nacional de medellã­n copaloyola2014"
"2014-08-18","__sabg","lo que mã s quiero es mi mamã me diga alistese y acompaã a medellã n seria perfecto"
"2014-08-18","alcaldiademed","en medellã­n los impuestos se ven mã s calidad de vida para la ciudadanã­a todosporlavida http d1sac2ezbx"
"2014-08-18","aligator90210_","eldeltapabocas se puede apostar que es mas seguro ir a rockalparque un partido de fãºtbol los medellã­n vs bogotã"
"2014-08-18","byronperezm","mario_sabato grcias por compartir con la aficion del ciclismo en medellin te consideramos un paisa mas"
"2014-08-18","cannabistian","medinathebarrio danielhidalgoh medellã­n tiene el gobierno que se merece pura apariencia"
"2014-08-18","col_edm","el de agosto saldrã la boleterã­a liccolombia para medellin estã n listos una noche llena pintura y mãºsica electrã nica edm"
"2014-08-18","dayanaobregonco","leoymoise1 tambn mas exactamente de medellin d"
"2014-08-18","heidymtz03","y la runic color amarillo que le impusieron al juniorclubsa a fuerza en medellã­n aã o http yxkfcgaksy pliseth"
"2014-08-18","hinchadafielcol","leandro castellanos â œmedellã­n es una gran familia luego de mi error todo el estadio coreã nombre decidã­ no http fj1ahyjlmn"
"2014-08-18","iviledger","curcicastro el del atlã tico nacional de medellã­n rulos puede jugar tambiã n"
"2014-08-18","jemaya_","lleguã sano y salvo medellã­n in antioquia w michitorresc ltdlbtk8jl"
"2014-08-18","josuhafff","yo solo soy hicha de medallo"
"2014-08-18","katerinevn","medellã­n me esperaðÿ ƒ"
"2014-08-18","llilber1","me quiero ir para medallo pero ya"
"2014-08-18","otragiraldo","orgullosamente de medellin seã ores"
"2014-08-18","palacio581","medellin tiene cosas muy lindas http rfeygczc3z"
"2014-08-18","santiagog86","johnlopez_b pi3nsa estamos sintonizados en medellã­n estabamos hablando de lo mismo ecosebas danielduquev linaguisao avallejoarias"
"2014-08-18","vickyhenaog","alguien de envigado o medellã­n que desee hacerse cargo esta belleza no tiene hogar y es justo http mektpxmfty"
"2014-08-18","violetta872","mariareginabd colombia medellã­n"
"2014-08-18","yelanrodriguez","maã ana preparando ya para aprenderme la ruta de el metro medellã­n"
"2014-08-21","79_arboleda","jajajaja disqe vamos pa medallo noo esta es re droqado"
"2014-08-21","abogadohurtado","y medellã n â por quã no estã en el top de la revista the economist las ciudades habitables del mundo concejomedellin"
"2014-08-21","amparochundrog","lanochentn24 por favor pueden investigar si es verdad que hay miembros del g2cubano en el cti de medellã­n horror"
"2014-08-21","d_dora42","medellã­n la mejor ciudad para vivir en amã rica latina http fmqhiqyqug vã­a portafolioco"
"2014-08-21","daqahiphop","me gustã un video de youtube daqahiphop http yoajmhl8yi rap en transmilenio desde la comuna medellin mc daemon"
"2014-08-21","dicamora","medellin un ciudad de orgullo colombiano capital latinoamericana la innovacion http 29lbeukcme"
"2014-08-21","elamplificador1","juanfervelasco su romanticismo en un ã­ntimo show sinfã nico http xgrarvzdjn medellã­n y bogotã boletas dzstg4o6sm"
"2014-08-21","h4rrehftzouis","oopshiblond obvio marica jajaj y mã s si soy caleã a he vivido en medellã­n yo algo asã­ como la prima de vendedora rosas jaja"
"2014-08-21","infodim","â quã clã sico tan amargo los hinchas del medellã­n no podrã n ingresar al siguiente derby antioqueã o http vmjbydycv0"
"2014-08-21","juan_alcarazs","foto de la serie cae tarde en medellã­n teleantioquia noticias http 1dos0svmtk"
"2014-08-21","jurgenvilla","udea vs upb coliseo universidad de medellã­n http 4mb6ti4hsy"
"2014-08-21","ks0l_","medellã­n camioneta obstruyendo la ciclovia ecobici gobiernodf policia_cdmx ovialcdmx ayuda http 9ecclbolqz"
"2014-08-21","leon_98l","yo soy de medellin pero es re mamon que ahora alla tanta paisa barata con todo respeto para las si son decentes"
"2014-08-21","meridianotv","vã­a victorgomez82 a las am de lima medellã­n y pm cãºcuta"
"2014-08-21","paisadeportes","que no lo coja la noche para inscribirse en el primer torneo abierto de parquã s medellã­n http mnukwdo6rt vã­a paisadeportes"
"2014-08-21","rbaquero80","puede una de las mejores ciudades latinoamã rica para vivir tener los trancones y trã fico que tiene medellã­n a toda hora sttmed"
"2014-08-21","traficoaereola","dany_gomezz pensã que ya estabas en medellin porque mencionabas a tu hermano o es ã l tambiã n esta lima"
"2014-08-21","ulahybelpez","lo que opinan los voceros de grupo clã­nicas medellã­n a las les adeudan billã n pesos http qattvtobkj eltiempo"
"2014-08-21","vanesagvanegas","la sis de vivi ha trabajado en medio medellin super rico"
"2014-08-21","zamu2301","neptune_project dude can you upload the set that played in medellã­n at fsoe350col"
"2014-08-24","5h_medellin","lauren y camila via allanface en ig http a7ilz2zrgj"
"2014-08-24","alma_bueno38","planeando mi viaje a medellã­n"
"2014-08-24","c_amg","domingo cycle streetart comuna5 medellin http ujcncoyvpg"
