id,conversation_id,created_at,date,time,timezone,user_id,username,name,place,tweet,language,mentions,urls,photos,replies_count,retweets_count,likes_count,hashtags,cashtags,link,retweet,quote_url,video,thumbnail,near,geo,source,user_rt_id,user_rt,retweet_id,reply_to,retweet_date,translate,trans_src,trans_dest
571458469708075008,571458469708075008,2015-02-27 18:54:51 SA Pacific Standard Time,2015-02-27,18:54:51,-0500,173489285,diyanblizmusic,Diyan Bliz,,He añadido un vídeo a una lista de reproducción de @YouTube ( http://t.co/Qg3lX1eXPT - Diyan Bliz - Rumba En Medellin Ft,es,"[{'screen_name': 'youtube', 'name': 'youtube', 'id': '10228272'}]",['http://youtu.be/LW5l5KQjli0?a'],[],0,0,1,[],[],https://twitter.com/diyanblizmusic/status/571458469708075008,False,,0,,,,,,,,[],,,,
571458293102714880,571458293102714880,2015-02-27 18:54:08 SA Pacific Standard Time,2015-02-27,18:54:08,-0500,246882833,eurovelo3,CycloTransEurope,,Le forum mondial de la bicyclette se tient en ce moment à Medellin (Colombie)  http://t.co/EzwvihZJPY,fr,[],['http://www.fmb4.org/es/inicio/'],[],0,1,0,[],[],https://twitter.com/eurovelo3/status/571458293102714880,False,,0,,,,,,,,[],,,,
571458216011431937,571458216011431937,2015-02-27 18:53:50 SA Pacific Standard Time,2015-02-27,18:53:50,-0500,2211274982,jdrestrepoe,Juan Diego Restrepo E.,,"Muy interesante @WorldBikeForum en Medellín, una ciudad que se piensa en bicicleta a pesar de ineficiente manejo de vías en @AlcaldiadeMed",es,"[{'screen_name': 'worldbikeforum', 'name': 'foro mundial bicicleta', 'id': '2347826203'}, {'screen_name': 'alcaldiademed', 'name': 'alcaldía de medellín', 'id': '497511506'}]",[],[],0,2,3,[],[],https://twitter.com/JDRestrepoE/status/571458216011431937,False,,0,,,,,,,,[],,,,
571458093395144704,571458093395144704,2015-02-27 18:53:21 SA Pacific Standard Time,2015-02-27,18:53:21,-0500,1105525944,move_medellin,Move,,Don't forget to #Move  http://t.co/6XrlG3vGa4 #movemedellin,en,[],['http://instagram.com/p/znwOHEhxui/'],[],0,2,2,"['move', 'movemedellin']",[],https://twitter.com/Move_Medellin/status/571458093395144704,False,,0,,,,,,,,[],,,,
571458065087770624,571457588665159680,2015-02-27 18:53:14 SA Pacific Standard Time,2015-02-27,18:53:14,-0500,123088833,mariaparentesis,Maria(),,@mafe_mindy @Maya_Chan @IQDeily y llevaste las uñas desarregladas a Medellín?? Qué vergüenza :P,es,"[{'screen_name': 'maya_chan', 'name': 'maya chan', 'id': '5822292'}, {'screen_name': 'iqdeily', 'name': 'deily acevedo', 'id': '165219556'}]",[],[],2,0,0,[],[],https://twitter.com/MariaParentesis/status/571458065087770624,False,,0,,,,,,,,[],,,,
571457974142676992,571457974142676992,2015-02-27 18:52:52 SA Pacific Standard Time,2015-02-27,18:52:52,-0500,198516103,fransinaia,FranciscoTorreblanca,,¿Quién se apunta a las charlas molonas en #Medellin sobre los 7 pecados con el equipazo de @kVmarketing_ ?  http://t.co/6cJVJSurQ1,es,"[{'screen_name': 'kvmarketing_', 'name': 'kv marketing', 'id': '2824765320'}]",['http://bit.ly/1N0jkpa'],[],1,1,2,['medellin'],[],https://twitter.com/fransinaia/status/571457974142676992,False,,0,,,,,,,,[],,,,
571457792093122560,571457792093122560,2015-02-27 18:52:09 SA Pacific Standard Time,2015-02-27,18:52:09,-0500,2512306334,javierduque05,JDO,,4 minutos de adición en Medellín @FutbolTotalFC #jamaslovivisteasidirectv #FutbolTotalDIRECTV,es,"[{'screen_name': 'futboltotalfc', 'name': 'fútbol total', 'id': '424479742'}]",[],[],0,0,0,"['jamaslovivisteasidirectv', 'futboltotaldirectv']",[],https://twitter.com/javierduque05/status/571457792093122560,False,,0,,,,,,,,[],,,,
571457771570368512,571391939511255040,2015-02-27 18:52:04 SA Pacific Standard Time,2015-02-27,18:52:04,-0500,248482004,mariacarouribe,Maria Carolina Uribe,,"@purasangre7 @elcolombia a, no padeces medellín entonces...aqui no te atracan porque das papaya o por demalas, saben quien sos y listo",es,"[{'screen_name': 'elcolombia', 'name': 'elcolombia', 'id': '43903398'}]",[],[],0,0,0,[],[],https://twitter.com/MARIACAROURIBE/status/571457771570368512,False,,0,,,,,,,,[],,,,
571457630868283392,571457630868283392,2015-02-27 18:51:31 SA Pacific Standard Time,2015-02-27,18:51:31,-0500,310303884,mrojasg88,Mauricio,,"No salgan a la calle amiguitos, no hay por dónde moverse en Medellín.",es,[],[],[],0,4,0,[],[],https://twitter.com/mrojasg88/status/571457630868283392,False,,0,,,,,,,,[],,,,
571457533472333824,571457533472333824,2015-02-27 18:51:07 SA Pacific Standard Time,2015-02-27,18:51:07,-0500,1323080906,__carolinag16,CarolinaG🦋,,"Si me voy para medellin, solo espero que haya aya una banda que sea una familia, como en la que inicie mis procesos 😏",es,[],[],[],0,0,2,[],[],https://twitter.com/__carolinag16/status/571457533472333824,False,,0,,,,,,,,[],,,,
571457452941701120,571457452941701120,2015-02-27 18:50:48 SA Pacific Standard Time,2015-02-27,18:50:48,-0500,145669860,redepazant,RedepazAntioquia,,En el lanzamiento de #VidaMarzo8 en #Medellin con @AntanasMockus #LaVidaesSagrada  http://t.co/fM4GPT1nmt,es,"[{'screen_name': 'antanasmockus', 'name': 'antanas mockus', 'id': '22488241'}]",[],"['https://pbs.twimg.com/media/B-45ec5XAAEc0VM.jpg', 'https://pbs.twimg.com/media/B-45fZlW4AERKzR.jpg', 'https://pbs.twimg.com/media/B-45gMhW8AAYJdD.jpg', 'https://pbs.twimg.com/media/B-45g9nW4AAo0sB.jpg']",1,4,2,"['vidamarzo8', 'medellin', 'lavidaessagrada']",[],https://twitter.com/redepazant/status/571457452941701120,False,,1,https://pbs.twimg.com/media/B-45ec5XAAEc0VM.jpg,,,,,,,[],,,,
571457423162118144,571391939511255040,2015-02-27 18:50:41 SA Pacific Standard Time,2015-02-27,18:50:41,-0500,248482004,mariacarouribe,Maria Carolina Uribe,,"@purasangre7 @elcolombiano lo bueno se va a continuar, pero hay que meterle mano a la seguridad, medellín es una bomba de tiempo",es,"[{'screen_name': 'elcolombiano', 'name': 'el colombiano', 'id': '64419705'}]",[],[],2,0,0,[],[],https://twitter.com/MARIACAROURIBE/status/571457423162118144,False,,0,,,,,,,,[],,,,
571457381726605313,571457381726605313,2015-02-27 18:50:31 SA Pacific Standard Time,2015-02-27,18:50:31,-0500,2993887566,dpaulina12,Paulina,,Una bicicleta en Medellín cuesta entre $150.000 y 40 millones  http://t.co/QWzYP5ZuxR,es,[],['http://www.elcolombiano.com/una-bicicleta-en-medellin-cuesta-entre-150-000-y-40-millones-GL1386594'],[],0,0,0,[],[],https://twitter.com/DPaulina12/status/571457381726605313,False,,0,,,,,,,,[],,,,
571457286889218048,571457286889218048,2015-02-27 18:50:09 SA Pacific Standard Time,2015-02-27,18:50:09,-0500,2871209493,visiondiaria,Visión Diaria,,Rutaca y Avior piensan abrir vuelos directos desde Bogotá y Medellín hasta la isla de Margarita.  http://t.co/bibs3XVg1y,es,[],['http://ow.ly/JJHDN'],[],0,0,0,[],[],https://twitter.com/visiondiaria/status/571457286889218048,False,,0,,,,,,,,[],,,,
571457246573535233,571457246573535233,2015-02-27 18:49:59 SA Pacific Standard Time,2015-02-27,18:49:59,-0500,211545899,ricky102368,Rikki Rayne,,"Welcome to Muscat Salon and Gift Shop located at the heart of FUNtastic Medellin,  New Poblacion Market,...  http://t.co/4VgdBdy4sD",en,[],['http://fb.me/3geUHcsSi'],[],0,0,0,[],[],https://twitter.com/ricky102368/status/571457246573535233,False,,0,,,,,,,,[],,,,
571457241318072321,571457241318072321,2015-02-27 18:49:58 SA Pacific Standard Time,2015-02-27,18:49:58,-0500,2324004612,maclarae,Ma Clara Echeverría,,Excelente publicación con ilustraciones de las aves que habitan la Universidad Nacional de Colombia Sede Medellín  http://t.co/JuNQnGJ1lZ,es,[],[],['https://pbs.twimg.com/media/B-45U9EW4AAJBxF.jpg'],0,0,0,[],[],https://twitter.com/maclarae/status/571457241318072321,False,,1,https://pbs.twimg.com/media/B-45U9EW4AAJBxF.jpg,,,,,,,[],,,,
571457164558123008,571457164558123008,2015-02-27 18:49:39 SA Pacific Standard Time,2015-02-27,18:49:39,-0500,3041445209,somosmedellin,somosmedellín,,En #Medellín “@_wokalounge  http://t.co/lQgAIZc2DU” #somosmedellín,und,"[{'screen_name': '_wokalounge', 'name': 'woka lounge', 'id': '1135168489'}]",[],['https://pbs.twimg.com/media/BG3Fzo5CEAAhtGN.jpg'],0,0,0,"['medellín', 'somosmedellín']",[],https://twitter.com/somosmedellin/status/571457164558123008,False,,1,https://pbs.twimg.com/media/BG3Fzo5CEAAhtGN.jpg,,,,,,,[],,,,
571457090096635904,571457090096635904,2015-02-27 18:49:22 SA Pacific Standard Time,2015-02-27,18:49:22,-0500,2211274982,jdrestrepoe,Juan Diego Restrepo E.,,Uso masivo de bicicletas en Medellín requiere cambios en semaforización. Hasta ahora @sttmed privilegia carros a peatones. ¿Habrá cambios?,es,"[{'screen_name': 'sttmed', 'name': 'secretaría de movilidad de medellín', 'id': '73007294'}]",[],[],0,0,2,[],[],https://twitter.com/JDRestrepoE/status/571457090096635904,False,,0,,,,,,,,[],,,,
571456942423613442,571269106613297152,2015-02-27 18:48:46 SA Pacific Standard Time,2015-02-27,18:48:46,-0500,1013354508,sportsnv,Nelson Valle,,@RaulBenoit quiero ir!!!! #Medellin,es,[],[],[],0,0,0,['medellin'],[],https://twitter.com/sportsnv/status/571456942423613442,False,,0,,,,,,,,[],,,,
571456725150261248,571456725150261248,2015-02-27 18:47:55 SA Pacific Standard Time,2015-02-27,18:47:55,-0500,2767621258,pedalentos,Pedalentos,,"Fórum Mundial da Bicicleta em Medellín, Colômbia. #4fmb #forummundialdabicicleta #pedalentos…  https://t.co/LVN1900xEl",pt,[],['https://instagram.com/p/zn6S-xLhUB/'],[],0,0,0,"['4fmb', 'forummundialdabicicleta', 'pedalentos']",[],https://twitter.com/pedalentos/status/571456725150261248,False,,0,,,,,,,,[],,,,
571456581289820162,571456581289820162,2015-02-27 18:47:20 SA Pacific Standard Time,2015-02-27,18:47:20,-0500,2458558478,fernandaayala24,Fernanda ♡,,"Deberían pasar todo  tiempo posible con migo, tal vez el otro año este por haya en Medellin con mi mama y no me vuelvan a ver en su vida.",es,[],[],[],0,0,1,[],[],https://twitter.com/FernandaAyala24/status/571456581289820162,False,,0,,,,,,,,[],,,,
571456501249921024,571456501249921024,2015-02-27 18:47:01 SA Pacific Standard Time,2015-02-27,18:47:01,-0500,358401286,frecuencia_u,Frecuencia U,,Al aire #1800 el programa juvenil de @frecuencia_u @ Universidad de Medellín  https://t.co/xsbvh5DI0G,es,"[{'screen_name': 'frecuencia_u', 'name': 'frecuencia u', 'id': '358401286'}]",['https://instagram.com/p/zn6MdsspNR/'],[],0,0,0,[],[],https://twitter.com/Frecuencia_U/status/571456501249921024,False,,0,,,,,,,,[],,,,
571456464700743680,571456464700743680,2015-02-27 18:46:52 SA Pacific Standard Time,2015-02-27,18:46:52,-0500,770469848,cicloviajerosec,CicloViajerosEC,,"En breve se viene la masa critica mundial, la bicicleta se toma #Medellin #FMB4 @RicardoPatinoEC @MashiRafael  http://t.co/ZSxDiMUw7K",es,"[{'screen_name': 'ricardopatinoec', 'name': 'ricardo patiño', 'id': '202792190'}, {'screen_name': 'mashirafael', 'name': 'rafael correa', 'id': '209780362'}]",[],['https://pbs.twimg.com/media/B-44neOW0AAqSPO.jpg'],0,3,1,"['medellin', 'fmb4']",[],https://twitter.com/CicloviajerosEC/status/571456464700743680,False,,1,https://pbs.twimg.com/media/B-44neOW0AAqSPO.jpg,,,,,,,[],,,,
571456375466958849,571456176069545985,2015-02-27 18:46:31 SA Pacific Standard Time,2015-02-27,18:46:31,-0500,1514101916,petroides,Pedro José Rivera Giraldo 🌳🌈,,"@JAIM3_ANDR3S nació en Salgar (Antioquia), pero se crió en Medellín y su número de suerte es el 82",es,[],[],[],0,1,2,[],[],https://twitter.com/petroides/status/571456375466958849,False,,0,,,,,,,,[],,,,
571456083568566272,571391939511255040,2015-02-27 18:45:22 SA Pacific Standard Time,2015-02-27,18:45:22,-0500,248482004,mariacarouribe,Maria Carolina Uribe,,"@purasangre7 @elcolombiano si querés tanto a Medellín acercate a las propuestas, con conocimiento de causa te digo que son ganadoras...",es,"[{'screen_name': 'elcolombiano', 'name': 'el colombiano', 'id': '64419705'}]",[],[],1,0,0,[],[],https://twitter.com/MARIACAROURIBE/status/571456083568566272,False,,0,,,,,,,,[],,,,
571456070419386369,571456070419386369,2015-02-27 18:45:18 SA Pacific Standard Time,2015-02-27,18:45:18,-0500,385127937,leo_kalderon,LEONARDO CALDERÓN ♛,,Soñando para que Medellín sea un distrito  http://t.co/a0loMYOyQH,es,[],['http://fb.me/2ywBR9lZI'],[],0,0,0,[],[],https://twitter.com/leo_kalderon/status/571456070419386369,False,,0,,,,,,,,[],,,,
571455968447471616,571455968447471616,2015-02-27 18:44:54 SA Pacific Standard Time,2015-02-27,18:44:54,-0500,224103514,isasantanariver,ISABEL CRISTINA🌈,,"""@MaiteOficial: Colombia Medellín a todo lo q daba con nuestro #eclipsedeluna cantando #tuyyo #vasaquerervolver…  https://t.co/5gno0imSuv"" :*",es,"[{'screen_name': 'maiteoficial', 'name': 'maite perroni fan account', 'id': '1319870618154815488'}]",['https://instagram.com/p/znoAAaCarp/'],[],0,0,0,"['eclipsedeluna', 'tuyyo', 'vasaquerervolver']",[],https://twitter.com/isasantanariver/status/571455968447471616,False,,0,,,,,,,,[],,,,
571455942799335424,571455942799335424,2015-02-27 18:44:48 SA Pacific Standard Time,2015-02-27,18:44:48,-0500,2271859088,ecuaflow_net,Promo Ecuador,,#Repost @kannon593 ・・・ Buena noche mi gente seguimos gracias a Dios aquí en #laindustriainc #LF #MEDALLO  https://t.co/CFj4hLDVGq,es,"[{'screen_name': 'kannon593', 'name': 'kannonelprotagonista', 'id': '609524924'}]",['https://instagram.com/p/zn58Ncmtm9/'],[],0,2,0,"['repost', 'laindustriainc', 'lf', 'medallo']",[],https://twitter.com/Ecuaflow_net/status/571455942799335424,False,,0,,,,,,,,[],,,,
571455633645572096,571455633645572096,2015-02-27 18:43:34 SA Pacific Standard Time,2015-02-27,18:43:34,-0500,575463112,valeayala2012,Vale Ayala,,Medellín simplemente ¡Te Adoro! Siempre dan ganas de volver y volver más y más veces...Ciudad hermosa,es,[],[],[],0,0,2,[],[],https://twitter.com/ValeAyala2012/status/571455633645572096,False,,0,,,,,,,,[],,,,
571455569694998528,571455569694998528,2015-02-27 18:43:19 SA Pacific Standard Time,2015-02-27,18:43:19,-0500,81973019,leonelpava,Leonel Pava,,Viajando a Bogotá desde Medellin x @Avianca el vuelo 6:20pm nos hacen abordar a las 6:30pm y anuncian que hora de despegue es 7:30pm ahhhh!!,es,"[{'screen_name': 'avianca', 'name': 'avianca', 'id': '274087824'}]",[],[],2,1,0,[],[],https://twitter.com/leonelpava/status/571455569694998528,False,,0,,,,,,,,[],,,,
571455538082545664,571455538082545664,2015-02-27 18:43:12 SA Pacific Standard Time,2015-02-27,18:43:12,-0500,143612545,santilinares04,Santiago Linares,"{'type': 'Point', 'coordinates': [6.24231382, -75.5764577]}",Foro Mundial de la Bicicleta! Gracias Medellin! #FMB4 #Bicycle @ Plaza Mayor Medellín  https://t.co/YoXVqGy7CV,es,[],['https://instagram.com/p/zn5wYLgcHn/'],[],0,0,0,"['fmb4', 'bicycle']",[],https://twitter.com/SantiLinares04/status/571455538082545664,False,,0,,,,,,,,[],,,,
571455463478468608,571455463478468608,2015-02-27 18:42:54 SA Pacific Standard Time,2015-02-27,18:42:54,-0500,2172390110,oyeperroni,bren,,#FOTO maitepb [@MaiteOficial]: Colombia Medellín a todo lo q daba con nuestro #eclipsedeluna  https://t.co/7LwSHk7HKt  http://t.co/y4fQKC9P5P,es,"[{'screen_name': 'maiteoficial', 'name': 'maite perroni fan account', 'id': '1319870618154815488'}]",['https://Instagram.com/p/znoAAaCarp/'],['https://pbs.twimg.com/media/B-4V889XIAAl_vP.jpg'],0,1,0,"['foto', 'eclipsedeluna']",[],https://twitter.com/oyeperroni/status/571455463478468608,False,,1,https://pbs.twimg.com/media/B-4V889XIAAl_vP.jpg,,,,,,,[],,,,
571455355286368256,571455355286368256,2015-02-27 18:42:28 SA Pacific Standard Time,2015-02-27,18:42:28,-0500,2926388907,lafixcrew,La FIX CREW,,La Fix Crew lista para rodar en la Masa Critica Mundial #Medellin #FMB4 #Mexico #Ecuador #Nederland…  https://t.co/V57mND40Lj,es,[],['https://instagram.com/p/zn5rEPqunf/'],[],0,0,0,"['medellin', 'fmb4', 'mexico', 'ecuador', 'nederland']",[],https://twitter.com/LaFixCrew/status/571455355286368256,False,,0,,,,,,,,[],,,,
571455346625138688,571455346625138688,2015-02-27 18:42:26 SA Pacific Standard Time,2015-02-27,18:42:26,-0500,2415245604,luisbduque,LuisBduque,,"Colombia: cómo duele que en Medellin no cesa la violencia , ni la extorsión. Vamos elegir un Alcalde con pantalones?  http://t.co/pliqmzEWY5",es,[],[],['https://pbs.twimg.com/media/B-43lJMUYAEAovf.jpg'],1,4,1,[],[],https://twitter.com/LUISBDUQUE/status/571455346625138688,False,,1,https://pbs.twimg.com/media/B-43lJMUYAEAovf.jpg,,,,,,,[],,,,
571455287304925184,571455287304925184,2015-02-27 18:42:12 SA Pacific Standard Time,2015-02-27,18:42:12,-0500,1918237963,peresalis,Alis Peres,,Medellín.  Colombia,es,[],[],[],0,0,0,[],[],https://twitter.com/PeresAlis/status/571455287304925184,False,,0,,,,,,,,[],,,,
571455261707247616,571455261707247616,2015-02-27 18:42:06 SA Pacific Standard Time,2015-02-27,18:42:06,-0500,384604339,gavirianatalia,Natalia Gaviria,,"""El problema en Medellín esta en que los pobres vemos la riqueza desde arriba, a la que nunca vamos a acceder"" Sicario de 15 años 😓",es,[],[],[],0,2,1,[],[],https://twitter.com/GaviriaNatalia/status/571455261707247616,False,,0,,,,,,,,[],,,,
571455252634963968,571455252634963968,2015-02-27 18:42:04 SA Pacific Standard Time,2015-02-27,18:42:04,-0500,193461527,casimona,Lesly,,En Medellín siempre hay buenos planes por hacer. Este Domingo #Yoga en el maravilloso @jbotanicomed  #YogaLife #YogaTip :-),es,"[{'screen_name': 'jbotanicomed', 'name': 'jardín botánico med', 'id': '227317182'}]",[],[],0,0,1,"['yoga', 'yogalife', 'yogatip']",[],https://twitter.com/CasiMona/status/571455252634963968,False,,0,,,,,,,,[],,,,
571455154886729728,571455154886729728,2015-02-27 18:41:40 SA Pacific Standard Time,2015-02-27,18:41:40,-0500,101048650,marcomeiz,Marco Mei,,Medellín desde la estación Alpujarra del Metro. No voy en bici pero vengo del #FMB4 ;)  http://t.co/6uAnztkvEP,es,[],[],"['https://pbs.twimg.com/media/B-43Vo5W4AAXSy-.jpg', 'https://pbs.twimg.com/media/B-43VrDXIAAfJ3o.jpg']",0,1,4,['fmb4'],[],https://twitter.com/MarcoMeiZ/status/571455154886729728,False,,1,https://pbs.twimg.com/media/B-43Vo5W4AAXSy-.jpg,,,,,,,[],,,,
571455083730366465,571455083730366465,2015-02-27 18:41:23 SA Pacific Standard Time,2015-02-27,18:41:23,-0500,148598546,mariosgar,Mario Suarez Garcia,"{'type': 'Point', 'coordinates': [6.20808735, -75.5641872]}",Celebration Postgraduate!!!  @leonardosugar @loryjessica! Happiness ! (@ El Correo carne y vino la 10 in medellin)  https://t.co/5iLaIxcnDJ,es,"[{'screen_name': 'leonardosugar', 'name': 'leo suarez garcia®', 'id': '287756487'}, {'screen_name': 'loryjessica', 'name': 'lory jessica', 'id': '309961723'}]",['https://www.swarmapp.com/c/1dQpGnmAV85'],[],0,2,1,[],[],https://twitter.com/Mariosgar/status/571455083730366465,False,,0,,,,,,,,[],,,,
571454876791775232,571454876791775232,2015-02-27 18:40:34 SA Pacific Standard Time,2015-02-27,18:40:34,-0500,256278976,jorgelaraphoto,Jorge Lara Photo,,Sesión Day After en Medellín - Colombia Tatiana y Tyler  Wedding Storyteller ©  http://t.co/X82SkM5q3l  http://t.co/EWsSSwtmEv,fi,[],"['http://www.jorgelara.com', 'http://fb.me/1Pttw9a4R']",[],0,0,0,[],[],https://twitter.com/jorgelaraphoto/status/571454876791775232,False,,0,,,,,,,,[],,,,
571454619169067008,571454619169067008,2015-02-27 18:39:32 SA Pacific Standard Time,2015-02-27,18:39:32,-0500,2790748504,memepolis,MEMEPOLIS,, http://t.co/FyyU8QG1ol Trending Topics Top 10 Latino Fecha 2015-02-27 17:39:31 Colombia  Medellín  http://t.co/IjSRPkrSdP,es,[],['http://developrz.com'],['https://pbs.twimg.com/media/B-428shVIAASHmg.png'],0,0,0,[],[],https://twitter.com/Memepolis/status/571454619169067008,False,,1,https://pbs.twimg.com/media/B-428shVIAASHmg.png,,,,,,,[],,,,
571454381528354816,571454381528354816,2015-02-27 18:38:36 SA Pacific Standard Time,2015-02-27,18:38:36,-0500,142065269,andreshd1982,Andres Hernandez,"{'type': 'Point', 'coordinates': [6.20975958, -75.56866407]}","I'm at El Poblado in Medellín, Antioquia  https://t.co/89gkVLPzO8",ca,[],['https://www.swarmapp.com/c/6sTdchrR7cQ'],[],0,0,0,[],[],https://twitter.com/andreshd1982/status/571454381528354816,False,,0,,,,,,,,[],,,,
571454180201799680,571454180201799680,2015-02-27 18:37:48 SA Pacific Standard Time,2015-02-27,18:37:48,-0500,100998754,viajaxcolombia,viajaporcolombia,"{'type': 'Point', 'coordinates': [4.6963013, -74.1402032]}",Ya en @AeroDorado para salir rumbo a #Medellin vía @LAN_CO  http://t.co/JHJyIWS1u6,es,"[{'screen_name': 'aerodorado', 'name': 'aeropuerto el dorado', 'id': '620049554'}, {'screen_name': 'lan_co', 'name': 'lan', 'id': '848235066899611648'}]",[],['https://pbs.twimg.com/media/B-42hOaW4AEOLmO.jpg'],0,0,0,['medellin'],[],https://twitter.com/viajaxcolombia/status/571454180201799680,False,,1,https://pbs.twimg.com/media/B-42hOaW4AEOLmO.jpg,,,,,,,[],,,,
571454168780701697,571454168780701697,2015-02-27 18:37:45 SA Pacific Standard Time,2015-02-27,18:37:45,-0500,71262904,enmicolombia,EnMiColombia.com,,or_karen en Instagram publicó: Yo puedo escalar los Andes solo por ir a contar tus lunares... #Medellin #medellinci…  http://t.co/YCZrN16fVT,es,[],[],['https://pbs.twimg.com/media/B-42iePW4AENXf6.jpg'],0,1,0,"['medellin', 'medellinci']",[],https://twitter.com/enmicolombia/status/571454168780701697,False,,1,https://pbs.twimg.com/media/B-42iePW4AENXf6.jpg,,,,,,,[],,,,
571453885216198657,571453885216198657,2015-02-27 18:36:37 SA Pacific Standard Time,2015-02-27,18:36:37,-0500,40533752,rcnradio,RCN Radio,,Concluyó en Medellín la reunión del Comité Consultivo en Radiocomunicaciones.  http://t.co/DgApZLFjko,es,[],['http://dlvr.it/8mNmmH'],[],0,0,0,[],[],https://twitter.com/rcnradio/status/571453885216198657,False,,0,,,,,,,,[],,,,
571453736876421120,571453736876421120,2015-02-27 18:36:02 SA Pacific Standard Time,2015-02-27,18:36:02,-0500,114551917,ferneydario,Ferney Jaramillo,,El metro de Medellín con fallas en estación Caribe  http://t.co/6zxj3gIVOl,es,[],[],"['https://pbs.twimg.com/media/B-42JSqXEAEte2g.jpg', 'https://pbs.twimg.com/media/B-42JKEWoAARzl-.jpg']",0,0,0,[],[],https://twitter.com/ferneydario/status/571453736876421120,False,,1,https://pbs.twimg.com/media/B-42JSqXEAEte2g.jpg,,,,,,,[],,,,
571453331312406530,571448035051507712,2015-02-27 18:34:25 SA Pacific Standard Time,2015-02-27,18:34:25,-0500,353372632,ihana_talvi,•° Ihana Talvi °•,,"Sunset right now, seen from Medellín, Colombia. &lt;3   “@Sinsintidez: Las 6:11 pm.  http://t.co/ld0KAPYjJ1”",es,"[{'screen_name': 'sinsintidez', 'name': 'stiven', 'id': '737045474'}]",['https://twitter.com/Sinsintidez/status/571448035051507712/photo/1'],[],1,0,4,[],[],https://twitter.com/Ihana_Talvi/status/571453331312406530,False,,0,,,,,,,,[],,,,
571453324416962561,571453324416962561,2015-02-27 18:34:24 SA Pacific Standard Time,2015-02-27,18:34:24,-0500,114551917,ferneydario,Ferney Jaramillo,,"@etmva otro tren dañado, congestión en Caribe #Medellín  http://t.co/61q55MiZoC",es,[],[],"['https://pbs.twimg.com/media/B-41xGvXEAAtPhw.jpg', 'https://pbs.twimg.com/media/B-41xSnWoAEVm1F.jpg']",0,0,1,['medellín'],[],https://twitter.com/ferneydario/status/571453324416962561,False,,1,https://pbs.twimg.com/media/B-41xGvXEAAtPhw.jpg,,,,,,,[],,,,
571453243034898432,571453243034898432,2015-02-27 18:34:04 SA Pacific Standard Time,2015-02-27,18:34:04,-0500,3041445209,somosmedellin,somosmedellín,,“@Opcion_Hoy: #Medellín recibe mañana a Pitbull en concierto. Más información #somosmedellín   http://t.co/Z86kTxHRS8  http://t.co/5D254tUJkB”,es,"[{'screen_name': 'opcion_hoy', 'name': 'revista opción hoy', 'id': '163912664'}]",['http://goo.gl/tfpOiV'],['https://pbs.twimg.com/media/B-4ouUkWwAAQ7l5.jpg'],0,0,0,"['medellín', 'somosmedellín']",[],https://twitter.com/somosmedellin/status/571453243034898432,False,,1,https://pbs.twimg.com/media/B-4ouUkWwAAQ7l5.jpg,,,,,,,[],,,,
571453165964558336,571453165964558336,2015-02-27 18:33:46 SA Pacific Standard Time,2015-02-27,18:33:46,-0500,478210581,jorge_ache,JorgeAche,,Bicicletas públicas: así es la movida en Medellín  http://t.co/d2k9Qj0PMA via @ELTIEMPO,es,"[{'screen_name': 'eltiempo', 'name': 'el tiempo', 'id': '9633802'}]",['http://bit.ly/1BzHe86'],[],0,0,0,[],[],https://twitter.com/jorge_ache/status/571453165964558336,False,,0,,,,,,,,[],,,,
571453125271298048,571453125271298048,2015-02-27 18:33:36 SA Pacific Standard Time,2015-02-27,18:33:36,-0500,113206846,nubieliza,nub,,"#Viernescoolinario ""Calmantes Montes"" Sinaloa y Medellín. Hoy Margararitas 2x1👌🍹😬 @RecomendadoraDF @LaRomaDF  http://t.co/4At8xLgvRT",es,"[{'screen_name': 'recomendadoradf', 'name': 'recomendando', 'id': '2715046999'}, {'screen_name': 'laromadf', 'name': 'colonia roma 🚲', 'id': '530884727'}]",[],"['https://pbs.twimg.com/media/B-41j9TUsAAeXA5.jpg', 'https://pbs.twimg.com/media/B-41j9WUAAA2Kkr.jpg']",0,1,2,['viernescoolinario'],[],https://twitter.com/Nubieliza/status/571453125271298048,False,,1,https://pbs.twimg.com/media/B-41j9TUsAAeXA5.jpg,,,,,,,[],,,,
571453110431944704,571453110431944704,2015-02-27 18:33:33 SA Pacific Standard Time,2015-02-27,18:33:33,-0500,346003067,jesusdiazr80,King Without a Crown🍃,,El 5 de marzo los caminos conducen a la UNIVERSIDAD EAFIT en medellin a escuchar a este grande de la…  https://t.co/sWYcji7j1m,es,[],['https://instagram.com/p/zn4pwJPiEC/'],[],0,0,0,[],[],https://twitter.com/jesusdiazR80/status/571453110431944704,False,,0,,,,,,,,[],,,,
571453068774129664,571453068774129664,2015-02-27 18:33:23 SA Pacific Standard Time,2015-02-27,18:33:23,-0500,58987500,nicolaslopezco,Nicolás López,,"Hemos trabajado muy duro, nos sobra amor por Medellín y por nuestra gente. Estamos listos para asumir el reto.  http://t.co/iXhiU4kYcs",es,[],[],['https://pbs.twimg.com/media/B-41Z-6WwAAXjck.jpg'],0,3,2,[],[],https://twitter.com/NicolasLopezCo/status/571453068774129664,False,,1,https://pbs.twimg.com/media/B-41Z-6WwAAXjck.jpg,,,,,,,[],,,,
