"date","username","tweet"
"2016-06-29","velodromomed","telemedellin hx9ophcnvb medellin necesita un velodromo"
"2016-06-29","vgxgxg","vea la joda pacheco esta en medellin"
"2016-06-29","vivalaradiotv","el artista legarda y su ã xito laverdad muy pronto de promociã n en medellã­n carloscoloradopâ dmyb7brxuj el artista legarda y su ã xito laverdad muy pronto de promociã n en medellã­n carloscolodadopâ dmyb7brxuj"
"2016-06-29","xicos_medellin","summerbrielle you probably flushed it or put in the fridge sinderellapinup ðÿ ðÿ’œðÿ’œðÿ’œ"
"2016-06-29","yulyvalencia","medallo ome ó œ â šó ecezshtxxz"
