"date","username","tweet"
"2016-09-29","pipebega","tbt puertocolombia barranquilla medellã­n colombia 179k2ngmf3"
"2016-09-29","pipekno1","que pasa con la movilidad de medellin a si es q lloviã"
"2016-09-29","policiamedellin","vamosseguros adelantamos controles preventivos propendiendo por la tranquilidad y seguridad de habitantes las comunas medellã­n 3r11gwulvk"
"2016-09-29","prensacom","el discurso del periodista martin barton eu serã uno de los platos fuertes festivalgabo en medellã­n el orquideorama del jardã­n botã nico de medellã­n serã donde en minutos ocurra la ceremonia premiaciã n festivalgabo mmj6pjcihu dentro de poco en la ceremonia premiaciã n del festivalgabo hablarã jaime_abello y el alcalde medellã­n federico gutiã rrez en minutos inicia la ceremonia de premiaciã n del festivalgabo medellã­n"
"2016-09-29","pulzo","venden paquete turã­stico que incluye cena con â popeyeâ en medellã­n ijzaf6ywjs wt4r1mcmsk"
"2016-09-29","qhubotolima","investigada agencia que vendiã paquetes turã sticos para ver a alias popeye medellã n el colombiano las tlmfrlleii"
"2016-09-29","rafico42","departamento de estado decã­a que uribe perteneciã al cartel medellã­n gaviria netnkg6tbj vã­a bluradioco"
"2016-09-29","ramarin22","bluradioco cã mo se consiguen las boletas para voz populi en medellã­n he escrito varias veces al correo y no responden gracias"
"2016-09-29","redradiove","medellã­n abriã sus puertas al premio gabriel garcã­a mã rquez znmtglemgh ilhkfbzhzp"
"2016-09-29","rodrigocrave42","ud vive en colombia llame mesaje privada soy reportero del diã rio mã s grande de brasã­lia bogota medellin cali plebiscito urgente"
"2016-09-29","romanovtrainer","just posted a photo bello medellin antioquia 9ld3tf05bi"
"2016-09-29","santiagoescu92","conducir a medellã­n compartir informaciã n de la carretera en tiempo real con wazers mi zona eta pm usando waze conducciã so conducir a medellã­n compartir informaciã n de la carretera en tiempo real con wazers mi zona eta pm usando waze conducciã so"
"2016-09-29","savetheworldla","save the world domingo de oct en santa fe antioquia municipio aledaã o a medellin desde la 1pm los spqj5dcb1e"
"2016-09-29","scardenass","sergiobogotano carlos_o_jr medellã­n es maravillosa me encanta esa ciudad y disfruto mucho visitarla voy tanto como puedo"
"2016-09-29","sergiof10_","s4ntiagoc carlos_o_jr de acuerdo a esto medellã­n debe ser la mejor ciudad del mundo para santiago p ðÿ"
"2016-09-29","siatamedellin","actualizaciã n del pronã stico para la noche de hoy oriente medellã­n areametropol v7xmt13gre 8cbjpdpvii actualizaciã n del pronã stico para la noche de hoy en centro medellã­n areametropol v7xmt13gre tnkyczebdc actualizaciã n del pronã stico para la noche de hoy occidente medellã­n areametropol v7xmt13gre svhlucpvru"
"2016-09-29","sociopelaez","tbt familiar poblado medellin antioquia wckutxf05n"
"2016-09-29","soyestebancalle","laurencruzm los de ayer fatã­dicos me daba pena decir admitir que medellã­n era equipo antioquia"
"2016-09-29","sttmed","antes y despuã s de av colombia asã­ se transforma el transporte pãºblico colectivo en medellã­n opkihs4bpr funambulsense hola â cuã ntenos quã situaciã n se presenta y en sector de medellã­n"
"2016-09-29","tecnoautos","independiente medellin medellã­n â pensando en cambiar a leonel ã lvarez enlaces imã genes videosâ aj5t3fnugv"
"2016-09-29","tehatsu","hello breakfest festival medellã­n we are so excited gã nate de los pases dobles para este sã bado tã mate ltljzuwaxb"
"2016-09-29","tejiendoentelar","como usar uber medellin todo lo que debes tener en cuenta w9ibhgyhna vã­a themaxterpc"
"2016-09-29","telemedellin","esta noche en puntodegirotm conversamos sobre los retos del posacuerdo para medellã­n vez nos vemos desde las pm â te esperamos wmiaktxgbf al aire noticiastm choque entre dos buses en el barrio la floresta de medellã­n dejã lesionados va1mprvarw cmqkxawcsh"
"2016-09-29","tennis_result","caio zampieri beat alejandrofalla in the quarter final at medellin atpchallenger tennis"
"2016-09-29","uninoticias","nuestros periodistas mayepri clementealvarez y lav_arroyo estã noche en medellã­n premiogabo duygblhikh"
"2016-09-29","vicentedemivida","se entregã el mã ximo cabecilla de â la terrazaâ medellã­n gfg7d7vpbv jfqaxv4vhq"
"2016-09-29","wsjforero","liev schreiber from spotlight aka marty baron washingtonpost is celebrated in medellin colombia where he speaks at journo forum cxh4hvuhei"
"2016-09-29","yeisonsgarciat","parque de los deseos medellin yeisongarciatibaquicha colombia edificio parqueâ si77bo6xoo parque de los deseos medellin yeisongarciatibaquicha colombia edificio parqueâ dz7pjscgff"
"2016-09-29","yoopinoyqu","video concejo de medellã­n entregã su mã xima distinciã n al comitã olã­mpico colombiano el homenaje se efectuã g2cwhy6lnv"
