"date","username","tweet"
"2018-12-24","vivirpoblado","atardecer decembrino en medellã­n vista desde las cã maras del siatamedellin olddxdfqse"
"2018-12-24","vivona_lopez","uno viene a medellã­n recordar cuanto odia peã alosa te amo bogotã â ï no cã mo el impedido de alcalde que tienes ðÿ"
"2018-12-24","wasgyofx","medellin va muy adelantada en este aspecto solo falta una cosa sacar lo carros del centro el sistema de transporte pãºblico ya da para dar ese paso feliznavidad"
"2018-12-27","addkerberos","estando en el parque norte me doy cuenta de un fenã meno ãºnico medellã­n debe ser la ãºnica ciudad mundo que las mujeres preciosas le toman fotos a los gurres sus mozos"
"2018-12-27","andruduart","quien esta interesado de viajar maã ana para uraba carepa me escriben tengo cupos libres whatsapp â en medellã­n iu2rgborck"
"2018-12-27","brazzabrat","medellin___ tu parles mal azi jâ boude"
"2018-12-27","carlosamoralito","por estos dã­as a medellã­n con este clima solo le falta el mar 371ismem5k"
"2018-12-27","chesanti18","medellã­n â ï opkveyxsqv"
"2018-12-27","cielomontoya3","crisrojastovar alejopalaciores danielsampero fueran ejemplo por favor cuã l ciudad d colombia tiene el avance y calidad vida medellã­n venga conã zcala despuã s opinaðÿ â ï mientras tanto ðÿ"
"2018-12-27","genio724","lcvelez tal cual en medellã­n estamos inundados taxis particulares buses motos que vaina"
"2018-12-27","iquehaz","no saben las ganas que tengo de regresar a medellã­n"
"2018-12-27","juliano_bau","david gonzã lez do independiente medellã­n foi o goleiro com mais defesas difã­ceis na liga colombiana realizadas colombiano de anos e m ficou jogos sem sofrer gols total partidas campeã valor mercado transfermarkt mil euros ppxqwl6luo"
"2018-12-27","katty97461795","la verdad como estã medellã­n creo que nos va tocar defendernos por nosotros mismos ya administraciã n ni justicia apoya pero tambiã tengo claro violencia trae mã s"
"2018-12-27","lebonflowrecord","medellin___ mdrrr je ne m'y attendais pas"
"2018-12-27","lionheart_david","tarde en familia jardã­n botã nico y por ahã­ un dinosaurio xd de medellã­n 43mvdrk6tw"
"2018-12-27","luisyepesb","el de diciembre alertã sobre este punto en la cerca a construcciã n metroplãºs medellã­n emvarias lo atendiã al otro dã­a asã­ estã hoy gente no colabora alcaldiademed soymalala 9r6hc8qll8"
"2018-12-27","lvz28","___aleexandra â estã s en medellã­n"
"2018-12-27","maevabeyy","les putes de medellã­n ont kiffã ma kekette"
"2018-12-27","ossa_g","petrogustavo el transmicable no es ni de petro peã alosa todos los bogotanos que pagamos impuestos ademas hay mucho celebrar cuando hasta ahora tenemos uno mientras en medellã­n ya tienen metrocables con metro y tranvã­a incluidos â la verdad estamos muy quedados"
"2018-12-27","ramiro150402","todapasion el tã cnico que jodiã a nacional de medellã­n"
"2018-12-27","ramonteria","yoalejov las obras pãºblicas no son de ningãºn caudillo la ciudadanã­a para su uso y disfrute mal muy ese interã s por personalizar el accionar del estado en beneficio menos medellã­n existe fajardocable o salazartranvã­a ahã­ estã diferencia"
"2018-12-27","tripisnat","nd8nytxv3m tripisnat acompaã amiento asesoriadeviajes quehaceren colombia planesen medellin bogota cartagena viaje seguridad guia turismo tours explorarâ hslvd9euoz nd8nytxv3m tripisnat accompaniment traveladvice whattodoin colombia plansin medellin bogotã cartagena trip security guide tourism tours adventure toexplore knowâ 3vik3iocbq"
"2018-12-30","173kally","pre lanzamiento corp en colombia armenia probando el primer cajero bidireccional atm madeinperu corpcolombia medellã­n corp_oficial travellingâ yryd3r9zc0"
"2018-12-30","2arrojas","jaimeflozada la otra diferencia es que a bogotã llega ralea del paã­s tirarse ciudad en medellã­n no los reciben"
"2018-12-30","alejolopezmejia","ivanduque y samuelhoyosm son los tã­teres sin experiencia ni conocimiento para administrar el paã­s su capital perfectos ser manejados por alvarouribevel joseobdulio regreso del cartel de medellã­n paramilitarismo asã­ se llamarã la pelã­cula"
"2018-12-30","alejomde","para los de lejos que tambiã n se las disfrutan por medio mi facebook un pedacito medellin y la musica maã ana infaltable sonora queja negra quiã no ha llorado con este tema 7jbc6pw0oj"
"2018-12-30","andino212","petrogustavo no sos bienvenido a medellin con su ideologia de extrema izquierda y mentiras"
"2018-12-30","artedigitalmcy","la boda de tatiana y jhonattan fotografodebodas noviasdemedellin carrosdealquiler bodas banquetes fotografiadequinces videodebodas medellã­n antioquia â in colombia 7x8unjxxfe la boda de tatiana y jhonattan fotografodebodas noviasdemedellin carrosdealquiler bodas banquetes fotografiadequinces videodebodas medellã­n antioquia â in colombia 1bqxhvolic la boda de tatiana y jhonattan fotografodebodas noviasdemedellin carrosdealquiler bodas banquetes fotografiadequinces videodebodas medellã­n antioquia â in colombia ydu9bxpq1x"
"2018-12-30","betojuan13","lucanu1973 alfredoramosm si vamos a hablar de cã ncer mejor callese que el peor es aman allã en medellã­n uribe ser humano ha habido la polã­tica colombiana alfredoramosm jajaja en medellã­n aborrecen criminales sobre todo por lo q muchos polã­ticos aman al narcotrã fico y paramilitarismo como su padre se valiã de ã ste para hacerse elegir no sea cã­nico que toda colombia sabe tienen a esa ciudad sumida un mar corrupcion fabiortegallego petrogustavo allã no estã n los valencia cossio uribe popeye usugas la oficina de envigado todas esas palomitas son defensoras derechos humanos y medellã­n entera es estrato"
"2018-12-30","bisbalinda","yosoyfanh bogotã es frã­o cartagena mã s cã lido y medellã­n fresco ninguno de los tres tiene el mismo clima pero aquã­ te dejo esta lista reproducciã n que seguro serã muchã­sima ayuda faf8mpyol2"
"2018-12-30","camilosilvaj","de acuerdo estã n bien equivocados del como se hace polã­tica en medellã­n es distinto a la hacen bogotã donde tristemente les da votos acabar con las administraciones pasadas el trabajo otros proponiendo y haciendo"
"2018-12-30","capulettotshirt","camisetas estampadas en medellin para toda colombia acartv camisillas esqueletos screen tipopolo p7hsxneqhr camisetas estampadas en medellin para toda colombia intygrillos colorbia sublimacion tipopolo niã os 6o4imkhani"
"2018-12-30","dalemaos","lasernabogota bueno en tiempos de fajardo el verdadero alcalde medellã­n era don berna la donbernabilidad"
"2018-12-30","devimed","calzada medellin bogotã municipio de copacabana a la altura del retorno no el cabuyal km vã­a despejada calzada medellin bogotã municipio de copacabana a la altura del retorno no el cabuyal km presenta paso restringido por accidente transito transite con precauciã n"
"2018-12-30","dizzykween","lucozadeboi this is what iâ m hoping for i heard bogota a lot colder but idk about medellã­n joemichaelii medellin is a higher altitude i really hope itâ s cooler in medellin than santa marta because wanna wear a cute long sleeve for new years tomorrow and donâ t be stuck another trifling ass tank top like all my pics rv9lots3zv"
"2018-12-30","drchrisstout","medellin colombia livingalifeinfull alifeinfull medellã­n antioquia zgo7qruv8w medellin colombia livingalifeinfull alifeinfull a pico de botella bar ezsl0b46o1 medellin colombia livingalifeinfull alifeinfull parque de los deseos 0vzto2napr medellin colombia livingalifeinfull alifeinfull pueblito paisa medellã­n antioquia chibchombia zmsgcqbucw medellin colombia livingalifeinfull alifeinfull orquidiorama jardã­n botã nico de dznyk8rjln"
"2018-12-30","elespectador","el diseã ador grã fico mauricio ospina entre las vã­ctimas de sicariato en medellã­n vhwnaeigxv amxhljdfy3"
"2018-12-30","estonoescierto","si petro fuera un tris estratã gico tendrã­a aliados cercanos pero autonomos una coaliciã n apoyada por el gana la de medellã­n puede ir pensando en serio llegar a presidencia"
"2018-12-30","evamariasefue_","quã calor tan hijo de su gran puta madre no te extraã aba asã­ medellã­n ni un poquito fo"
"2018-12-30","fagusan","i liked a youtube video yjf404z5n8 hermoso parque en medellin ft eduardo menoni"
"2018-12-30","flamengueiropb","sugestãµes sudacas para o fla ir atrã s caso diego nã fique andrã ricaurte ind medellin nicolã benedetti dep cali lã fernandez fenix rodrigo bogarin guarani mas ouvi dizer q pode ao chile"
"2018-12-30","florezo_andres","alfredoramosm o los que vienen de medellã­n a hijueputear parlamentarias insisto la gente antioquia es buena honesta y trabajadora pero como en todo lugar hay tambiã n no"
"2018-12-30","focus_freedoms","i added a video to youtube playlist pkack0c2wh magical day in medellã­n colombia"
"2018-12-30","hvilla12","eccehomoelkin petrogustavo total mientras petro se dedicaba a hablar en el balcã n de la alcaldã­a con sus problemas administrativos medellã­n construyã tranvã­a un avance impresionante"
"2018-12-30","ingenierocrush","medellã­n estã mas sola que la mayoria de tuiteras"
"2018-12-30","jackelinastridl","anuel just said â œestoy en medellin con la reinaâ ðÿ âœšðÿ theyâ re perfect for eachother my parents omg"
"2018-12-30","jesusortega78","isis_medellin jajaja que buen chiste"
"2018-12-30","jhonperezphoto","mis primeras fotos editoriales en esta temporada medellã­n publicadas ðÿ ºðÿ urban girl magazine fkpvntmvjv"
"2018-12-30","joshalvarado08","a los meses derrepente me entro la locura y dije querã­a regresar medellin conoci comuna bueno en noche ya se imaginarã n el resto ðÿ gmwnstrzjd"
"2018-12-30","juanhenao24","cerro tusa la pirã mide natural mã s grande del mundo medellã­n turã­stico ybaekd5b0v"
"2018-12-30","juanksalazar","camilobota en bunker fiscalã­a general de la nacion medellã­n nst0yjhxoc"
"2018-12-30","juliancobos451","mi medellã­n hermoso y metrodemedellin gracias por su hospitalidad los quiero mucho espero volver de regreso a bogotã con melancolã­a pero las ganas nuevo tu xak4jym3ix"
"2018-12-30","juliedoctors","oiganaestas medellã­n es hermosa hay que motivar a visitarla y resaltar el lema antioquia la mã s educada evitando groserã­as para llamar atenciã n vergã enza quien habla sin pensar desprestigia sus progenitores"
"2018-12-30","katheaguirrecol","sobre el aumento de la violencia en medellã­n y evaluaciã n polã­tica ðÿ"
"2018-12-30","la_bisiesta","estã n estos dos perritos en adopciã los entregan con promesa de esterilizaciã la ojos raros â ï ðÿ es hembra el otro machito medellã­n nqbvzdjfco"
"2018-12-30","larenovacionya","quinterocalle total apoyo el cambio que merecemos queremos de nuevo la medellã­n pujante y envidiable algãºn dã­a fuimos cuente conmigo dr daniel"
"2018-12-30","laurenpti","medellin___ valourde mathildemlv ðÿ"
"2018-12-30","luisyepesb","luces de medellã­n parque norte y zona nororiental u3tieoxlks"
"2018-12-30","maggieep_","i loovveeee the way colombians speak spanish especially ones from medellinðÿ"
"2018-12-30","marcosperales1","bucaramanga con la tarifa de bus mã s cara colombia medellã­n manizales microbãºs bogotã barranquilla cali santa marta ibaguã cartagena"
"2018-12-30","matchtenis","ðÿ ï â ðÿž el antioqueã o dividiã su pretemporada entre medellã­n y cartagena eqjjdqz88n cã mo crees que le irã en debut"
"2018-12-30","medellin_77","vai dizer graus e pro cara feder parado ðÿ µ o vontade de ir pra praia ðÿ â ï calor fdp"
"2018-12-30","miguelitokst","22gstorvalemas josefante cierto de un tiempo aca a medellin han llevado todo tipo orquestas tradicionales nuevas y hecho lo posible por reunir que sonaron hace mucho pero dejaron gran legado musical ejemplo ello el concierto leyendas realizan en abril cada aã o"
"2018-12-30","moniquitir","alfredoramosm carlosfmejia se cansã petrogustavo d adjudicarse obras en bogotã y ya quiere meter su nariz medellã­n quã equivocado como siempre mayorã­a detesta los miserables q ã l han sido beneficiados sin merecerlo a pesar eso son malagradecidos"
"2018-12-30","nass_one","medellin mdr pardon"
"2018-12-30","nelsonarturo3g","petrogustavo bocarejo_jp este tipo estã desquiciado en campaã a vino medellã­n veces decirnos paracos corruptos y asesinos pero quedã virreina quiere copiar todo lo de bogotã gobernar travã s tweets cuando persona no hizo ni mier optzlkgmvk"
"2018-12-30","ramiro150402","2010misterchip libertadoresxfox copalibertadores finalcopalibertadores2018 error y la de que hubo tanda penales entre nacional medellã­n olimpia"
"2018-12-30","realtyofchicago","today we stood at the helipad where pablo escobar turned himself in to national police la catedral was built and designed by it nicknamed club medellã n because had a soccer field jacuzzi bar waterfall traveltheworld"
"2018-12-30","restrepomateo17","reventando medallo brrrrðÿ anuel_2blea _anuel_aa karolgmusic 2sa4c04jk3"
"2018-12-30","rigo_comunes","uriberecuperã colombia y se nota mire como celebran las fiestas en el retiro a minutos de medellã­n paraã­so uribista del centro democrã tico â coã azos madrasos c62e6jev1c"
"2018-12-30","rs_records_med","roger waters is this the life we really want vinilox2 180gr cop disponible en rs records music la tienda de discos carulla del c.c el tesoro servicio a domicilio medellã n y envios gkxaeil5dz"
"2018-12-30","rubenalvarezc","pablovareladdhh petrogustavo generalizar que aquã­ en medellin vivimos la inmunda demuestra su nivel como persona no somos suiza pero definitivamente estamos"
"2018-12-30","santiagotobon","estoy seguro que en las administraciones puse como ejemplo hubo avances medellã­n es mã s moderna y tiene una mayor capacidad para actuar frente a la violencia homicida hay ser crã­ticos pero de manera constructiva el problema no del gobierno ciudad el debate de la polã­tica seguridad hay que desvincularlo las pasiones y los odios cada homicidio duele debe llamar a acciones reflexiã n en medellã­n homicidios se asocian con crimen organizado alguna forma por su parte ficogutierrez recibiã medellã­n con homicidios al aã o y en tercer va a haber fue mala gestiã n de nuevo no necesariamente el contexto conflicto occidente ha sido determinante ejemplo otro ejemplo alonsalazarj recibiã medellã­n con homicidios al aã o y la entregã fue por su mala gestiã n no necesariamente pudo ser porque iniciã guerra entre sebastiã valenciano por ejemplo anibalgaviria recibiã medellã­n con homicidios al aã o y la entregã fue su buena gestiã n no necesariamente pudo ser porque se apaciguã guerra entre sebastiã valenciano"
"2018-12-30","sosomla","story x medellin versus"
"2018-12-30","stephaneosmos","angela_djk mr_ngangoum medellin___ ðÿ strict vã ritã"
"2018-12-30","telemedellin","noticiastm cada vez son mã s los turistas que llegan desde cualquier rincã n del mundo y se llevan una impresiã positiva de medellã­n mncxznc8lg"
"2018-12-30","valentinaho_","ioscarluna pasaras el en medellã­n"
"2018-12-30","vivaaircol","kronos729 â gracias a tiiii por preferirnos el momento solo contamos con vuelos directos desde o hacia bogotã y en conexiã n medellã­n la idea es seguir ampliando nuestra red de rutas lt vuela pronto d"
"2018-12-30","vuhawktalk","bullcityva colombia is amazing did medellin and santa marta tayrona a few years ago beware of the aguardiente"
"2018-12-30","weird_snorky","thinkingaboutc2 medellin___ la raclette ðÿ"
"2018-12-30","ximeconcaconca","alfredoramosm oscartagena medellã­n tiene los pantalones biã n puestos ðÿ ðÿ‘œ"
"2018-12-30","yosoyfanh","bisbalinda bogotã cartagena medellin un aspecto general jajajaja aãºn no tengo bien el itinerario ðÿ"
"2018-12-30","yoyerar","con mauricio conversamos y caminamos por nuestra gran pasiã n medellã­n le inquietaba la ciudad pero a diferencia de mã­ escepticismo tenã­a mejor pronã stico nos habã­amos prometido recorrer sus ojos artista unas balas cerraron su mirada 0lxulqdrr2"
"2018-12-30","zebposada","plein air sketching afternoon with andreduque93 that's the rigging i use etchr_lab and dolicatripods medellã­n antioquia y3barw8wt8"
