"date","username","tweet"
"2018-12-15","moonshinejpn","brunomars which cartel do you belong to medellin cali or guadalajara ðÿ œ jqcav5fjka"
"2018-12-15","ncantioquia","como si nada ladrones atracaron a cuatro personas en zona exclusiva de medellã­n 6jczhcgbnk tpciopfzvb"
"2018-12-15","olgalgonzalezj","mavimejo itm_medellin luisgpatino sapienciamed ficogutierrez alcaldiademed lo que demuestra pãºblico bien administrado con docentes altas competencias y unos jã venes comprometidos su desarrollo personal deportivo acadã mico"
"2018-12-15","oscara0516","alcaldã­a de medellã­n escribe cemã foro en publicidad y pasan el oso del aã o hamaopxfqy"
"2018-12-15","paniaguadanny","i'm at uniã n nacional de limitados visuales in medellã­n antioqia fwqichfocz"
"2018-12-15","pedroperezt","con ganas de estar ya en medellã­n mi cama y el vuelo demorado"
"2018-12-15","reddigitall","impactante video de un policã­a que se enfrenta a dos ladrones y los atrapa en el centro medellã­n jva4tdh6t3"
"2018-12-15","sahiamramirez","mucho niã o lindo en medellã­n ðÿ"
"2018-12-15","soydeituango","video del atraco hoy sabado en el poblado medellin compartir vpvzn7f3xk"
"2018-12-15","sportsgalleryco","nike air wspðÿ domicilios gratis en medellã­nðÿ envã­os a todo colombia ðÿ âœˆï tenis domiciliosgratis medellin compra segura como haces tãº 1xbwakmgag"
"2018-12-15","teovelasquez22","estuve en bogotã visitando a mi novia y amigos me doy cuenta que la diferencia cultural entre medellã­n es realmente enorme felizsã bado"
"2018-12-18","aerobronceado","bronceadoconaerografomedellin presta servicio en la loma los benedictinos envigadoðÿš ðÿš info y citas ðÿ žâ žï wtp3115805809 â bronceadoconaerografo medellin bronceadoinmediato ot08c1jcq4"
"2018-12-18","alejandro_vegan","la triste historia de otro uribista mã s arrepentido el conductor tambiã n denunciã que cuando alcalde medellã­n federico gutiã rrez estaba en campaã a prometiã una reuniã ayudarã­a formalizaciã los trabajadores uber ciudad â bdcq6tdewb"
"2018-12-18","alvaroarango1","recorriendo a medellã­n en tranvia al fondo el cerro pan de azucar oriente la ciudad ficogutierrez alcaldiademed metrodemedellin areametropol luisgpatino davalho manuelvillame 8pbwlsdxcz"
"2018-12-18","catalleresdecba","dayro moreno viene de jugar en atlã tico nacional medellã­n esta tarde firmã su contrato con talleres y es el primer refuerzo albiazul para â w6pq17p0ze o1dlv4httv"
"2018-12-18","contextodiario","el homenaje navideã o a la migraciã n venezolana en bogotã medellã­n y cãºcuta jfyle8gt4q dvtrpfbjqy"
"2018-12-18","daniarbo013","parceros en comuna medellã­n colombia lzbu9zyfg1 con las locas de parceros alcaldiademed en comuna medellã­n colombia tntbrhg0rl con las parceras parceros alcaldiademed en comuna medellã­n colombia mahnsx6nn9"
"2018-12-18","dargel0113","conexion2018 como buen tiburã n solo deseo q venga a el equipo orozco del tolima y chacho castro d medellã­n quedamos listos para un papel en la libertadores"
"2018-12-18","edwbon","gracias medallo por esa octava estrella volveremos pronto otra juniorclubsa wmen81g4le"
"2018-12-18","eldeedeemaraj","medellin___ we proud of a black queen"
"2018-12-18","hahott","palestino independente de medellã­n en santiago revancha el colombia"
"2018-12-18","hotelestodo","viaja con nosotrosâ tranquilo agencia de viajes mayorista hoteles todo incluido cra n â barrio laureles medellã­n colombia pbx whatsapp reservas hotelestodoincluido.com.co rzzwprzv8a"
"2018-12-18","inglowitrust","la diferencia es que yo no ataquã y sin embargo me metieron en un problema ni velas tengo ese entierro cuando mi tweet fue desde hace mes para una queen de medellã­n"
"2018-12-18","itsbryan04","ahora vienen los hinchas del medellã­n a reclamar la liga porque cano hizo el doble de goles"
"2018-12-18","jamesesdelrojo","americaenlared americadecali cuando contraten a jugadores como lizcano del medellã­n regreso al estadio queremos un equipo competitivo y peleando tã­tulos q nos regresen la grandeza por favor"
"2018-12-18","jeorgem3","conexion2018 buenas noches desde medellã­n felicitaciones muy buen programa ricas las intervenciones del sr ã scar renterã­a le pone sabor con los aportes polã mico bien"
"2018-12-18","john53973119","palaciopaula ficogutierrez medellã­n una ciudad ejemplar de colã mbia lã stima la delincuencia q es que se tira todo"
"2018-12-18","juandl84","nacional debuta en la libertadores el de febrero a las p.m caracas o cuzco partido medellã­n serã misma hora"
"2018-12-18","juanvillaarq","diegogallo0810 andreaguerreroq juniorclubsa cdtolima ganas de poner problema por todo la pregunta claramente apunta a los grupos y su conformaciã n nacional medellã­n aãºn no estã en asã­ que caben este anã lisis seguramente otro momento se harã el sus llaves cuando conozcan rivales"
"2018-12-18","kathe_calle","aviatur como hacemos para la expediciã n de voucher en sede poblado medellin que ha dã­as hã biles y calendario del viaje no los mandado todos dicen al otro dã­a nada"
"2018-12-18","kevinto24205066","mvictoria_03 eduardoluisfut juniorclubsa jajaja el es hincha del medellã­n"
"2018-12-18","loupdelameute","medellin___ si"
"2018-12-18","luisvsantaella","ðÿ salamanca0995 â ï encesde stockmodelscol luisvsantaella medellin antioquia colombia model pensaban que era un mito pero aquã­ estoy mã s real el cielo ves a diario ngxkjzrobn"
"2018-12-18","manizaies","ceremonia de transformaciã n del dolor a la luz este viernes en medellã­n qqd8ng9jtn"
"2018-12-18","marifs_9","necesito conocer medellã­n urgente"
"2018-12-18","mariodejessduq2","revistasemana semanarural mi experiencia personal habla de como en los aã os y el municipio medellã­n no me permitio construir mis terrenos dijeron que solo podia desarrollar proyecto ecologico ambiental hectareas"
"2018-12-18","nbrotzmann","diegodeolivos y quedaron eliminados racing por el campeã n nacional de medellã­n boca subcampeã olimpia en mismo momento a cuadras distancia octavos"
"2018-12-18","nosetwittears","el metro de medellã­n ni se vale porque es patio este potrero llamado colombia ðÿ"
"2018-12-18","noti_medellin","ceremonia de transformaciã n del dolor a la luz este viernes en medellã­n idksjaomoy"
"2018-12-18","pipekno1","ahg me dejaron ðÿ â canon canonphoto canonphotography soycanonista canon60d medellin medellincolombia tranvia streetphotography street transport transportationâ cvamtz8ujv"
"2018-12-18","prueba37413910","â no era broma a conductor de uber ya le suspendieron su licencia por aã os en medellã­n secdacgyqc"
"2018-12-18","raulmei70347935","sharonm33927788 bby que rico cuando la hacemos yo estoy en medellã­n hã blame al dm"
"2018-12-18","sebasjimenezph","jorgevillaveces eventstarsww eventstarsjz workingprogress photoshoot photographer medellã­n en antioquia colombia jvrpaufvcs"
"2018-12-18","sileostours","solo sileos tours lo tiene disponibilidad aerea internacional bogota medellã n cali barranquilla manaos lima madrid qsbkv9wndu"
"2018-12-18","smellolucas","conmebol que tinha confirmado na rã dio gaãºcha a estreia do inter contra o river plate no monumental de nãºã ez com portãµes fechados mudou novo ordem dos jogos colorado vai estrear fora casa g4 sã paulo talleres independiente medellã­n ou palestino"
"2018-12-18","tomasdvoretzky","el veintiocho de marzo rosario central va a estar visitando g3 libertad bolivia atlã tico nacional medellã­n deportivo la guaira o real garcilaso 1krkafwiq1"
"2018-12-18","waldorfmyr","medellin___ moi qui lâ ai vu grandir sur la 1ere ta mãªme tete ðÿ medellin___ omg tu lui ressemble de ouff et jcrois jtai deja vu sur sa story ðÿ canon medellin___ mais t pas la cousine a kelly"
"2018-12-21","alejandrommt1","cortuluaoficial hijos de puta no son bienvenidos a medellã­n"
"2018-12-21","alethewolf","pleyadianos arctuarianos andromedanos ã â iluminan mi mente ðÿ œðÿœ real boy swag colombia medellin medallo traveler venezuela raiman en medellã­n antioquia zjah1x5jtt"
"2018-12-21","alidobus","caracolradio la mal llamada colombia humana ya llegã a desestabilizar medallo"
"2018-12-21","alxandeer_","juanpa_mt dim_oficial creo q aunque no lo hagan espero eso pase ya la gestiã n se ha notado y dios quiera si cano va sea por medellã­n instituciã puso en mesa que pueden ofrecerle acordã al presupuesto ellos manejan"
"2018-12-21","avior_ops","vuelo 9v1412 procedente de caracas aterrizã en medellã­n a las p.m con una duraciã n hora y minutos"
"2018-12-21","baguilarme","carolondd sebastiangb1209 metrodemedellin en bogotã trate de abordar un trasmilenio y ese momento si le quedan ganas critique el medellã­n la cultura metro es innegable"
"2018-12-21","bartendingking1","views drinks colombian michelada beer with lime and salt medellin via r drinkswithaview rg8qg06ceb y239ojjipw"
"2018-12-21","belargoez","vacaciones swimming natacion en complejo acuatico medellin 5tfiaur5zd"
"2018-12-21","bobseluarpetak","imanqush tak dooo frust dapat gi sebab ticket mahal kalau aku plan awal murah sikit hahaha medellin buat narcos ðÿ"
"2018-12-21","bogotanospor","bogotanos por el mundo medellin final liga aguila alumbrado 4ki7awsbtl vã­a youtube casadelamemoria finalliga2 finalisima juniorclubsa dim_oficial alcaldiademed metrodemedellin seguidores bogota amigos"
"2018-12-21","bombshellcol","h e l oâ b o m s newâ â holiday collection botin negro info âœ wp womenswearbombshell womenswearbs en medellã­n antioquia tder6xphgs"
"2018-12-21","calidezhumana","equipos amp suministros de tecnologã a hogar empresarial contacto wapp direccion calidezhumana.com despachos desde bogota cali barranquilla medellin bucaramanga cartagena cucuta ibague santamarta valledupar pereira armenia manizales inj28nmijj"
"2018-12-21","claragiraldo","como ciudadana de medellã­n lo digo con absoluto respeto pero en serio que hay tener una obsesiã n demasiado grande para gastar toda la plata se estã gastando el edificiomonaco hasta contratar agencia comunicaciones derrumbarlo eso pasa"
"2018-12-21","comercantes","equipos amp suministros de tecnologã a hogar empresarial contacto wapp direccion calidezhumana.com despachos desde bogota cali barranquilla medellin bucaramanga cartagena cucuta ibague santamarta valledupar pereira armenia manizales xybi1fbuzy"
"2018-12-21","cristologia1","en medellin cantan villancicos hasta el.metro pxxdlkryeu"
"2018-12-21","danielacorreapi","para los que no alcanzaron a verse pã jaros de verano en medellã­n cinecolombia estã haciendo un repitis vizcaya"
"2018-12-21","darknoco","me ha gustado un vã­deo de youtube d0lxiktokw masacre alex okendo recibe condecoraciã n en medellã­n"
"2018-12-21","douglasfugazi","hombre bajã a la vã­a del metro de medellã­n y lanzã artefacto explosivo qgt9ccu2fn telemedellin"
"2018-12-21","erijozata","â horror vã­ uno parecido pero en un anuncio de la alcaldã­a medellã­n quã pasa con los comunicadores las entidades pãºblicas"
"2018-12-21","fredynunezd","mi medellã n esta hermosa y brilla en navidadâ ï ðÿž ðÿ para disfrutar las novenas familiaâ 2ï âƒ 0ï 1ï 8ï â 9fn9d91zrl"
"2018-12-21","historiacamino","i added a video to youtube playlist b6ajstjkxt medellin comuna"
"2018-12-21","imanqush","bobseluarpetak tk gi medellin wan haha"
"2018-12-21","infodim","medellã­n no contarã con elvis mosquera en el i 4tmf85ael5 ommbyjtxpz"
"2018-12-21","jaipena","el carro para la vicerrectorã­a de universidad nacional medellã­n costã millones"
"2018-12-21","jhon08156793","viendo fãºtbol total desde medellin colombia"
"2018-12-21","jjmamut","enriquepenalosa no es suficiente para ir a la par de santiagodechile lima medellã­n cali etc donde avanzan como gigante renovando elã ctricos bi y articulados gas o diesel siguen siendo contaminantes pero si el los buses comprados son tecnologã­as obsoletas en europa"
"2018-12-21","juanguaje","mieldeflorez el acento es paisa montaã ero o de medellin"
"2018-12-21","kathe_calle","falabella_co como personas o mã s y sin suficiente aire quecalortanhp medellin"
"2018-12-21","lachaqueteria","paga contra entrega desde whatsapp yfasdjisiu bogota cra 28a 53a local barrio galerias whatsaapp medellin laureles envã­os nacionales no incluye gastos de enviã"
"2018-12-21","laziotirapiedra","monetti loaiza lucumã­ torres bienvenidos al club atlã tico san lorenzo de medellã­n"
"2018-12-21","leoortizd","richizuluaga enriquepenalosa sãºper vã yase para medellã­n y todos felices"
"2018-12-21","luisamev","buenamãºsica hecha en medellã­n para el mundo"
"2018-12-21","luisvsantaella","reconocen el lugar ðÿ luisvsantaella medellin colombia antioquia jeans conociendo con mis de busumer_ adelantã estrenos ðÿž en medellã­n dj7wqfylfv"
"2018-12-21","luisyepesb","pero no detectan las basuras av cerca a la fla medellã­n alcaldiademed emvarias wfuqtstf7q sombras medellã­n hoy 4dz7qhfmfz"
"2018-12-21","maquiavelo61","identifican a policã­a caã­do en cumplimiento de su deber medellã­n bravo perdiã la vida tras frustrar asalto cajero automã tico iqi7cogpll identifican a policã­a caã­do en cumplimiento de su deber medellã­n bravo perdiã la v a3atshdqis vã­a gobernantesver"
"2018-12-21","matheussgomesf","i'm at espaã o medellã­n in rio de janeiro rj zto1h1rrly"
"2018-12-21","melissagarcial","yo necesito que ustedes me digan si en medellã­n ponen toda remix las discotecas y la bailan ðÿ"
"2018-12-21","noti_medellin","la historia de una madre cuidadora y emprendedora medellã­n ab0gr4y78t"
"2018-12-21","papydabs","elerinnawhite medellin___ des paroles claires et limpidesðÿ ðÿ ðÿ‘œðÿ"
"2018-12-21","parrincol","kelly johana jaramillo loaiza juan carlos calle agudelo farid bouhout en serio medellã n tan raro jajaja paisas h 6uyas jajan dm1yhsmde2"
"2018-12-21","reclutamentes","equipos amp suministros de tecnologã a hogar empresarial contacto wapp direccion calidezhumana.com despachos desde bogota cali barranquilla medellin bucaramanga cartagena cucuta ibague santamarta valledupar pereira armenia manizales gqovjyfyae"
"2018-12-21","sai_buu","quã harã­as si tuvieras un caracol con barba detrã s de vos ðÿ œ en selina medellin hpimrfbk5x"
"2018-12-21","salimcure","sebastiangb1209 argiro1961 metrodemedellin medallo es un ejemplo de civismo"
"2018-12-21","samuelalaken","medellã­n bwhcc1qwms"
"2018-12-21","santiagorendon","nuevos alumbrados navideã os de medellã­n sttmed ficogutierrez genteelpoblado vivirpoblado 6iudhdfwb5"
"2018-12-21","sashaxkrwkv","iamtatamille medellin___ tu mâ as mis ko ðÿ je y attendais pas du tout iamtatamille medellin___ ðÿ"
"2018-12-21","sernaandres_","to meet new people always will be a good idea ðÿ ph renteriadirector stylo.caleno colombianmalemodel lifestyle cali bogota medellinâ uxytptwog6"
"2018-12-21","summer_mcs","en medellã­n lima ðÿ o6bd4xfvtm"
"2018-12-21","tendenciacol","âš ï trending topic colombia pm ðÿž selcasforjungkook graciasivã n andrea marmolejo premierxespn nuevacancionfv guacho viernesdeculosenjean independiente medellã­n carlos sierra la feria de cali tendenciascolo1"
"2018-12-21","tobiasesneider","tivimoises manuelortega3 lo que pasa es ese negocio fue asã­ jãºnior daba a toloza y medellin piedrahita los dos sin opciã n de compra"
"2018-12-21","trendinaliaco","metro de medellã­n acaba convertirse en tt ocupando la 6âª posiciã n colombia mã s vmx73owseq nbtezphvn0"
"2018-12-21","tusanagustin","sabemos que toda mujer sueã a su fiesta de quince aã os medellã­n sea una fecha inolvidable cada detalle es importante para tu gran o en san agustã­n tenemosâ ixnsynxp06"
"2018-12-21","valemogo","desde medellã­n esperamos que pronunciaciones como ã sta sean objeto de las respectivas sanciones la legislaciã n nacional e internacional protege a mujeres este tipo discriminaciones y agresiones verbales.respaldamos liga femenina fãºtbol mã srespeto"
"2018-12-21","vendeypunto","venezolanosenelexterior venezolanosenelmundo siguemeytesigo elnacionalweb vendeypunto motivacion softwareadministrativo tierradegracia bogota venezolanosenbogota colombia followforfollow medellin lima peru numox4zgex"
"2018-12-21","willintona","pirryoficial en medellã­n tambiã n compraron votos para duque"
"2018-12-21","wilsonr_18","se le va a uno la vida en los trancones de medellã­n ya no hay por donde movilizarse"
"2018-12-21","yoeldelafoto","buenas noches medellã­n rwq3ojyj6f"
"2018-12-24","alejofranco16","muy fan de la gente que dejã el regalo mamã en medellã­n y ya le tocã bajar a toda mierda por yo"
"2018-12-24","alexbar20225721","se aparece un ovni en medellin antioquia saludos n6t1hbfv5s"
"2018-12-24","anamaria_palaci","ðÿ en medellã­n antioquia f3w22mli2p"
"2018-12-24","asmelamaya","paga tu boleta yaaaaaaa aestahora envivo ãšltimahora riohacha laguajira cesar rifas la nueva ola plan navideã o para que te ganes una hermosa y lujosa ford escape â xlt modelo jugara este de diciembre con el premio mayor loterã­a medellã­n sin serie 2ogwxea1hg paga tu boleta yaaaaaaa aestahora envivo ãšltimahora riohacha laguajira cesar rifas la nueva ola plan navideã o para que te ganes una hermosa y lujosa ford escape â xlt modelo jugara este de diciembre con el premio mayor loterã­a medellã­n sin serie czytkf0heo paga tu boleta yaaaaaaa aestahora envivo ãšltimahora riohacha laguajira cesar rifas la nueva ola plan navideã o para que te ganes una hermosa y lujosa ford escape â xlt modelo jugara este de diciembre con el premio mayor loterã­a medellã­n sin serie m1weisuxij paga tu boleta yaaaaaaa aestahora envivo ãšltimahora riohacha laguajira cesar rifas la nueva ola plan navideã o para que te ganes una hermosa y lujosa ford escape â xlt modelo jugara este de diciembre con el premio mayor loterã­a medellã­n sin serie tauxisrnma paga tu boleta yaaaaaaa aestahora envivo ãšltimahora riohacha laguajira cesar rifas la nueva ola plan navideã o para que te ganes una hermosa y lujosa ford escape â xlt modelo jugara este de diciembre con el premio mayor loterã­a medellã­n sin serie fk8clrj2zm"
"2018-12-24","barberiamanila","acaba de publicar una foto en medellã­n antioquia b3bigwpfzb"
"2018-12-24","bodainolvidable","con mi corazã n dividido hijos en chile sobrino argentina amigas y amigos ecuador perãº montevideo espaã a medellin no es fã cil pero la fe certeza de verlos pronto felizâ 1qmil4ch6m"
"2018-12-24","champerap","prende ðÿ tu rumba ðÿ’ƒðÿ ƒðÿ ºðÿ con mis dos nuevas champetas 1ï âƒ lapera 2ï isabella 24dic colombia feliznavidadcartel felicesfiestas venezuela barranquilla medellin copalibertadores bogota cali feliznavidad le desea el salvavidas del gã nero yhglgrjvq0"
"2018-12-24","circles_k","king_suqu medellin cartel was bad"
"2018-12-24","daleyf_","infodim mauroramirez_7 asodeporcali como besa y siente la camisa del medellã­n lo dudo feliz navidad"
"2018-12-24","daveorjuela","fiestas y alumbrados en medellã­n 6hi5tgegtf"
"2018-12-24","devimed","calzada medellin bogotã municipio de rionegro a la altura del puente playa km presenta paso restringido por accidente transito transite con precauciã n calzada medellã­n bogotã municipio de marinilla a la altura el cordobã s km presenta paso restringido por trabajos en vã­a.transite con precauciã n"
"2018-12-24","dmaurozg","jerojasrodrigue saludos especiales en esta navidad mauricio zapata desde medellã­n"
"2018-12-24","dolenec_silvana","reposted from paoespanapress sorpresanavideã a en medellã­n maluma teammaluma q95dhyrwug"
"2018-12-24","edwinri39744156","enriquepenalosa soy de medellã­n pero se ve que a estos bogotanos no les gusta absolutamente nada malo porque boga y"
"2018-12-24","elcolombiano","video chanclas interiores entre otras cosas son algunos de los artã­culos que no se deberã­an regalar en navidad segãºn habitantes medellã­n ksatrhivso"
"2018-12-24","elkinrios12","figuerjoda abucaramanga no el joven se aprovecho de la llamada del bucaramanga y medellã­n para buscar un marrano con mejor contrato le llego amã rica"
"2018-12-24","emirwar","acaba de publicar una foto en medellã­n antioquia d0kfwfrdtv"
"2018-12-24","felipepuerta16","luisomartapia igual para ti y los tuyos un abrazo desde medellã­n colombia"
"2018-12-24","frankmaflauone1","bandadeportiva asodeporcali pachovelez10 dufielebron josevalenciacl charbermudez pedronolascopr twiteroscali rrdelcastillo1 desde cuando los presidentes de cali y amã rica son paisas uno hincha del medellã­n otro nacional por eso es que equipos la comarca estã n como estan para esos culebreros todo negocio una completa pena verdad"
"2018-12-24","gabrielpelaeza","pasion_poderosa germancanoofi german en la vida no todo es plata.en ee.uu usted va a salir calle y nadie lo reconocer cambio medellin por donde salga encontrar gente que quiere mucho"
"2018-12-24","gutiarts","passion for culture comunart crece ðÿ šðÿ ðÿž en medellã­n antioquia 0f2xodtqbv"
"2018-12-24","helena77hdez","desde mi balcã n esperando la familia ðÿ medellã­n ðÿ’šðÿ’šðÿ’š omi7ycouwf"
"2018-12-24","jaivisacolombia","iguowqfcwx en medellã­n antioquia dq6ckc1vzl"
"2018-12-24","jaymegutiez","segãºn una investigaciã n hecha por mã­ envigado aplica para medellin estã frã­o porque se fueron las fincas todos los abusadores de combustibles fã siles quedamos poblaciã menor sinfincas y agripados"
"2018-12-24","karana640","cleen_rock_one inkmaster steventefft medellin_tattoo djtambe joshpaynetattoo joeyhamiltontat lol rock i did if teej would have done more line work in the helmet and faced scales right he would've won tony lines are always wonky btw your son's very handsome proud papa"
"2018-12-24","lacaballero","a veces me gusta el brillo ðÿž â en medellã­n antioquia uepsmtnyxb"
"2018-12-24","laempanada27","ðÿž feliz navidadðÿž ðÿ merrychristmas merryxmas en medellã­n antioquia asdpejttoi"
"2018-12-24","lamine_amaadou","medellin___ postbyob â"
"2018-12-24","lesliemars48","que en el prã ximo aã o pueda ir a medellã­n y mã xico amã n"
"2018-12-24","lucyenforma","esta es nathali sossa de medellã­n z0tjwdspwi"
"2018-12-24","manue_agudelo","mi primer regalo de navidad ðÿž amycake021 en medellã­n antioquia shfkm4rr3z"
"2018-12-24","medellin_jose","skeletonspoon betospotify but thatâ s fine if you donâ t want to see that just go around labeling people for their mistakes it makes look like a ugly fruity pebble skeletonspoon betospotify lmao everyone neglects the good he was becoming heâ s not a homophobe for beating dude up looking at him while changing itâ easier to say you wouldnâ t do shit than actually be in situation that makes very uncomfortable"
"2018-12-24","moniquitir","tomsernao jbagbam74 metrodemedellin quã orgullo mi medellã­n y su gente que nunca se pierda la cultura metro digna de ser imitada"
"2018-12-24","mori_medellin","mueren en accidente de helicã ptero martha ã rika alonso y rafael moreno valle que dices al respecto lopezobrador_ conveniente despuã s no quedã tu candidato kjl9aoaemf vã­a lopezdoriga transformaciã nde4a"
"2018-12-24","nosoydaniela__","vivo mã s o menos cerca del rio medellã­n y en un piso a media noche me llega olor de mil cadã veres proveniente ese rã­o gas odio todo"
"2018-12-24","personeriamed","ðÿ ºi navidad en medellã­n donde todos contamos i persoyoutuber qt47iuehdw"
"2018-12-24","riclargo","medellã­n ðÿ tmvxmh6xdk"
"2018-12-24","rirestrepo","noguerastiv matadoreltiempo chrigarces medellin paga las consecuencias de un atarban que siendo gobernador le dio por armar la poblacion civil y llamo convivir si con delincuentes extorcionan roban cobran vacuna los pagamos luisalf82940568 giordanobrunofi andrstrece el tibio que hizo en medellin la bernabilidad claro gobernaba con don berna socio del narco paraco terrorista uribe y de carlos restrepo caidadelatorre quieren armar la poblacion y eso es lo que en medellin se paga dejaron las convivir por el narco paraco terrorista uribe ahi los tenemos haciendo toda clase de delitos entre ellos vacuanas desalojos contravia giordanobrunofi recuerden que asi empezaron las conviivir en antioquia y especial medellin miren todo lo llevamos no nos hemos podido liberar de ellas son extorcionan los barrios a cuanto negocio vivienda encuentran"
"2018-12-24","rumbosjace","happy day christmas thanksgodðÿ ðÿ âœœ diostueresmiguia blackandwhite monday usa medellin colombia medellã­n antioquia ixksf7rmuj"
"2018-12-24","selenit321","medellin jimã nezðÿ ðÿ dy4pnfrtd7"
"2018-12-24","solojenifers","tinojaramillo acostavillada falta de respeto la ustedes con el paã­s si salieran burbuja un poco se darã­an cuenta que dos gallos en una flota va para pueblo es algo muuuy comãºn â iba granada meta no medellã­n"
"2018-12-24","soydeituango","medellã­n a esta hora desde el barrio manrrique y pm luisyepesb medellã­n a esta hora desde el barrio manrrique santa cecilia y de la tarde roures1 ece9cda9ho"
"2018-12-24","sr_clonazepam","i'm at mercado melchor ocampo medellã­n in cuauhtemoc df eeknrejf5v"
"2018-12-24","sttmed","sepulveda_918 hola santiago en medellã­n rige la medida av.regional â saludos elkreyes hola elkin en medellã­n se realiza una fotodetecciã n por jornada â saludos"
"2018-12-24","therealfunkee","die galletas festival limã n sind mit dem speedboot direkt aus medellã­n in mein testlabor fã r diese kurze review gekommen sie punkten hã bschen keksen und einem niedrigen preis aber erwartete kã nstliche zitronencreme eine verpackungsflut trã ben das gesamtbild bhsibnjnyb"
"2018-12-24","vasquezdonpaisa","si se voltean solos soy un gran chef paisa medellã­n antioquia gcoeualv26"
