"date","username","tweet"
"2018-12-03","soydeituango","impresionante el evento de ayer domingo diciembre por las calles la comuna medellin ca6yat0pzc"
"2018-12-03","sportsgalleryco","fila ðÿ wsp domicilios gratis en medellã­n envã­os a todo colombia âœˆï tenis domiciliosgratis medellin compra segura como haces tãº toma 8ibpxgc0pq"
"2018-12-03","sttmed","motociclistas se movilizaron por la seguridad en las vã­as de medellã­n compartimos noticia teleantioquia 0xbxk1ylch"
"2018-12-03","sumadima4","que tan cierto es si saque mi cuenta del banco bogotã en medellã­n solo la puedo cancelar misma ciudad nonecesitotuaval"
"2018-12-03","sumariuminfo","el â œnarcoturismoâ que mantiene vivo a pablo escobar en medellã­n dmbwpmtahv qwrldd3urp"
"2018-12-03","tatetattooart","great horned owl espero les guste realizado en la familia tattoo medellã­n calle 44bsur 42b03 apto ed portal de barcelona barrio paz envigado bajando loma canchaâ zjtimcejao"
"2018-12-03","tatianacg17","medellã­n es tan lindo parce ðÿ"
"2018-12-03","telemedellin","noticiastm revisan sitio para estaciã n de transferencia basuras en medellã­n bnxx613b9q"
"2018-12-03","terminalesmed","viaja desde terminales medellã­n sigue la ruta de seguridad unviajedecosasbuenas ðÿ žðÿšƒ wrjvmdajow"
"2018-12-03","tiatoldyouso","i need to hear medellin on sunday"
"2018-12-03","uvalpochile","uv presenta su oferta de postgrados en colombia fue parte del stand chile la expo posgrados bmi medellã­n bt0j2cobue"
"2018-12-03","valentina020103","me quiero ya en medellã­n pero que pereza alistar maleta"
"2018-12-03","vane02525475","kimberlyloaiza_ juandedios_p te gustaria ser madre en realidad amas ah juan saluditos desde medellin los amoðÿ ðÿ"
"2018-12-03","vichbedoya","exijo un estudio serio de cuantos miopes habemos en medellin gafufosalpoder"
"2018-12-03","wgomezarango","hoy antioquia registra homicidios de enero a octubre medellã­n tiene un ã­ndice homicios por cada 100mil habitantes ituango caucasia y tarazã fuente policiacolombia noscogiolanoche"
"2018-12-03","widaloba","josã ordã ã ez con las horas de chistes desde medellã­n dã­a 8gnkt2anat"
"2018-12-03","wilpego","realsociedad gorkaelustondo fuerzagorkaelustondo desde medellã­n se le apoya y respeta meses van en un abrir cerrar de ojos lo importante es recuperarse bien"
"2018-12-03","yadalyuribe","ðÿ µðÿ œðÿ’ªâœœï vamos medellã­n etgucq9baa"
"2018-12-06","_quesadinho","mon enfance ã medellã­n câ tait comme a avec des coups de matraque dans le dos"
"2018-12-06","adanyosefrv","bien ridã­culo y mal escrito pero con todo el feeling porque ya casi la vuelvo a ver â ï medellã­n antioquã­a colombia lkzgkjemru"
"2018-12-06","aj0ta","muriã belisario betancur el que le mezquinã a bogotã la posibilidad de tener metro por dã rselo medellã­n"
"2018-12-06","albertomiramora","tbt la reconocida banda italiana de metal sinfã nico rhapsody estuvo visita en ciudad medellã­n fue el martes enero para recordar este concierto los invito aâ 8y7ekhrmni"
"2018-12-06","alesuara13","casa en venta belã n rosales medellã­n antioquia colombia qwr1eqwb7s"
"2018-12-06","anavgu","mami conociendo otra parte de medellã­n"
"2018-12-06","andresriac1250","josejorge13co stp3572 noticiascaracol se tumbã el metro de bogotã para dã rselo a medellã­n no hizo las escuelas y hospital que prometiã cuando decidiã declinar del mundial respecto lo armero ã l ivã n duque padre hicieron caso omiso la magnitud tragedia le habian advertido parecia exagerado"
"2018-12-06","angelamariac87","ficogutierrez alcaldiademed buen programa seã or alcalde pero lamentablemente aãºn hay niã os que se mueren de desnutriciã n es decir algo nos estã fallando lamentable este aã o hayan muerto literal hambre en medellã­n"
"2018-12-06","angesilvaj","los de la oficina medio me explotan pero al menos llevan a pasear medellã­n ðÿ"
"2018-12-06","aranguito16","este aã o damos la vuelta con el medellã­n ðÿž 7âƒ â­"
"2018-12-06","astridzugi","siempre medellin luciã ndose"
"2018-12-06","aviancaescucha","ggoyret gaston el tuvo demora de minutos debido a revisiã n tã cnica del aviã asignado en uno sus vuelos previos ocasionada por factores externos tu seguridad es nuestra prioridad ello hacemos estos controles favor dinos si ya estã s medellã­n estaremos atentos"
"2018-12-06","cementos_argos","a su regreso medellã­n jorge arango hizo adoptar la figura de aquel obelisco con leves modificaciones como logo compaã ã­a hoy conservamos esta idea logotipo que surgiã hace mã s aã os y hemos crecido hasta llegar consolidarnos en paã­ses ðÿ i7jseeklyd"
"2018-12-06","claudiaarango","un consejo gratis si viven en medellã­n y manejan vehã­culo consulten constantemente la pã gina de sttmed tiene fotomultas pendientes ayer me llegã el cobro jurã­dico una infracciã n que cometã­ mayo"
"2018-12-06","clubtiburonesfb","nuestra filial sub15 se prepara con miras a su prã xima participaciã n en la ediciã de medellã­n soccer cup colombia âš ï ðÿ vibraenmiserðÿ µðÿ ˆ n3kmsatsou"
"2018-12-06","cmilanoticia","con bloqueos de vã­as cã ntricas medellã­n se realizaron concentraciones estudiantes o5x4qd9er6 gobxpjdbec"
"2018-12-06","coatcomposites","heliodoptero muere belisario betancur uribistas favor abstenerse de sus comentarios jocosos sobre las farc que mientras ã l gobernaba su uribe trabajaba ya sabemos para quienes en la aerocivil luego tener ser destituido alcaldã­a medellã­n por nexos con el narcotrã fico"
"2018-12-06","conduzcamos","navidad amor hogar familia familiaconduzcamos medellin ðÿ wtrkyhlhte"
"2018-12-06","confiamosjunior","estã claro que el medellã­n debe pagar todo y cada uno de los insultos han lanzado sus hinchas en estos dã­as sobretodo rafael linares perro sin sangre ese"
"2018-12-06","coronel_delia","me ha gustado un vã­deo de youtube wbnpn5e4t0 el ciclopaseo mã s grande latinoamã rica por medellã­n colombia"
"2018-12-06","curlsquatrack","gopro mtb downhill challenge medellã­n with sam pilgrim and nicholi roga nvd7xrotou via youtube"
"2018-12-06","cvalenzuelae","disponen del bus de hacienda para pagar impuestos en medellã­n colombia vã­a alcaldiademed urh7ljndjq"
"2018-12-06","debbymnzo_is","dabeanns medellin___ yâ a des gens bizarre layyy perso moi je prend plus la ligne en tout cas quâ il ose me toucher"
"2018-12-06","devimed","calzada medellã­n bogotã municipio de marinilla a la altura el cordobã s km presenta paso restringido por trabajos en vã­a transite con precauciã n calzada medellã­n bogotã municipio de el santuario sector llanerito km vã­a despejada calzada bogotã medellin municipio de marinilla sector vestimundo k vã­a despejada calzada bogotã medellin municipio guarne km sector el chaparral vã­a despejada calzada medellã­n bogotã municipio de copacabana a la altura piedras blancas km vã­a despejada via calzada medellã n bogotã municipio de bello a la altura eds los angeles no presenta ninguna novedad km"
"2018-12-06","dhf05","omarflorezisaza merecumbiandofu ficogutierrez alcaldiademed por eso medellin ejemplo universal"
"2018-12-06","diegoguty1998","me ha gustado un video de youtube predicciã n â medellin le ganara a junior el partido ida camilo md 2ivkb4yt4g"
"2018-12-06","diegoojeda85","medellã­n de mi vida ðÿ aob78hmcgk"
"2018-12-06","directvsportsco","si junior tuviera que cobrar un penal este sã bado en el partido contra medellã­n â quiã n deberã­a patearlo responde con ht futbolasidirectv hjj7wcsjun"
"2018-12-06","dolly83388860","la_negociacion angelicalozanoc cinemaparaiso estoy en medellã­n donde la puedo ver gracias"
"2018-12-06","edwin_r_c","juankamilomarin ludelpilar pauliina_mejia no hay problema que tal lucã­a venga a conocer medellã­n y le pase algo nos daã la imagen vendemos de ciudad"
"2018-12-06","emmaarmengod","â œeste libro es mudoâ em diuen dues nenes de anys la floresta œmudo œsã­ sin letrasâ œy que podemos hacer œponerle nuestra historiaâ i aixã­ hem anat fent medellin ehqfirocys"
"2018-12-06","gabrielvanegas","hoy en bppiloto se lanza luminiscencias una exposiciã n sobre fotografã­a emergente medellã­n fotografas y fotã grafos comparten sus obras shirleymzuluaga e_duperly mammedellin fqt33wllxe"
"2018-12-06","hborreroguitar","organizando los juguetes en busca de inspiraciã n este diciembre lovellmusiclab mountainracks timtravelling hborreroguitar medellã­n antioquia fqtex3lw69"
"2018-12-06","holguinmc","pronto salimos con este video ecdmâ ï ðÿ cubanrecord afdvargas elcombodemedallo medellin hiphop trap jose cuban record juan david muã oz herrera ley homa delgado sanchez tupa cardona marky mel allbe gv andres villa alfredo vargas qsjmhqhuv3"
"2018-12-06","i95svelez","acrossjoel es que acã en las veces han venido no bajan un poroto por mã s estã n calmadas y asã­ o sea solo pasa bogotã porque medellã­n si bajaron como allã tipo nos odian ro te juro"
"2018-12-06","ichbinbarretor","rabodeajip donjediondo aunque no queda propiamente en medellã­n el parque los salados es muy bonito apenas para asados del de enero"
"2018-12-06","itbigboss","en este vã­deo te enseã amos cã mo crear marcas de tus productos â quieres saber mã s visita nuestra pã gina web q4rvdwarms o contacta a asesora medellã­n alisson calle bqelhjcvm9 en este vã­deo te enseã amos cã mo crear marcas de tus productos â quieres saber mã s visita nuestra pã gina web q4rvdwarms o contacta a asesora medellã­n alisson calle ogobspg4ay"
"2018-12-06","jdvalde","aprovechamos para hablar con la gente sobre importancia de las plantas tener una medellã­n mã s sostenible rhkmafyq2n"
"2018-12-06","josehenaol","policiacolombia alcaldiademed favor ayudenmen a encontrar esta perra beagle que se acaba de extraviar en el centro medellã n la av playa con palo difundir dgnyfuj9z8"
"2018-12-06","josgmontoya","nos fuimos bueno pero igual deja tus mensajes que maã ana los responderemos todos vive puffeados vivepuffeados estilo comodidad relax puff medellã­n cali bogotã bucaramanga colombia cartagena um2g2dcsix"
"2018-12-06","lagranderusty","medellin_tattoo tifferwright great to see you guys didnâ t break last night now time take it on home"
"2018-12-06","lariis_ferr","matheusp3drotti vamos pro medellã­n agr"
"2018-12-06","latutumontoya","numeral767 buenas noches me podrã­an decir el estado de la carretera medellã­n necocli gracias"
"2018-12-06","mauricionerid","monikhin betogallagher es una conexiã n extrasensorial con medallo para los que hemos estado ahã­ âœ"
"2018-12-06","meappunto","acompaã amos a la bppiloto en inauguraciã n de exposiciã luminiscencias fotografã­a emergente medellã­n arte meappunto ggxo6aoycy"
"2018-12-06","memogomezfoto","roque_guel mafe_garrido son a mã s el envã­o si es fuer de medellã­n por mensajes se decide gracias"
"2018-12-06","mentiratuverdad","hace aã os vivo en medellã­n y nunca entendã­ de que se trata el dã­a las velitas"
"2018-12-06","mono11486206","numeral767 buena noche cual es el estado de la vã­a ibaguã a medellã­n"
"2018-12-06","natscorrea","ticking away time medellin nofilterneeded museoexplora parque explora 5lys1zxzjp"
"2018-12-06","noti_medellin","alumbrados de medellã­n estã n entre los mã s â œimpresionantesâ del mundo usa today q2zmgasj3h"
"2018-12-06","officehomedesi","new post itâ s not about how to achieve your dreams live life if has been published on cortinas y persianas en medellã­n office home design b7daxox0hv kxcitk8qt6"
"2018-12-06","paisandolabien","somos paisandolabien socialmedia academia baile bailar bailaconmigo bailandoadomicilio dancingdelivery bachata kizomba salsa salsacasino salsaenlinea medellin medallo antioquia paisa colombia fjgncwvnjj"
"2018-12-06","paniaguadanny","i'm at corralito burguer in medellin antioquia 6scumoc2cw"
"2018-12-06","perezalejandrol","medellã­n me espera jajajaja xd frgbs5cr9d"
"2018-12-06","probioair","gopro mtb downhill challenge medellã­n with sam pilgrim and nicholi rogatkin 2be9ayexui staged 5lgzzl7g89"
"2018-12-06","rabodeajip","la sobreviviente una paloma de ã poca belisario que sigue en las calles medellã­n kqcxc1kuny"
"2018-12-06","rafael2696","augustoocampo belii betancourt se llevã a la tumba verdad sobre situaciã n del entonces alcalde de medellã­n al cual destituyã fulminantenente por narco.el mismo taita duque lo advirtiã el palacio justicia con procesos destruã­dos y magistrados muertos ylddujv5bo"
"2018-12-06","reustashai","biloul62 medellin___ je prã fã re pas me prononcer biloul62 medellin___ sah jâ vais pas jouer le coeur meurtri mais les hommes vous ãªtes vrm des ordures biloul62 medellin___ pose pas de question yaura rã ponse"
"2018-12-06","ruta_n","los buenos resultados se comparten y juntos podemos lograr mucho mã s por medellã­n alcaldiademed acimedellin bureaumedellin plazamayormed w1noe6tszd"
"2018-12-06","seguridadmed","con el planconfianza buscamos fortalecimiento del equipo humano de los organismos seguridad y justicia medellã­n la policiamedellin ejercito_div7 fiscalã­a seccional se benefician este programa para potenciar construcciã n confianzaciudadana fxpyjlxhri"
"2018-12-06","shots4days","could barely contain my excitement ðÿ žfrom meeting pabloescobar older brother robertoescobar narcosirl legendsneverdie medellin colombia 8lgurcbyfv"
"2018-12-06","simonvargas311","athziricasandra colombia medellin"
"2018-12-06","soyafroman","me ha gustado un vã­deo de youtube q4uzudvff7 comida colombiana vs venezolana ðÿ medellin"
"2018-12-06","sugarmeli","es medellã­n por cierto"
"2018-12-06","t_suarez22","yo soy agua tatiana suã rez elpoderdelosimple soundhealing ekã nta reiki cristales colombia cantosanador terapiasalternativas sonidosanador tatianasuã rezcoach medellã­n pnlâ ofitu9kmwa"
"2018-12-06","thamaproducer","me ha gustado un vã­deo de youtube n2jvseemka estudio tovarecords medellin colombia"
"2018-12-06","thesuperboring","â quieren incomodar organicen marcha el de diciembre a eso las 00pm en nortr bogotã la zona comercial medellã­n con tanta gente bien comprando no creo que esmad caiga tan violentamente"
"2018-12-06","thisisbrayan","este domingo estreno del filminuto paisaman pendientes no se lo pierdan en mi canal de youtube hã roes mar el medellin paisa colombia bogotã desdeâ emandvxofs"
"2018-12-06","tropitalonline","gastronomic railroads private day tour from medellin colombia vkqtzqrxtd by int_travelers travelblogger history"
"2018-12-06","tuinfocompra","en venta nueva versiã n cc de illustratorâ con instrucciones instalaciã y activaciã envã­o digital sin costo adicional vtt60m0wqo illustrator cc2019 colombia bogota cali medellin cartagena barranquilla bucaramanga cucuta renf0pmu9y"
"2018-12-06","violetamarcela","medellã­n me estã tratando demasiado mal con ese frã­o que haciendo ðÿ"
"2018-12-06","yulbotero","en minutos los espero conectados con nuestra secciã n de entretenimientoteleantioquia durante todo el mes vamos a recorrer parques medellã­n para mostrarles alumbradonavideã o pedientes teleantioquia hoy desde manrique parque gaitã epmestamosahi vavwttc2dj"
"2018-12-09","acevedomapu","sin medallo"
"2018-12-09","alejoleon17","â quã alegrã­a me da por este crack cuando llegã al medellã­n muchos dieron su carrera acabada y aseguraban que debã­a dedicarse reggaetã n hoy el dueã o de la magia quedã grabado con letras oro en historia river plate eres enorme juanferquinte10 gkpxlnqscs"
"2018-12-09","colonia_colvenz","gracias por asistir a nuestra master class de zumba normischuchu ariamh745 y hendervalles dieron lo mã ximo en medellã­n antioquia 68wnfhyqbl"
"2018-12-09","didiho511","claudialopez medellin ejemplo universal"
"2018-12-09","edilber31236273","risalocahumor juanferquinte10 risa loca le va tocar que medellã­n traiga a quintero para la final con junior"
"2018-12-09","enfotosmedellin","nuestra ciudad es extraordinariaðÿœ viste este atardecer ðÿ â foto fotografia paisajes medellin city lifestyle medallo colombia enfotosmedellinâ w7kaf83aur"
"2018-12-09","felipe_majo","ðÿ asã­ se vive la navidad ðÿž en mi bella ciudad pereira medellin bogota cali feliznavidad nochedevelitas alumbradonavideã o jaiime_oficial aparato_12 art_balloon_pereiraâ hi5dyrizoz"
"2018-12-09","jhsilva1991","samuelvenancio cruzeiro san lorenzo universidad catã lica independente medellin"
"2018-12-09","jorgeoviedo","viejobarbado andreao_h medellã­n a7aeiufnhb"
"2018-12-09","jose_tapiag","saquelargowin es que un equipo busca el arco contario queda expuesto a recibir goles eso le pasã al medellã­n"
"2018-12-09","jozwiakkrystian","podoba mi siä film przez åšwiat na fazie pablo escobar å ladami bossa kartelu z medellã­n czä åšä w youtube â"
"2018-12-09","kuznetzovp","ivanduque recuerdo que belisario destituyã a alvaro uribe de la alcaldã­a medellã­n por sus nexos con el narcotrã fico tambiã n su papã y fueron los responsables negligencia mil muertes armero r271icemeo"
"2018-12-09","leu_lewis","y que le paso al calvo hp de medallo hablaba mal junior ðÿ"
"2018-12-09","marlonosrz","tavomonr 2010masterchip y no se crean tan importantes america junior medellã­n millonarios cali tmbn lo hicieron todos esos son mã s grandes que el tolima"
"2018-12-09","maurici74555099","juanferquinte10 y te bebiste el ultimo sorbo de la copa dando gloria a tu hinchada en medellã­n celebramos rabiar gol felicidades maestro"
"2018-12-09","rafamendoza16","aminarizadonado atljunior dim_oficial winsportstv saquelargowin amin pero fue eduardoluisfut el que dijo y sostuvo fueron regalos de medellã­n manda cã scara no entiende en fãºtbol con presiã n se busca originar error del contrario parece ha visto"
"2018-12-09","richizuluaga","helen06191 hilbersonc dcoronell jorgomezpinilla una cosa es denunciar y otra transformar con ejemplo buena administraciã n medellã­n antioquia fueron lã­deres en transparencia ejecuciã ya revisã los nãºmeros de su caudillo hay que ser muy anacrã nico para creer el populismo asistencialista positivo lea mã s"
"2018-12-09","sincensura97","stevenarce jajajaja si eso fue un partidito la liga colombiana es una competencia de barrio no miremos los minutos gran final junior vs medellã­n esos errores groseros que cometiã el son partiditos y se supone lo mejor amateurs"
"2018-12-09","sportnautas","ðÿ œðÿš andreaescobary y okendobmx se coronaron campeones de la xiii versiã n del campeonato internacional las luces realizado en medellã­n ðÿšº manuela martã­nez valentina muã oz ðÿš juan carlos dã­az samuel zapata ciclismoweb_net 5rky9gcmqr"
"2018-12-09","telemedellin","noticiastm autoridades buscan minimizar riesgos de secuestro y extorsiã n en medellã­n mjacdlxw56"
"2018-12-12","alwayssameshit","estoy sentado solo en ciudad del rã­o ya me arrepentã­ de medellin"
"2018-12-12","cacheadicted","te entiendo total danielaacallee no y si hubieras visto medellã­n hoy primero hubo un choque los conductores se pusieron a pelear una persona terminã muerta por otro lado volteã bus me demore como horas fue increã­blemente estresante danielaacallee no y si hubieras visto medellã­n hoy primero hubo un choque los conductores se pusieron a pelear una persona terminã muerta por otro lado volteã bus me demore como horas fue increã­blemente estresante"
"2018-12-12","elespectador","indignaciã n en medellã­n hombre le da una cerveza a un perro oyncwg2c05 gufsidcrwf"
"2018-12-12","hamidiacisse","malamine222 siikhou medellin___ il ce sont tromper wssh jcroi voulais mettre"
"2018-12-12","janierarmenia","listo lo que me faltaba para las vacaciones ðÿ mi traje de baã o super recomendado davidramzgz pide el tuyo ðÿ‘œðÿ‘œðÿ‘œðÿ‘œðÿ‘œ en medellã­n antioquia ulnjr6uej3"
"2018-12-12","jefbanguera","cuchiwolff partidoverdecol lo mismo pasa en medellã­n y otros municipios pero como les puede mã s el amiguismo preferã­ alejarme del"
"2018-12-12","juanduribe61","el tiempo de regreso a casa los trabajadores paisas se aumenta en horas por culpa la inmovilidad que vive medellã­n elcolombiano"
"2018-12-12","kitokojohnny","medellin___ une semaine ma chã re juste et câ est terminã medellin___ vient une semaine chez nous gros tu seras formatã de ouf ðÿ medellin___ ãªtre en chien vouloir soulever ou se faire"
"2018-12-12","malamine222","hamidiacisse siikhou medellin___ plus"
"2018-12-12","marianaarrubla","ya quisiera yo tener la lealtad de un hincha del medellã­n"
"2018-12-12","s_shawtyyy","__105e medellin___ jai eu a ton test ðÿ"
"2018-12-12","saresithava","melissalrc viene para medellã­n y yo sin saber por dã nde estarã ir a buscarla ðÿ melissa si lees esto te amo que estã s aquã­"
"2018-12-12","sofiro01","ficogutierrez alcaldiademed jairoclopatofsk 6amcaracol la administraciã n municipal de medellã­n inrrespeta a los lã­deres poblaciã con discapacidad al incumplir acuerdos que previamente se llegã este es un testimonio ksiap98i18"
"2018-12-12","tovarlexer","me gustã un video de youtube h23r4bjgp2 letraðÿ ðÿ ª vs kmlðÿ cuartos final regional supremacia mc medellin"
"2018-12-12","wajesusol","eso es inaceptable tanta gente sin plata y con ganas de tomarse una cerbecita hombre que le da cerveza completa a un perro indigna medellã­n 0ui565riqr"
"2018-12-12","xkanaria","medellin___ ðÿ medellin___ flm tu fais ã a trã s bien dã jã mdrrrr"
"2018-12-15","0_0cristian","y ajã ðÿ medellã­n antioquia welaqyhukk"
"2018-12-15","alcaldiademed","pico y placa no se suspenderã en medellã­n durante fin de aã o medellã­ncuenta medellã­nporbuencamino ðÿ xo7sl8pjmv 98pw4kglny"
"2018-12-15","amdji01","jodeci_xiii medellin___ j'attendais que ã a ohh"
"2018-12-15","armyestefa09","ssssiiiiii medellã n ðÿ"
"2018-12-15","berna_tapia","como olvidar ese glorioso junior que viajo a medallo y ya saben la historia"
"2018-12-15","cafe1907med","colombia igerscolombia ig_colombia galeriaco medellin colombia_folklore bogota colombiatravel colombia_estrella colombia_greatshots idcolombia colombiana colombianiandoâ pskpzca2x3"
"2018-12-15","carloshmb10","herbinhoyos que pesar medellã­n se la tiraron"
"2018-12-15","ciberpaisa","acaba de publicar una foto en medellã­n antioquia xkyv9p1glo"
"2018-12-15","crisbarza","siempre lo digo y dirã medellã­n con alumbrados no es ciudad mã s que eso expectacular orgullo de ser paisa crisbarza saludos"
"2018-12-15","devimed","via calzada medellã n bogotã municipio de rionegro a la altura retorno no playa presenta ninguna novedad km via calzada medellã n bogotã municipio de guarne a la altura t aeropuerto no presenta ninguna novedad km"
"2018-12-15","dim_oficial","âš plantelprofesionaldim ðÿ µðÿ medallo hizo su ãºltima prã ctica de cara a la final nuestro fãºtbol los muchachos estuvieron esta tarde en el polideportivo sur ðÿ‘š juntosxla7 ox9jcrts56"
"2018-12-15","el_quim16","medellin"
"2018-12-15","esumedellin","con segenlinea y tepillã puedes sumarte a denunciar los problemas de seguridad convivencia en medellã­n â tu reporte aporta cfya0u7z9f descarga para android jplpdpwyqs"
"2018-12-15","frand_v","saludos desde medellã­n colombia viendo ufcxfox que buenas peleas"
"2018-12-15","gaviria_miriam","luzmamunera anacrisrestrepo yerada69 luisyepesb funurbiano ggomezca geocelis geneve3016 cloquis _asiole_ martinhroman pero lo mã s grave del alcalde rico es que ã l su familia y sus amigos no tienen un asomo de vergã enza con ese dinero se hubiera subsanado el dã ficit salud medellã­n por menos la m etrosalud repãºblica grande paã­s"
"2018-12-15","gerzovi","seã or rabodeajip esto es en su querida medellã­n de nuevo la mala ortografã­a las vallas del municipio me puede confirmar"
"2018-12-15","jcipa","hello medellã­n 2bm6hmliyi"
"2018-12-15","lahistoriaec","paraleer el regreso del escritor fernando vallejo a medellã­n colombia cpncx9gzku"
"2018-12-15","lapanaderiarusa","hoodie tokyo ðÿ âœ ï tallas s m diseã o y manufactura colombiana model linacruzr envã­os gratis a medellã­n whatsapp robotobogota robotomedellin medellin bogota hnhazdsi2l"
"2018-12-15","laruletadeport","finalxlrd maã ana estaremos cubriendoðÿž la gran final del futbol profesional colombianoðÿ ðÿ âš ï desde el atanasio girardot ÿdesde cuidad de medellã­n despidiendo aã o como nos gusta con fãºtbol y compartiendo ustedes los hinchas kl3mozyr6d"
"2018-12-15","lodvgcolombia","nuestro buen amigo alvarofuentes nos felicita por aniversario y cuenta algunas cosillas de lo que preparan para lovgcolombia14aã os la oreja van gogh oficial lovg fans colombia medellin hdus bogota qlipll7icr"
"2018-12-15","madsnguyen","medellin_nick yes medellin_nick i hate you"
"2018-12-15","manuelortega3","anoten tambiã n en la lista de los ausentes a evert salas hay dos jugadores que algunos no recuerdan estuvieron nã mina campeona del orlando ballesteros y wilson carpintero ninguno jugã medellã­n ante nacional"
"2018-12-15","maogonzalez20","dios cada vez falta menos para ver al rojo en el atanasio yo creo ti medellin a dejarlo todo la cancha vamosrojoquerido"
"2018-12-15","marcellogaviria","sorprendente en medellin obra de andes peatonales la calle bombonã del centro terminarã n el y alcaldiademed ficogutierrez no toman cartas asunto teleantioquia telemedellin cosmovisionofi concejomedellin personeriamed vqghgw902w"
"2018-12-15","mattmattmatt_23","thesusieschaaf i my first day in medellã­n eating nothing all until found a nice restaurant to get bandeja paisa and club colombia beer literally the best"
"2018-12-15","mauricio29662","alvaroaduarte tobonvillada ficogutierrez herbinhoyos policiamedellin seguridadmed no es verdad caballero ya he visto varias veces la respuesta rã pida de las autoridades medellin"
