"date","username","tweet"
"2020-11-29","juanech62391322","cesarbetancurb mariadcmesa lastima la inseguridad pero sã­ es el mejor barrio de medellã­n"
"2020-11-29","juanefe14","cruzazulcd vamos domã­nguez mã quina desde medellã­n colombia"
"2020-11-29","juangaviriam","a medellã­n llegarã vacuna covid en segundo trimestre de quinterocalle tkhu2xbpsp"
"2020-11-29","juanka7829","patermionostro alcaldiademed epmestamosahi pero mas guevon vos a lo legal sufran uribistas de pacotilla medellã­n nunca serã uribista"
"2020-11-29","juanma_alvarezo","colombia_hist bogotaantigua esta cuenta cada vez se supera con sus imprecisiones y errores a simple vista sin necesidad de mayor conocimiento reconoce que esa no es la catedral primada si medellã­n"
"2020-11-29","junoveryou","man made bamboo forest in medellin cebu responsibletourism alwayswearamask gbqnynkuzy"
"2020-11-29","karytosolano","realmente eres magia medellã­n ðÿ zpmjhk4i65"
"2020-11-29","laespergesia","cuando leo que algunos no entienden la pasiã n despierta el fãºtbol pienso en mi abuelo con su camisa del deportivo independiente medellã­n de pie escuchando himno antes inicio partido si equipo perdã­a le dejaba hablar a los eran atlã tico nacional"
"2020-11-29","latriadaw","a partir de maã ana noviembre y hasta el diciembre la alcaldiademed realizarã primera ediciã n del medellã­n tech fest espacio para hablar aprender vibrar alrededor las nuevas tecnologã­as h1jdeqvihv"
"2020-11-29","lerubiano","medellin figurita telemedellin elcolombiano bluantioquia gobantioquia despiertaant adnmedellin"
"2020-11-29","linaaristizab12","ðÿ y en medellã­n cuã ndo â"
"2020-11-29","lopera_zea22","bueno familia se llegã el mes de la parranda asados y diversiã n nuevamente ofreciendo por acã los barriles ahumadores artesanales estoy en medellã­n hacen envã­os a nivel nacional ðÿ ž tambiã whatsapp agradezco un jbeafhzczi"
"2020-11-29","lucas15928","oscarsuaza123 ghitis feliz cumpleaã os desde medellã­n cðÿž ðÿž ðÿžˆ"
"2020-11-29","luisrangelmlyl","eglomu irving_medellin hahahahaha que hueva hoy comã­ eso lol brayanwaloo irving_medellin ya fue retirada"
"2020-11-29","luisyepesb","misteriosa atisbo de luna oriente medellã­n dbqvawxvtx"
"2020-11-29","madandcute1","eva bralette âœ restock en crema y negro cnqejhypfh medellã­n antioquia id40vanrnh"
"2020-11-29","maquina141","la mejor mã quina del trek sãºpercaliber supercaliber maquina141 bike colombia brasil cali bogota medellin mexico mtb biker parati tiktok ciclismo mtbcolombia en ve 3eeko1b9ra"
"2020-11-29","marijaimeseb","de la nada james charles es un gay medellã­n ðÿ âœ"
"2020-11-29","matchtenis","jornada redonda para los colombianos en el torneo piloto ciudad de medellã­n ðÿ ðÿ‘œðÿ 6âƒ 8âƒ cupos quedaron manos locales 65fbpedybj"
"2020-11-29","mauricio11170","queenroguexxx1 hola queen yo soy de medellã­n colombia hermosa me encataria estar con tigo ðÿ"
"2020-11-29","mcamilabotero3","parce hornitos deberã­a tener sede en medellã­n ðÿ"
"2020-11-29","medellin_af","x1am_20 ù ø g11177 ø ùš ùˆø ù ø­ù ðÿ"
"2020-11-29","medellin_rmz","le coeur sur la main jâ avance mãªme si il est cassã zb"
"2020-11-29","mellamantommy","lo digo porque me chupã meses encerrado en medellã­n sin poder viajar a ninguna parte y como todo esa monotonã­a cansa"
"2020-11-29","mhbetan","_sadyavatti_ quinterocalle braulioemarquez medellincuenta1 mas_medellin revocoaquintero r2po73n2gk _sadyavatti_ quinterocalle braulioemarquez medellincuenta1 mas_medellin revocoaquintero esa no es idea de â œpinturitaâ"
"2020-11-29","miguelramonpym","tulioagomez como directivo jamã s les llegarã a los talones don pepino sangiovanni o al doctor carlos puente ã sea que segãºn usted anoche su tã cnico barato de centavos juancruzreal se inventã el fãºtbol en medellã­n y es mejor ochoa por favor serio"
"2020-11-29","mmanuelcordoba","llego la navidad carrera carabobo de medellã­n yv4ec28ouz medellã­n en el parque de berrio se ve un famoso almacã n que â œfã­a porque confã­aâ lo recuerda toda la esquina del y al fondo ed portacomidas boyacã con palacã ceho3zpjml"
"2020-11-29","mon_velarde","just posted a photo medellã­n antioquia qnlkwyqwwm"
"2020-11-29","moralitos14","ngalvisarias ahora imagã­nate montar una panaderã­a buena con diversos panes del mundo medellã­n descuidã un nicho de mercado algo se les tenã­a que escapar ðÿ"
"2020-11-29","mpvallejo","mi hermana me dijo que volver a medellã­n era como quitar una curita tenã­a hacerlo rã pido y sin pensar bueno allã voy"
"2020-11-29","mundoequinocol","ðÿ encuentra en artequino sombrero peruano todas la tallas âœ mã s informaciã n whatsapp â artequinotiendaecuestre jinetes caballistas caballos equinos medellã­n colombia ccc caballo tradiciã ywzz30cxaf"
"2020-11-29","murillocasanova","clã sico rcn el team medellã­n gana la crono por equipos brayan sã nchez primer lã­der tiqyzjdhx5"
"2020-11-29","nelsonprezbote2","indermedellin dianatoroz erickcogo la comuna hoy disfrutã del evento recreaciã n se siente en tu barrio de ciudad inder medellã­n con el apoyo gestiã territorial â œmedellã­n futuroâ xonwv4iwaq"
"2020-11-29","nicoperiodista","el metrodemedellin alcaldiademed celebrarã maã ana sus aã os con usuarios los podrã n disfrutar de una tarde la filarmã nica medellã­n y su puesta musical nacido en cuarentena estos vehã­culo han recorrido millones kilometros alkldhshsn"
"2020-11-29","noti_medellin","en el primer trimestre de llegarã­an mil vacunas daniel quintero lclws9seiv"
"2020-11-29","officehomedesi","new post endless summer vibes via by â has been published on cortinas y persianas en medellã­n office home design t7tp3eufpa 3azvk2fsct"
"2020-11-29","oficialcimarron","acaba de publicar una foto en medellã­n colombia l9asprgwum acaba de publicar una foto en medellã­n colombia 0yigl0fef4 acaba de publicar una foto en medellã­n colombia s7hjfhotov"
"2020-11-29","oscarpanesso","dcoronell rayzo25 margaritarosadf losdanielesop danielsampero ud ame al delincuente fajardo involucrado en la corrupciã n y muerte d hidroituango grandes desfalcos a antioquia medellã­n ahora el trencito elevado bogotã lo reto q me denuncie por esto digo vemos como se reviven procesos contra ese bandido"
"2020-11-29","padillmoises","pedromirandat medellã­n aã os bebida de dioses"
"2020-11-29","parbelaezr","brayan sã nchez team medellã­n aã os primer lã­der del clã sico rcn se iniciã en el orgullo paisa y aspira estudiar gastronomã­a"
"2020-11-29","profelrodriguez","bajaron los contagios pero siguen subiendo casos activos de coronavirus en colombia este 29noviembre reportan fallecidos bogotã cali medellã­n preocupa el alto nãºmero tolima covidãƒ"
"2020-11-29","raridad150_","o novinha de marquinha vem c a mã no joelin arrocha os mlk do cartel medellinðÿž ðÿ µðÿ ˆ"
"2020-11-29","realneuriana","everybody in colombia eats pizza with pineapple they call it hawaiian medellin bogota"
"2020-11-29","reinaldojoseco3","ivcnetworks ivclvbp desde medellin es sintonia soy venezolano magacaribe de anzoategui.daludos"
"2020-11-29","reporteactivo","ðÿžˆ descãºbre cuã les son las perras mã s sabrosas de medellã­n en este vã­deo wstofvv1ws"
"2020-11-29","rg2240","chris10bsc medellin_los fmolestinae entonces no digas que nuestra buena racha es por robo acepta y listo"
"2020-11-29","rusb20","javierito321 ese tambiã n pudiera ser algãºn barrio de medellã­n no lo es pero los hay asi"
"2020-11-29","s_slosada","sonja_neteu davidguenel d'aprã s moi il faut ajouter que laureles est un cartier ã medellin"
"2020-11-29","sandramarin1982","excelente es el mejor concejal que ha hecho control polã­tico para la ciudad medellã­n porque quiere a y no nos acaben"
"2020-11-29","sc_011","estoy demasiado feliz ðÿ me voy para mi paã­s for a whole ass month extraã o tanto medellin ºðÿ"
"2020-11-29","sebaspl91","medellã­n ya no es la ciudad de las dinã micas los hoy una regiã n que requiere un marco normativo articule conurbaciã y permita gran cuente con coherencia del desarrollo su territorio el amva pueden seguir siendo islas"
"2020-11-29","sepega_","creo que los baã os de arkadia son mã s lindos todos centros comerciales medellã­n"
"2020-11-29","shaqpacc","riding clean youngest nigga in the medellin"
"2020-11-29","sitamurta","pabloalahungara que lindooo me tinca harto cartagena de indias yo estuve en medellin hace unos aã os y la isla san andrã s maravilla ðÿ"
"2020-11-29","stewart1382","medellin_los geovanny_bsc barcelonasc en la pre libertadores tambiã n era culpa de busos el problema no es tã cnico"
"2020-11-29","taxcoopebombas","ð ƒð ðÿœ âœ taxi elã ctrico ðÿ’š0 emisiones contaminantes ðÿ ƒmejor calidad del aire mejor de vida alcaldiademed sttmed epmestamosahi medellã­n movilidadsostenible tutaxiseguro taxielã ctjmf05cyg"
"2020-11-29","team_medellin","ðÿš â ï cre clã sicorcn ðÿ team_medellinâ brayans1994â vivamedellã­n diegogiraldopaâ bkvh6zmhuj"
"2020-11-29","tizumbaonline","tãº y yo viendo los alumbrados de medellã­n no sã piã nsalo tyfd4lvbil"
"2020-11-29","tomsmesa6","renacercamion mintransporteco ansvcol supertransporte autopistasuraba ani_colombia aplaudimos los planteamientos de la corporaciã n renacer camionero que buscan opciones para minimizar el impacto se va a generar por las obras en corredor vial medellã­n apartadã diferentes actores esta vã­a"
"2020-11-29","unodelacosta","el costeã o que va a medellã­n dias y regresa hablando paisa es una ofensa para resto de los os carolina herrera ggcfkfivqv"
"2020-11-29","walter_fuckyou","tuiterycocacola santa fe medellã­n ðÿ œ"
"2020-11-29","winsportstv","goleswin liga femenina repasa aquã­ los goles de la remontada medellã­n ante real san andrã s ebh6xt8mdj"
"2020-11-29","wonderlan578","monicarpor hahahahahhaha no ome que cosa tan horrible mi medellin ya sã si reã­r o llorar"
"2020-11-29","x1am_20","medellin_af ùƒù ùˆ ùˆùˆùˆùˆ medellin_af ùƒù ùˆ ùˆùˆùˆùˆ"
