"date","username","tweet"
"2020-11-17","leandro_xjr41","q buen vivo d reykon en la hermosa medellin ðÿ"
"2020-11-17","lefou_moose","medellã­n es una competencia constante por quien mas bobo hijueputa"
"2020-11-17","leo_medellin","johanmanueloso5 freedom50083729 fcfseleccioncol y dale con ofensas acerca de la indentidad sexual que acaso te quedã gustando trola burro johanmanueloso5 freedom50083729 fcfseleccioncol si ud acusa a los demã s de ser homosexuales es por que algo en oculta otra parte como homosexual fuera una ofensa nos vamos estereotipos ese caso creo no probã burra sino burro johanmanueloso5 freedom50083729 fcfseleccioncol mejor ni se quite el tapabocas triple hijueputa es su ãºnica oportunidad de interactuar sin ser rechazado johanmanueloso5 freedom50083729 fcfseleccioncol aparte dando opiniones como si ud fuera un canon de belleza con esa cabeza forma aguacate johanmanueloso5 freedom50083729 fcfseleccioncol mã s cara de bobo hijueputa tiene su gran puta madre que no uso condon y mirã el resultado un mongã lico como ud freedom50083729 johanmanueloso5 fcfseleccioncol si claro como ud tiene un premio puskas"
"2020-11-17","liliguerrero10","jbagbam74 stellaq96192711 ese hp alcalde se cago medellã­n"
"2020-11-17","lucioarmijos","asã­ titulã diario el colombiano de medellã­n tras la goleada en quito â œecuador aplastã a colombiaâ ojhiufchvf"
"2020-11-17","luisgar96280128","jbagbam74 pero los paisa no lo van a permitir se este miserable comunista alcalde de medellã­n serã revocado"
"2020-11-17","luisrui59700118","ya que el presidente ivanduque se apersonã de la catã strofe del huracã n en sanandresislas cuando va a apersonar destrucciã bogotã y medellã­n ocasionadas por los huracanes claudialopez quinterocalle"
"2020-11-17","makaiaorg","este es un resumen de la calidaddelaire en medellã­n opendata elcolombiano eltiempo areametropol telemedellin cleanairfund accionesporelaire ibmcolombia caravanstudios ruta_n alcaldiademed qijfgefv7z"
"2020-11-17","mas_medellin","nachounal crispinavilla bluantioquia medellincuenta1 revocatoriadq ah no si quiere le dejamos la ciudad a ese inepto pensando en el uribismo repetimos solo nos interesa medellã­n es un sentir colectivo de"
"2020-11-17","mestanza777","este frã­o de medellã­n estã hpta ðÿ fqrzcregxv"
"2020-11-17","miguego1","noticiascaracol el uberrimo oliendo a azufre y se asustan por unos diablos en medellã­n"
"2020-11-17","nancy2142","jumajara medellincuenta1 mas_medellin inepto"
"2020-11-17","negrosuspez","acaba de publicar una foto en medellã­n antioquia ffq54b9ozt"
"2020-11-17","noraelisa44","los alumbrados de medellin con homenaje al diablo revocatoriadanielquintero lo0xcmg9tx"
"2020-11-17","nosoyparri","quiero amiguitos de medellã­n"
"2020-11-17","numeral767","julbarrientos2 inviasoficial hola buenas tardes la vã­a medellã­n monterã­a presenta las siguientes novedades cierres esporã dicos por mantenimiento vial sector frisolera km se realizan cada minutos para sentido"
"2020-11-17","oyarcemumo","medellin_los frasotro 2010misterchip por eso le fue mal en colombia y bien ecuador honduras"
"2020-11-17","parocafeter0","el tema es que las aguas y aire de ciudades como medellã­n bogotã son los mã s contaminados del mundo produce enfermedades respiratorias con altos ã­ndices mortalidad no hay minimizar la problemã tica"
"2020-11-17","pemberthy1913","minsaludcol que inrresponsabilidad ruta caldas medellin yp0c8ixp1m alcaldiademed esta belleza ruta caldas medellin hj5iyu5elm"
"2020-11-17","pnet2k","mateo_ramirezv jumajara medellincuenta1 mas_medellin y los ateos van a trabajar en la semana santa feriados religiosos hipã critas ateituyos jumajara medellincuenta1 mas_medellin insisto la capital de colombia deberã­a ser medellã­n"
"2020-11-17","slondonouribe","creo que el affair del diablo es un buen ejemplo de lo pequeã o y limitado ha llegado a ser debate pãºblico en medellã­n por debajo se mueven fuerzas esas sã­ oscuras sus anchas los titulares giran sobre insulso"
"2020-11-17","soyanymaniaco","recuerdo que lo siento hoy sentã­ cuando iba a ver rbd en medellin siempre he estado aquã"
"2020-11-17","teatropablot","asã­ vivimos el primer dã­a de las caravanas culturas la comuna disfrutã y bailã con nuestro invitados quienes demostraron que en medellã­n nosmuevelacultura volveremosaflorecer ðÿœº maã ana estaremos cosiaca69 circomedellin â no te lo pierdas nuqgtcervf"
"2020-11-17","thesamu_","acaba de publicar una foto en medellã­n colombia gjyrbcblin"
"2020-11-17","tukytury1","saratab estoy triste porque desde medellã­n colombia no pude entrar a la conferencia pues entender logã­stica del congreso de hoy las y me lo perdi serã que pueden ayudar por menos para sesiã n maã ana"
"2020-11-17","weltanschauu_ng","cassius35878158 super polã mico este finde almorcã con una enfermera de la clã­nica leã n xiii en medellã­n trabaja uci despuã s escucharla creo que para algunos escã pticos solo cuando estã supino y entubados toman esto serio a ella tambiã le toca embalar los muertos"
"2020-11-20","____________dbm","medellã­n es el primer equipo en sacar dos camisetas del mismo color ðÿ tan lindos"
"2020-11-20","adribaran","gualdomarin queensualumni edmontonwineguy queensprincipal una vez superemos un poco el covid te hare llegar unas botellas tengo muchos amigos y colaboradores en colombia me estoy trayendo fellow a kingston que empieza febrero de medellin"
"2020-11-20","bisexualoki","es de medellã­n"
"2020-11-20","botty747","acaba de publicar un video en poblado medellin wqs1m73ivg"
"2020-11-20","camuta92","camiloboterol bacano ese uniforme del amã rica a quã horas presentan el medellã­n"
"2020-11-20","ciclismoenlinea","vuelta colombia masculina â clasificaciones etapa josã hernã ndez team_medellin diego camargo tierradeatletas lã­der roosbelth rojas uaeteamcolombia mejor novato juan hoyos colnagocmteam sprint especiales suã rez equipoepm puntos ðÿ fedeciclismocol axhayvyqzg"
"2020-11-20","crismax35","marthaperaltae ivanduque estã gente si es cansona avianca da empleo y presta un servicio p nstro ðÿ tdo l de duque lo crã tican pero a los feos izquierdosos que n quebrando bta medellã hay callados esos son una ruina cndo llegan al poder acaban con todo dejan miseria x pasan"
"2020-11-20","elkin_bedoya","la nueva camiseta del medellã­n parece mã s una cosa de transiciã n como temporal pero no eso va a durar aã os ðÿ º"
"2020-11-20","humotv","santa fe millonarios dep cali amã rica deportivo independiente medellã­n atl nacional junior real san andrã s los equipos femeninos que calificaron a cuartos de final la ligafemeninabetplaydimayor hoy se harã el sorteo luego las p.m acã lo tendrã n xuphnakfq1"
"2020-11-20","infodim","hoy a las p.m medellã­n darã conocer los uniformes que le diseã ã puma para la prã xima temporada dstfk0xbyg"
"2020-11-20","insight_sound","llegã navidad y eso significa nueva canciã n de alcolirykoz nqossl4i53 noticias rap medellin aranjuez periodismomusical periodismo reseã a"
"2020-11-20","jfechev","la donaciã n que medellã­n y epm enviaron a san andrã s providencia a8fmijpm4o travã de elcolombiano bien por nuetsra ciudad epmestamosahi emvarias generosidad caridad no son propiamente virtudes del diablo sr quinterocalle zcnulkuec3"
"2020-11-20","juanpablogacas","kamerpo como podemos ayudar los que no estamos en jericã sino medellã­n"
"2020-11-20","karikarinak","con decirles que prefiero viajar a medellã­n por carretera regalarle mi dinero la aerolã­nea abusa y ademã s no cumple susto"
"2020-11-20","luvelur","la donaciã n que medellã­n y epm enviaron a san andrã s providencia xcfugdzg3p travã de elcolombiano"
"2020-11-20","maxiazprensa","ahã­ nos vemos medellã­n de fin semana ðÿ"
"2020-11-20","modo_urbano","tiburonas a cuartos de final clasificarã n como mejores terceras liga femenina colombia tendra posible rival santa fe amã rica millonarios o medellin acuerdo sorteo gcqb4uigkf"
"2020-11-20","nomolestar2020","lezardneos adrjs carajo sin son pesos colombianos serã­an casi dã lares se fumaron toda la producciã n de cali y medellã­n eh ave marã­a omeh"
"2020-11-20","revm_1","karliirr si hay una tienda en medellã­n de pablo escobar"
"2020-11-20","tutogol","los equipos clasificados a octavos de final la ligafemenina sorteo y mã s hoy pm en extremo csh5cqhx1g secsaludvalle grupo santa fe millonarios b amã rica deportivo cali jãºnior c medellã­n real santander nacional 3mvkegtsau"
"2020-11-23","_gustavogerardo","acaba de publicar una foto en medellã­n antioquia 4vhtshapjw"
"2020-11-23","adryocampom","con un poco de calor medellã­n hoy estuvo lindo ðÿ"
"2020-11-23","alcaldiaenv","los municipios unidos por la equidadðÿœ envigado itagã ã­ sabaneta caldas estrella copacabana bello girardota barbosa y medellã­n el ã rea metropolitana te invitan a conã ctarteðÿ al foro metropolitano todas unidas en una sola voz vida libre de violencias âœ ðÿ’œ 5fnhulaprj"
"2020-11-23","alertapanama2","giselatunon mã­nimo un hotel estrellas no baja de dã lares por dã­a par mã s y compro mi boleto para ir a medellã­n ida vuelta"
"2020-11-23","andreeuribem","antioquia cerrã el con la cifra mã s alta de quemados por pã lvora en paã­s casos medellin algunos lesiones irremediables hoy defrente2020 se hablarã sobre esta prã ctica que pone riesgo salud y buscamos cambiar campaã a enciendetuluz 0oxhyimudv"
"2020-11-23","andrescuellar84","monicamaria__ pues obvio no ve que mi dotor hurive ha sido el mejor presidente tenido cartel de medellã­n duã lale al le duela por eso su hijo serã tã­tere cerduque"
"2020-11-23","backbackbay","drmckinn j4m3z tangorene quesadillabrett czarim1 timburg95725020 sallybucket259 mark2_medellin snwilsonmd onlyme1177 minachan77 wedonopeneyes amybrough6 mikecolahan1 ulko7t7 hidden_surprise edwardyoung21 sarinajansson rself20 thank you doctor"
"2020-11-23","bellasprepagos","una chica sexy y complaciente es juliana modelos mujeres medellin tuzybjv984"
"2020-11-23","biswanathbasu15","bombay is becoming medellin of india hub drug trade in patronised by local state govt police judges bollywood ncb chased a mobs journalists jailed mafia ruling indiaâ s fin capital nia_india amitshah cia deahq please act drugmafiavsncb"
"2020-11-23","botty747","acaba de publicar una foto en poblado medellin dke8pbkh9i"
"2020-11-23","c_pueblos","adilanlomatoelesmad el pasado 19n un manifestante uribista expresã en medellã­n que a los estudiantes habã­a darles bala hace aã o bogotã dilan cruz lo asesinã una de la policiacolombia mientras defendã­a su derecho educaciã n ktvkrrwlya"
"2020-11-23","caracolmedellin","atenciã n descartan que haya desaparecidos en deslizamiento el corregimiento puerto valdivia a esta hora concluyen labores de remociã y se restablece paso total la vã­a medellã­n â costa caribe ðÿ caracol radio snskm2uo0n"
"2020-11-23","carlosgiraldop","numeral767 me informan por favor estado de la via medellin a apartado"
"2020-11-23","carlosju777","gatica en adopciã n medellã­n responsable con seguimiento kwvpgzcsso"
"2020-11-23","carviba1","pero su amiga cabal dijo que gracias a lina usted fue alcalde en medellã­n osea sã­ hay una herencia polã­tica por ahã­ ðÿ"
"2020-11-23","cataescobarr","me siento muy orgullosa de las jã venes la juanfe en medellã­n que hoy trabajan manera digna tenemos el ellas mercado laboral verlas progresar empoderadas es nuestro propã sito pasã ndolas pobreza a dignidad 1r7p4hdor0"
"2020-11-23","cforeroo","alejovelopez estoy casi seguro de que sã­ hay maracuyã si no puede venir antes a bogotã cuando vaya medallo le llevo"
"2020-11-23","chavanestor1","golpean a supuestas ladronas en medellã­n durante dã­a sin iva noticentro cm amp hmk2h61c7j"
"2020-11-23","ciclope78hugo","la pregunta es al revã s â quã podrã­a salir bien dilan igual que todos esos hdlgp hacen terrorismo urbano para congraciarse con terroristas de verdad corriã suerte merecã­a y merecen los siguen su sendero el hombre medellã­n dijo armarse asã­"
"2020-11-23","ciudad_morada","alairemoradanoticias moisã s y juanjo editoresdeciudad les cuentan sobre la furia trans toma que hicieron en medellã­n el pasado viernes de noviembre gstkrvqskq editarlaciudad ciudadenamorada alairemoradanoticias nocopiomed dedicamos un minuto de vida por migue los seres amados que nos harã n falta en medellã­n las personas asesinadas la masacre finca gabriela vereda el pedral abajo municipio betania antioquia alairemoradanoticias nocopiomed con ellos ya son las personas que nos ha arrebatado la violencia homicida en medellã­n seres amados ciudades posibles no conoceremos entre migue nuestro editor de ciudad asesinado alairemoradanoticias nocopiomed tanto el viernes de noviembre como sã bado no se presentaron homicidios en medellã­n ðÿ µ â hola moradores ðÿ’œðÿž ï hoy en morada noticias hablaremos de la conmemoraciã n del 21n el paro nacional tambiã furia trans y toma que hicieron medellã­n semana pasada placer ciertos waffles erã ticos con formas particulares gstkrvi490"
"2020-11-23","colombianiisimo","dnp_colombia henry1henry195 mintransporteco inviasoficial vicecolombia infopresidencia ivanduque rodluisalberto jdbernalgo la linea fã rrea bucaramanga medellã­n o barrancabermeja mueve mucho turismo y ayuda a campesino sacar sus cultivitos"
"2020-11-23","danilodazar","quinterocalle oscarsevilla76 juan_p_suarez vueltacolombia1 team_medellin epmciclismo daniel te faltã decir el equipo y de dã nde es ganador diego camargo olvidemos regionalismo que somos un mismo paã­s"
"2020-11-23","daniymagneto","acaba de publicar una foto en medellã­n antioquia jas9eplubz"
"2020-11-23","delfinvinotinto","marlagutierreza danielsampero en el hospital la marã­a que estã medellã­n y es de gobernaciã n lo remodelaron pusieron una placa toda entrada urgencias ðÿ son muchos los no cumplen con norma"
"2020-11-23","diamaep","monyrodriguezof sergio_fajardo como alcalde de medellã­n superã las expectativas en transparencia y buena gestiã n mi mejor voto"
"2020-11-23","diegoncho","me ayudan a compartir los que estã n en medellã­n y el oriente rodessian rodessianridgeback xc6shsnrhj"
"2020-11-23","difehervas","metrologã­a no basta con medir tambiã n es generar nuevos conocimientos en mã todos consistentes y confiables equipos adecuados el itm_medellin te proporciona las herramientas que necesitas compra ya tu pin djflau1jqc cmtknkyufu"
"2020-11-23","dollyamparo10","monroycamilo medellã­n estã decayendo vã­as parques etc"
"2020-11-23","dottor1980","jarlinsonpantan team_medellin oscarsevilla76 jarlinson su comentario es desobligante y por demã s falto de cultura el gentilicio apropiado boyacense estas al nivel del seã or video"
"2020-11-23","dsanignacio","jaime linares es antioqueã o de nacimiento y venezolano corazã n despuã s aã os regresã a su tierra natal se dedica vender vive en los parques del centro medellã­n lugar favorito la plazuela san ignacio por sus ã rboles aire fresco somossanignacio swcr6cekd7"
"2020-11-23","edwin62455655","quinterocalle oscarsevilla76 juan_p_suarez vueltacolombia1 team_medellin epmciclismo que pena con los ciclistas una trocha en medellã­n"
"2020-11-23","elenguayabado","creo que es de medellã­n tampoco centro"
"2020-11-23","estebanrestre","el aã o pasado medellã­n registrã de los casos lesionados por pã lvora en antioquia sabemos que la historia puede ser diferente si cada uno nosotros pone su parte para nuestra ciudad se apague y viva una navidad tranquila enciendetuluz sq3z2qfc2w"
"2020-11-23","fbmtl","ðÿ travelmemories at botero plaza in medellin colombia december recuerdos de viaje en la medellã­n diciembre art sculpture fernandobotero boteroplaza antioquia colombia_travel uyq86vxrdx"
"2020-11-23","fergerain1","en mi concepto el corredorverde le darã mã s de lo mismo a la ciudad bogotã buses y se estã n quedando corto con innovaciã no les da ni por mirar medellã­n"
"2020-11-23","fernandoacero_1","acaba de publicar una foto en medellã­n antioquia o0ng3h0iu4"
"2020-11-23","galeano_789","un sueã o que a partir de hoy se empieza tejer desde la realidad el colegio del futuro fue aprobado en concejo medellã­n felicitaciones albertycorredor por una propuesta revolucionarã y darã paso modelos nuevos enseã anza para nuestras futuras generaciones"
"2020-11-23","garcialotenzo","jarlinsonpantan team_medellin oscarsevilla76 la defecã"
"2020-11-23","gonzalez_medin","ã sas son dos forma de ataques como las infiltrar milicianos en alcaldã­as bogotã medellã­n cali y ciertos ministros el gobiern nacional la democracia sta cuidados intensivos"
"2020-11-23","gragus2006","que raro en meses d covid col este no ataca ni a gamines bazuqueros petroã‘eros universicarios fecode solo ciudadanos pie es mas medellin la poblacion indigentes y se mantiene o aumento creo q llego macho garzon alcaldia"
"2020-11-23","h724noticias","por solicitud de la fiscalã­a general naciã n el juzgado penal del circuito medellã­n sentenciã a aã os y meses prisiã al subintendente policã­a nacional jerson wilman aranda gaitã delito concusiã ee53qbje2c"
"2020-11-23","humbertomuozgu3","esta belleza es la peste que le cayã a medellã­n aparte del covic 19ðÿ ðÿ lw4d7abmle"
"2020-11-23","iamlorenguerra","galway ireland medellin colombia toronto canada cetrtyvlkk"
"2020-11-23","iholgun","a dos horas de la segunda ciudad del paã­s medellã­n las mafias paramilitares se disputan el territorio suroeste antioqueã o asesinatos selectivos han pasado masacre ocho personas en betania mitad colombia estã su poder y gobierno sigue tan campante"
"2020-11-23","irving_medellin","sfabyluna fonta_flores ves fontas ya kyt"
"2020-11-23","ivancho32med","adrigm_tech youtube hasta x acã te digo soy ivã n y saludos desde medellã­n colombia ðÿ ðÿ’šðÿ â ï"
"2020-11-23","jdiego_fue","medellin_los alfredjoe80 pochoharbec y dos dã­as despuã s tengo la razã n barcelona de mano bustos no juega a nada pudo ganar un equipo q estã en el descenso.y tema es almada analiza fãºtbol seas fanã tico solo digo"
"2020-11-23","jggcmusic","ðÿ en medellã­n antioquia hawixsovio"
"2020-11-23","jnbetancourt","elestimulo envã­os a medellã­n no bueno estã bien ðÿ"
"2020-11-23","johndoe60091409","mincienciasco programaondas naskadigital itm_medellin cta_co colegiosminuto seguimos sin entender el propã sito de minciencias cuando la innovaciã n deberã­a estar en transformaciã tecnolã gica al interior del estado mã s que temas ministerio educaciã y cultura"
"2020-11-23","jorge77uk","que bueno respetarã n las normas sttmed cadenagaitan metrodemedellin medellin movilidadmedellin estaciã floresta gkysnxxdv6"
"2020-11-23","ju25081","restrepoalejo tetenovoa31 hincapiedatos el men se deja llevar de esa estadã­stica que cali desaparecio solo cambio nombre esto mas todo te lo discuten y echan cizaã a hincha del america medellin inventan datos porque sus equipos nacieron narcotrã fico"
"2020-11-23","juanjai70017900","numeral767 buenas noches cuã l es el estado actual de la via desde medellã­n al municipio se jardã­n muchas gracias"
"2020-11-23","juanpablo9mejia","â el colegiodelfuturo es una realidad hoy fue aprobado proyecto de acuerdo colegio del futuro cual marcarã la pauta en transformaciã n educativa no solo medellã­n sino tambiã antioquia y colombia felicitaciones albertycorredor soy testigo arduo trabajo"
"2020-11-23","judan_1020","fonchobernal19 bello antioquia al fondo se ve el rã­o medellã­n"
"2020-11-23","lachivaalerta","alerta la chiva medellã­n vuelve el cine a arkadia arkadiacc entrenenimiento cinemarkcol cl3ifjfm49"
"2020-11-23","linagarciaganan","en estos momentos le damos nuestro voto positivo al proyecto colegio del futuro que busca modernizar la educaciã n medellã­n para hacerla mã s competitiva ðÿ juntoshacemosmã"
"2020-11-23","lioramoll","y a un an je vivais ma meilleure soirã e au medellin ðÿ"
"2020-11-23","lorebeta21","quiero denunciar a una moto que la parquean todos los dã­as en el anden del barrio campo valdes calle74 ya ocupa espacio donde las personas no pueden caminar le obstaculizar paso movidas medellã­n sttmed"
"2020-11-23","lupis_medellin","desorbirata jaajajajajaja confirmo la maldita falta de creatividad que tienen"
"2020-11-23","makaiaorg","este es un resumen de la calidaddelaire en medellã­n opendata elcolombiano eltiempo areametropol telemedellin cleanairfund accionesporelaire ibmcolombia caravanstudios ruta_n alcaldiademed o99eytgn33"
"2020-11-23","mangalenita","buscarlashastaencontrarlas alcaldiademed fiscaliacol hoy buscamos a marã­a ã ngel heredia desaparecida el de noviembre en la vã­a medellã­n bogotã policiacolombia gobantioquia anibalgaviria"
"2020-11-23","margari27588809","quinterocalle oscarsevilla76 juan_p_suarez vueltacolombia1 team_medellin epmciclismo oiga imbã cil pavimento las calles por ahã­ derecho arregla el techo de la alcaldã­a que vergãœenza i n e p t o revocatoriadanielquintero quinterocalle larepublica_co menso y pendejo trabaje suelte el twitter que de ahã­ no sale su pago ni sueldo seã ora medellin se cae rn delincuencia en trancones calles sin pavimentar t r a b j e v g o revocatoriadanielquintero"
"2020-11-23","mariboterohenao","les presento a la ciudad mã s hermosa y no pienso discutirlo con nadie te amo mi medellin del alma ðÿ ðÿ’šðÿ’šðÿ’šðÿ’š"
"2020-11-23","maxtor11","genios sitios bacanos para comprar juegos de switch en medellã­n gracias linduras"
"2020-11-23","medellin_cristo","la alcaldesa persigue a gente de bien mientras permite que vã ndalos anden sin ningãºn tipo protocolo contaminando bogotanos perversiã n total bluradioco vã ndalos rindiendo homenaje a un ndalo tan bonito que denuncian a unos mientras encubren otros izquierdistas hipã critas"
"2020-11-23","miguel_ma07","jarlinsonpantan team_medellin oscarsevilla76 se dice boyacense tramposo"
"2020-11-23","minchito0407","jarlinsonpantan team_medellin oscarsevilla76 tan marica si una persona que ya deberã­a estar de salida les gana es por experiencia nivel competitivo los jã venes estaban mal preparados"
"2020-11-23","monik692","van a ver el cambio amp no saber por quã ðÿ šðÿ â ï ðÿž ðÿ’œ en algãºn lugar de medallo gyuf1bqsus"
"2020-11-23","montsecont7","ando hablando con un colombiano de medellã­n gracias universo ðÿ"
"2020-11-23","nalgatp","todo medellã­n estã en ny este momento"
"2020-11-23","nanderas2","quinterocalle oscarsevilla76 juan_p_suarez vueltacolombia1 team_medellin epmciclismo pinturita no jodas la ciudad vuelta mierda de aquella tacita plata orgullo por su aseo y sus calles pavimentadas queda nada que tapao tan hijueputa nos metieron msznkgzyao"
"2020-11-23","neguib79","angelamrobledo usted fue fã rmula a la presidencia de un secuestrador asesino y sicario del cartel medellã­n no sea descarada"
"2020-11-23","non_an_","yo lo que necesito es una amiga en medellã­n"
"2020-11-23","osal262","sergio_fajardo este intelectual de plastico arranco en medellin y antioquia con la pandemia deseducaciã n"
"2020-11-23","oscarfh2o","asã­ se jugarã la primera fecha de tal liguilla en colombia grupo a ã guilas vs envigado medellã­n pereira b millonarios once caldas chicã patriotas c bucaramanga alianza petrolera para los nuestros clasicoboyacense"
"2020-11-23","ospinapauce","aviso social urgente se busca este niã o nombre de matã­as montoya martã­nez tiene aã os perdiã hoy en horas la tarde el barrio enciso favor ayãºdame a difundir informaciã n su familia medellã­n al tel hm6h1xdsjo"
"2020-11-23","patermionostro","cmjaramillo rcnradio caracolradio tambiã n en medellã­n tuvimos el placer de tener al gran comentarista taurino ivanparra parrita triste partida"
"2020-11-23","pepar1950","en medellã­n se habla mucho de fãºtbol y poco polã­tica un las personas conocidas que hace tiempos no vemos a veces nos reunimos grupo grande amigos toda la vida familiares para tomar unas buenas copas licor ya podemos por restricciones"
"2020-11-23","pigo2010","marlagutierreza felicitaciones marla nunca he entendido por quã lo hacen si esa es su obligaciã n ejecutar obras anibalgaviria tambiã tiene nombre en el soterrado inãºtil que hicieron medellã­n una obra de paisajismo costosã­sima"
"2020-11-23","pintasycanas","jarlinsonpantan team_medellin oscarsevilla76 buenas noches marcos hurtado â responde al profesor cely en el ã mbito ciclistico cariã osamente lo llamamos boyaco sin animo de ofender a nadie por contrario grandes amigos boyacã tenemos comãºn un abrazo y mil disculpas"
"2020-11-23","pjfltr95","swe6ter cartagena medellã­n no sabrã­a cuales mã s"
"2020-11-23","puessi7","dona_pily ya verã n publicidad de medellã­n santamarta y cali el oxigeno estos hps es la mermelada oficial"
"2020-11-23","pvirtualcom","vã­deo del hombre robando tapa de alcantarilla ocurriã en medellã­n v5lc0eivmu"
"2020-11-23","quinterocalle","medellã­n ha sido elegida como sede para la ediciã n del congresoclad2021"
"2020-11-23","ralffnilonave","acabou de sair react medellã­n em um dos maiores canais e informaã ãµes do mundo trap no brasil ðÿ to feliz acabou de sair react do marcos dos anjos ouvindo medellã­n ðÿ žðÿ link no comentã rio pvwuzrjbjd"
"2020-11-23","ricardriguez","despejando un poco de fut champions nos vemos maã ana les dejo una postal medallo city zhbubcl20a"
"2020-11-23","rodrigo57","carlosholmestru armadacolombia policiaantinar fiscaliacol y el control de la venta insumos como cemento gasolina quã­micos para procesamiento cocaã­na cuando no le parece un exabrupto que en los llanos orientales se venda mã s bogotã cali o medellã­n usembassybogota"
