"date","username","tweet"
"2020-11-23","rojasjohan2018","medellã­n de la tacita plata metrodemedellin alcaldiademed acimedellin culturantioquia d7by2uwbwu"
"2020-11-23","rubenramirezmar","monsealirio que bueno en medellã­n monseã or ricardo tobon tuviese ese corazã n para sus sacerdotes daã o le hace a la iglesia"
"2020-11-23","rushbetcolombia","todo se define en medellã­n mejoratucuota para el partido decisivo entre nacional ðÿÿ y amã rica ðÿ âš las dos opciones mã s votadas harã n parte de nuestros especialesrushbet dã janos tu voto antes p m del noviembre aplican tã rminos condiciones"
"2020-11-23","senacomunica","â ponte pilas y certifã­cate ðÿ entre el de noviembre dj bogotã medellã­n cali barranquilla podrã n certificar sus competencias laborales con la convocatoria en alianza dna music dp ðÿž inscrã­bete qw6neme9y7 fsvaxozmu3"
"2020-11-23","slasharmycolomb","gunsnroses medellã­n notinthislifetimetour ðÿ katbenzova gi8ujdiwrc gunsnroses medellã­n notinthislifetimetour ðÿ katbenzova sw01ihcsa2"
"2020-11-23","sleyvabo","fernandogrillor muchas felicitaciones a usted y anibalgaviria quinterocalle desde la mgppeafit de eafit ofrecemos todo nuestro apoyo en realizaciã n del clad medellã­n uno los eventos mã s importantes administraciã pãºblica a.l sgeneralclad"
"2020-11-23","tafur2021","video tan bonita y ladrona cogiã a bofetadas mujeres por robo en medellã­n djixqx0npm travã s de pulzo"
"2020-11-23","talksongs","earlier ep on madonna alpha amp omega everybody and medellã­n hcoimtvln2 want more madge discussion buy our 1st book z99wgsovek nk36dlsmxg"
"2020-11-23","timeisnow2020","drmckinn backbackbay j4m3z tangorene quesadillabrett czarim1 timburg95725020 sallybucket259 mark2_medellin snwilsonmd onlyme1177 minachan77 wedonopeneyes amybrough6 mikecolahan1 ulko7t7 hidden_surprise edwardyoung21 sarinajansson rself20 ðÿœš resistance resist fbr fbrparty votewarnockossoffga flipthesenatebluega"
"2020-11-23","tonybandres","quizã s el amor de mi vida estã en medellã­n ðÿ"
"2020-11-23","tutogol","vb2thvnugy laliguilla asã­ se jugarã la 1ra fecha jueves y o viernes donaorganos secsaludvalle grupo a ã guilas vs envigado medellã­n pereira b millonarios once caldas chicã patriotas c bucaramanga alianza petrolera descansa jaguares wizpgfq4qt"
"2020-11-23","unodeaquellos","mi unica foto del concierto de guns and roses en medellin es con una ex siempre tomen fotos ustedes solitos por si acaso"
"2020-11-23","valleuribista","es preocupante ver las principales ciudades del paã­s como bogotã medellã­n y cali donde los alcaldes de izquierda derrochan recursos pãºblicos el endeudamiento sin un proyecto serio a futuro en su cabeza no existe desarrollo ni mucho menos la competitividad"
"2020-11-23","vconcesionadas","colombia dpto de antioquia tras deslizamiento en valdivia abren paso a dos carriles vã­a medellã­n caucasia cj5hetqrwc colombia descartan que haya desaparecidos en deslizamiento el corregimiento puerto valdivia a esta hora concluyen labores de remociã n y se restablece paso total la vã­a medellã­n â costa caribe m61qxdgjar"
"2020-11-23","vickygalloc","jumajara ese adefesio es para asutar no sã lo a los niã os que pena por medellã­n inmundicia de imã genes navidad mejor se hubieran ahorrado esa platica"
"2020-11-23","visioncali","radiosupercali asodeporcali policiacali jorgeivanospina la gente que quiere planear una marcha caravana en motos cicla conmemoraciã n quiera sabe lo puedo hacer porque tenemos un alcalde cobarde le tiembla mano hijo de terrorismo no sanciona bandido.ejemplos bogotã medellin"
"2020-11-23","wigube","medico a domicilio no salgas de casa en estos momentos pandemia nosotros te atendemos bogotã medellã­n cali bucaramanga villa cio cãºcuta costa norte neiva excelente plan familiar was atencion tarifa promocional personas x vigenc pxm80kuzp9"
"2020-11-23","wradiocolombia","ademã s ya se restableciã el paso total en la vã­a que comunica a medellã­n con costa caribe lr0fxhgmwq"
"2020-11-23","x8myh3wqelidqyg","furiarojatv y porquã no hacen algo medianamente inteligente le dan a jerson gonzã lez que dirija ese partido en medellã­n manden para la pm juan cruz real sirve nada"
"2020-11-26","_moonlies_","bel es de medellã n ya no me voy a las piã‘as mejor la abrazo"
"2020-11-26","albanuryhernnd1","broncojoseadan confiando en dios asã­ serã saludos desde medellã­n colombia ðÿ ynzaarvw4s"
"2020-11-26","aldanaluisf1","powerful_41 para ocaã a bucaramanga medellin"
"2020-11-26","alexrojito13","ðÿ urgente serian los jugadores contagiados de atletico nacional cara al duelo definitivo contra america en medellin oficializados maã ana a las p.m atleticonacional verdolaga losdelsur maradona americadecali"
"2020-11-26","andresellopez","me parece inconcebible que haya alguien pueda contar una historia del diego en medellã­n pudo convivir un rato con ã l y no estã siendo conocida o viral quã hermoso momento viviã nestorvelbot"
"2020-11-26","andrsra15","albertycorredor concejomedellin isvimed alcaldiademed sebaslopezv linagarciaganan alexflorezh quinterocalle 1jorgetorresram excelente poco a vamos contextualizando las necesidades de los habitantes mã s necesitados para hacer medellã­n una ciudad innovadora ðÿ’ªðÿ’ª"
"2020-11-26","angemontenegrob","lo mejor de medellã­n mwjvwtk6gt"
"2020-11-26","aurora_restrepo","revocatoriadq elcolombiano medellincuenta1 mas_medellin masamorpormede ya casi sacamos a ðÿ quinterocalle"
"2020-11-26","blankolifa","que hubo bebã donde estas acabo de aterrizar en medellã­n te quiero sentir dã nde estã s voy a ir tengo unas ganas tiiii"
"2020-11-26","bripascuales","srxanderh24 claro que cambie ya no tomo medellã­n si perro con"
"2020-11-26","brucegaravito","kalley abre su casa de experiencias enâ medellã­n djtbrqnda6"
"2020-11-26","cj_marsiiglia","me estaba viendo el programa de la resistencia ayer invitado fue camilo y se presentã como medellã­n mamita querida â alguien quiere pensar en los monterianos ðÿ"
"2020-11-26","colombiavaquero","powerful_41 ibague armenia medellã­n o bucaramanga"
"2020-11-26","davidbautistaqf","cacheticolorada de personas que tienen anticuerpos para el virus por lo es muy probable sean casos los confirmados en medellã­n son como mil si no estoy mal estadã­sticamente probables segãºn eso eran maso entonces sã­ acuerdo con la seroprevalencia"
"2020-11-26","deleiterisueno","llega diciembre y con el nuestras hallacas que esperas para probarlas este sã bado tendremos disponible deleiterisueno hallaca diciembreðÿž medellin l6mz5ocxzi"
"2020-11-26","eliecerhernadez","enriquepenalosa hablan y no se ve inicios de obras todo queda en el bla este seã or ya dejo papel metro bogota medellin"
"2020-11-26","felipedz10","ðÿ en medellã­n antioquia kgrjgmuos3"
"2020-11-26","franeditor","soyandresparra josã vicente grecco goleador histã rico del poderoso independente medellã­n"
"2020-11-26","franoguera","saludhernandezm amirareym en medellã­n despuã s de poner el primer ladrillo se iniciã una gran campaã a cultura ciudadana no solo con publicidad asã­ los paisas apropiaron del metro y lo cuidan como propio desde entonces"
"2020-11-26","fundacionorca","â participa en nuestra alcancã­a navideã a llena tu y dã nala como aguinaldo para nuestros peluditos ðÿ fecha de recepciã n diciembre lugar el mejorcoworking cafã fundaciã calle medellã­n ðÿ’œ planalcancia fundacionorca.org aguinaldoparalospeludos mtsdpowqna"
"2020-11-26","ivan_verdola","dani3palacios exc poss geande tripas fielnoyente desde medellin sus postcsst son mundial grande tripon"
"2020-11-26","jonatansernafr1","numeral767 buenas noches quã tipo de restricciã n hay en la vã­a entre medellã­n manizales gracias"
"2020-11-26","jorgegalindo","danielpacheco hombre en medellã­n el porcentaje es de la mitad que barranquilla estã justo lã­mite una las posibles estimaciones cuã ndo alcanza poblaciã n esa inmunidad lejitos sã­"
"2020-11-26","juanbedoya73","salsa desde medellã­n"
"2020-11-26","kimonydesigner","acaba de publicar una foto en medellã­n antioquia 5psqssmued"
"2020-11-26","mds_delgado","dimayor hoy no solo destruyeron un club normal y humillaron a miles de hinchas sã lo en cãºcuta si por todo el mundo esta ciudad tan olvidada porque le aseguro fuera otro equipo ejemplo medellã­n tolima santa fe"
"2020-11-26","mori_medellin","noroã a no puede ser mã s pen jo e irresponsable juliosergio2269 falta de ã cido fã lico"
"2020-11-26","r10s_bitch","abelinoseplveda _julirtp22 compras un boleto para medellã­n en el barco del capitã n garfio y apenas llegues vamos junticos"
"2020-11-26","radnalco","reportecovid19 medellã­n tiene una seroprevalencia la mã s baja hasta ahora del con un intervalo de confianza entre y martha ospina directora inscolombia sobre el estudio ðÿ âž lppvt06wli u69kbmhzo6"
"2020-11-26","raulflorez_","quien sabe dã nde venden salchipapas costeã‘as en medellã­n help medellin sinhuevocodornis"
"2020-11-26","rosa24639653","gusmaldonados en tradmilenio eso es lo que falta y revocatoria medellin ya tienen todo listo para recolectar las firmas sacar a diablito gusmaldonados asi es medellin la gente los agarra y garrote por eso donde hay se temen mano de pero bogota ven no colaboran que deben hacer ley"
"2020-11-26","sarrazolams","anakamaya79 ronnysuarez_ entiendo que medellã­n fue uno de los cierres mã s estrictos iniciales se expandiã a menor velocidad por eso la segunda ola parecida europa en leticia no han tenido repuntes propia inmunidad rebaã o tan anhelada pero su tasa mortalidad mayor"
"2020-11-26","sebasti84890634","deltiburonsoy macne10 por lo menos a los que le hicieron eso en medellã­n pagaron cano adiferencia de usted es cosa todo dã­as no ya dije prefiero ser narco un puto zoofilico 1b3avbcjdj"
"2020-11-26","sin_anestesia_1","jangel7circulo cadosch12 medellin es un pueblito con metro ðÿ ananneannie civilpreocupado medellin es un pueblo con metro bogota ciudad para ser catalogada como tal faltan aã os sin"
"2020-11-26","stefanbravo3","atencion revocatoriadanielquintero renta bã sica haces dias comentã lo del proyecto onu aqui feminazis en medellã­n quintero no le importa vandalismo segun estas mamertas se les puede grabar 1b0plorwp4"
"2020-11-26","technocio","kalley abre su casa de experiencias enâ medellã­n clydo8wyrc"
"2020-11-26","yolverzambrano","shannylam8 venezolano en medellin"
"2020-11-29","_am0705","pero las de medallo"
"2020-11-29","1jeanvaljean2","derechista20101 petrogustavo osea el centro democrã tico conocido antiguamente como cã rtel de medellã­n"
"2020-11-29","28_yoe","pactopormedellin mas_medellin medellincuenta1 que tal este descarado para votarã n por el les prometiã cielo y la tierra ahora los desaloja menos mal faltan solo dias"
"2020-11-29","34jjgc","plan a aã o para irme vivir medellã­n ðÿ š"
"2020-11-29","airanx","el carter de medellã­n pide a netflix que aclare narcos es ficciã n y no una serie histã rica"
"2020-11-29","albanuryhernnd1","broncojoseadan provecho ðÿ saludos desde medellã­n colombia naxdktaurw"
"2020-11-29","aleja1020","eldelmedallo dios te oiga cojo un aviã n para medellã­n a beber antioqueã o en aquel balcã"
"2020-11-29","alejitapitu20","mariadcmesa alguien con quien sale de medellã­n me contã el costo un apto en renta y es bastante alto ðÿ"
"2020-11-29","almtgb","soyalejangu sapienciamed concejomedellin con el patrocinio de mermelada herr quintero la del concejo medellã­n"
"2020-11-29","alwayssmile_xx","ø ø­ù ù øª ø­ùšø øªùš ùƒù ùš ùšø­ù ùƒ ùˆùšø ùšùƒ ùšø ðÿ medellin_af"
"2020-11-29","andresdinger47","sometimes i'm not who you want me to be en terminal de transportes del sur medellã­n syi7ja0b6m"
"2020-11-29","andresjcardenas","ðÿ ðÿš fotos jairoacardenasrpsicologo pasionciclista indoorcycling cycling bici ciclismoderuta yosoygw gwk2â saludmental rideshimano en medellin ant ubonwekbea ðÿ ðÿš fotos jairoacardenasrpsicologo pasionciclista indoorcycling amoralpedal cycling ciclismoderuta roadcycling cyclingpics bicycle yosoygw gwk2 saludmental soycycoâ rideshimano en medellin ant ztckuvubft"
"2020-11-29","aneirojr","desde medellã­n colombia apoyando a mi equipo rapaz ðÿ ivclvbp gwkijdbmih"
"2020-11-29","angepolo12","camilavasquezv8 venga pa que se tome su respectivo garrafã n de medellin"
"2020-11-29","anita0619","creer ðÿ âœ â en medellã­n antioquia avppdwia9o"
"2020-11-29","annykita","lejuanito tiene motilao de colas tipo alcalde medellã­n"
"2020-11-29","anthonyrpov","domingo de hacer cardio subir el cerrodelastrescruces medellin una vista maravillosa la ciudad eterna primavera fitness motivation senderismo naturaleza nature en cerro las tres cruces 1m4u9l2u5c"
"2020-11-29","anyee736","ngalvisarias agui en medellã­n todo se come con arepa y eso sã­ paisa cuã l pan"
"2020-11-29","arnulfobetancur","a epm la dejaron en crisis ficogutierrez y ex junta gea usd mllns sin cobertura cambiaria de hidroituango negocios huesos todo eso se viene arreglando vamos bien entrevista al alcalde medellã­n daniel quintero alcaldiademed vwlx6qk5un"
"2020-11-29","azuluaga26","mariafdacabal la pobre y todos perjudicados con esa ley en medellã­n victimas meritage llano grande"
"2020-11-29","bnnywglttr","andreasaltre ojalã vivieras en medellã­n ðÿ"
"2020-11-29","boomalakran","e_duperly mejor una banda de pop decadente medellã­n que se llame thanksgiving"
"2020-11-29","camikant","mariapsierra nadie dice que en medellã­n jijiji"
"2020-11-29","cancervecero3","quinterocalle este hp estã mã s drogado que su patrã n petrogustavo no puede con medellã­n y ya quiere desfalcar a los otros ðÿ"
"2020-11-29","candelinajolie","soysantiagop mi santi creo que es una propuesta reduce la acciã n de democracia por un lado el otro medellã­n no ha podido disminuir pobreza y desigualdad solo en ese territorio pueda extensiã mã s grande con sola figura cabeza"
"2020-11-29","caracoltv","culturacaracol eventos exponentes participarã n en este encuentro que demuestra la diversidad y riqueza de danza medellã­n ðÿ’ƒðÿ º ayb89eappm"
"2020-11-29","cardoza_luder","rato sin tomar medallo"
"2020-11-29","carlosg57649525","ernestomaciast alvarouribevel haber tenido un presidente y senador integrantes del cartel de medellã­n asociados al paramilitarismo responsables desplazamientos masacres violaciones menores es una afrenta a la democracia elemento que estimula los narcos actuales futuros"
"2020-11-29","cataboterotv","atenciã n capturan a los tres responsables de la masacre personas en betania antioquia ademã s aprehendieron un menor edad por orden judicial fueron capturados medellã­n hispania y ciudad bolã­var alias â œluisâ œguacucoâ œsangreâ minutos noticiascaracol keif3ud1lz"
"2020-11-29","cesarolse","prohibieron la alborada en medellã­n tradiciã n de lanzar toneladas pã lvora explosiva noche del noviembre para darle bienvenida a diciembre â ustedes creen que se lleve cabo pese restricciã"
"2020-11-29","cfcbing","despuã s de lo ayer en medellã­n con esa expulsiã n â œilã gicaâ me pregunto si la fifa implementã el var o comprã franquicia œgran hermanoâ jfcadavid jemoralesh andrestorresd gacamv elvarcentral"
"2020-11-29","chamaesmerida","prã fugos de la luna roja profugoslr comienza a mostrar su predisco en diciembre t6kve6m4ao travã s chamaess bogotã caracas mã rida medellin buenosaires argentina dw8mcomytj"
"2020-11-29","cheloalmeidac","joseguzmi80 medellin_los estebanavila sã­ liga es lo que dices porque pasas comentando en todo lado sobre jajaja el sufrimiento te causa fea vida debes tener"
"2020-11-29","chennyguzman","orlandojm elpais_america ciclorutas y beneficios a empleados que acudan en bicicleta dã­a libre al mes ha ayudado incentivo del uso pero bogotã robo d bicicletas ciclistas se disparado nueva alcaldesa no podido con la inseguridad.aca medellã­n hay una cultura de"
"2020-11-29","chris10bsc","renatog1122 medellin_los fmolestinae a mi no me arde brother y esta bien disfruta el futbol es de buenas malas rachas bsc en los 90era protagonistaa uds ni asomaban asi mismo hacian ridiculo ahora le toca eso todo"
"2020-11-29","ciclismoenlinea","clã sico rcn â primer lã­der felicitaciones ðÿ ðÿš el pedalista del team_medellin brayans1994 asume liderato clasicorcn despuã s de la primera fracciã n cre y en que su eescuadra fue protagonista qwrndnvckh"
"2020-11-29","cielomontoya3","damadehierrom jajajaja patã tico pinturita alcalde no puede con medellã­n y ya quiere ã l rea metropolitana petroã adas al dã­a ðÿ â ï"
"2020-11-29","colombia_hist","datocurioso el aeropuerto de medellã­n hace 50aã os se llamaba lasplayas hasta que fue vendido k3dteskdwk"
"2020-11-29","daleotar","lidiodominante ã‘eeeee el dã­a que dejen de aparecer zorreros reciclando en bogotã medellã­n cali o barranquilla ese ã ste hueco serã medio urbano antes no"
"2020-11-29","danimelma","pensar a medellin y el valledeaburra como ciudad regiã n cambia la forma de concebir e impulsar su progreso desarrollo materializar consolidaciã fortalecerã urdimbre nuestro tejido social sentido pertenencia proyectã ndonos aãºn mã s destino inversiã"
"2020-11-29","daniymagneto","acaba de publicar una foto en comuna medellã­n colombia qjcjzklms7"
"2020-11-29","danypatrol","clabianchicla s4f4ri1 miiecstasy osc__ar yes itâ s aging good but it definitely has some bad songs like bitch iâ m loca medellã­n i rise just skip them"
"2020-11-29","degenerjitz","logfitz6 have been to cartegena medellin 6x cali bogota and barranquilla might retire here good weather warm beautiful people low cost of living still my favorite city so far poblado area"
"2020-11-29","devimed","calzada bogotã medellã n municipio copacabana a la altura asadero pollos mario del km sin novedad calzada bogotã medellã n municipio copacabana a la altura asadero pollos mario del km presenta paso restringido por vehã­culo varado autopista medellã­n bogotã municipio de guarne a la altura del chaparral km no presenta ninguna novedad"
"2020-11-29","dogepodcast","everybody in colombia eats pizza with pineapple they call it hawaiian medellin bogota"
"2020-11-29","eduar2631","cadenagaitan lamba q estan echando como siempre mamerto defiende no ha sido capaz con medellã­n las calles de son un desastre llenas huecos en todos los barrios y ustd la movilidad paso el sab habia x donde moverse cerro autopista ðÿ"
"2020-11-29","eglomu","luisrangelmlyl irving_medellin luis come como niã o de aã os nuggets y hamburguesitas mcdonalds"
"2020-11-29","elcolombiano","en entrevista con el colombiano alcalde dijo que ministerio de salud le informã cuã ndo podrã­a haber vacunas para medellã­n lã alo aquã­ ymtx4txtfo"
"2020-11-29","elcorncapitan","at least times a month i think to myself billy walsh would have won cannes for medellin"
"2020-11-29","elespectador","el team medellã­n se quedã con la contrarreloj por equipos del clã sico rcn aeak20xmfa q8ohqpqepf"
"2020-11-29","emiliogonzlezg6","en medellin ademã s del covid hay otra pandemia llamada âœ pseudo cantantes artistasâœ"
"2020-11-29","estebanrestre","un agradecimiento a los concejales que se sumaron esta iniciativa con esto sin duda estamos construyendo juntos la transformaciã n de medellã­n concejomedellin esta nueva visiã n de la educaciã postsecundaria fue una promesa del alcalde quinterocalle quien propuso integrar para iniciar un proceso transformaciã curricular que genere nuevo modelo educativo medellã­n sapiencia asume el reto de liderar la educaciã n postsecundaria en medellã­n y hoy damos primer paso con aprobaciã concejomedellin del proyecto acuerdo que modifica objeto las funciones agencia eduaciã superior medellin"
"2020-11-29","estefanatruji16","mjoq02 la cura para soledad se llama medellã­n"
"2020-11-29","estradacarlosm","con alegrã­a celebramos el anuncio del alcalde de medellã­n quinterocalle entregar un terreno propiedad municipio para construir centro innovaciã n sena beneficio todo los medellinenses senaesnaranjaðÿ š"
"2020-11-29","evamariasefue_","quinterocalle alcaldiademed epmestamosahi oã­ste dani muy vacano eso que estã haciendo epm hay ayudar felicitaciones pero â pa cuando pensã s mandar a tapar esa mano de huecos quã en las calles medellã­n deterioradas n nuestras y habla mal la actual administraciã"
"2020-11-29","finalenalto","el team_medellin se ratifica como favorito al ganar la cre en clasicorcn 15biydjvqz diegogiraldopa brayans1994 lã­der de cg 2ztjb8lnb6"
"2020-11-29","francis13427601","natalyvelezl masaldarlon concejomedellin que triste uds no hacen nada y salen a decir ayudan la niã ez me paro en cada semaforo de medellin veo os por doquier cual puta ayuda se estan robando toda luisalfreramos juanduribe61 y ud callado con todo lo que pasa en antioquia medellin pense se iba a poner trabajar para rescatar de ese par ratas"
"2020-11-29","francis78104541","laligaxwin buenas tardes los saludo desde medellã­n hoy clasifica mi santafecito lindo y seremos campeones"
"2020-11-29","franco_diestro","damadehierrom cielomontoya3 ojo con ese man medellã­n debe frenarlo"
"2020-11-29","fridokhala","no les alcanzã a meses de gobierno la burocracia medellã­n necesitan los puestos y contratos del ã rea metropolitana"
"2020-11-29","gloriaicairo","la campaã a educativa y el manual d convivencia para uso del metro fue de aã os luego su vida ãºtil hasta que llegã hdgp pinturita quinterocalle daã arlo en meses debe hacã rsele un juicio por traiciã n medellã­n revocatoriadanielquintero nunca es ni serã paisa quinterocalle mi ciudad este forã neo cree q medellã­n o antioquia adopta a un comunistoide la ãºnica garantã­a es destrucciã n pã sima administraciã y el abandono de tacita plata lã rguese antes lo saquen como basura revocatoriadanielquintero ya"
"2020-11-29","gmez2john","larazajlopez isabelhdz05 quinterocalle votaron en contra de alfredoramosm y miren el resultado lã pez o sos testaduro no medellã­n fin del comunicado"
"2020-11-29","gomez4stiven","feelinâ good like i should boy medellin viral potdðÿ like4like followme cnloqw91ok"
"2020-11-29","grupochamaes","chamaes mãºsica pendientes con deviaje deviajeband se viene su predisco en diciembre comienza mã rida sancristã bal caracas bogotã medellin manizales bucaramanga xico buenosaires argentina ga5fbnzcry chamaes mãºsica pendientes con deviaje deviajeband se viene su predisco sã­ganlos ahora â quiã nes son owen lulo guitarrista rã­tmico y arreglista desenvuelve en piano guitarra estudiante mã rida medellin caracas bogotã sancristã bal novedades bandas 8ml5wad2w2"
"2020-11-29","haquibe","noches de diciembre ðÿ en medellã­n antioquia j04nkv8v4h"
"2020-11-29","henryrotan","martha_lanana rodriguezr_jc ganã amã rica femenino y masculino a nacional de medellã­n rodriguezr_jc y ayer el rã­o medellin estuvo crecido por tanta lluvia lã grimas de los paisas hinchas nacional"
"2020-11-29","hermanodelucho","que los hinchas de medellã­n se burlen nosotros el mundo al revã s"
"2020-11-29","imachainsmoker","mariacamilah___ medellã­n te espera"
"2020-11-29","ivansagbini1","daniellaaleman vamos pa medallo"
"2020-11-29","jatirado_oc","medellã­n la vida le sonrã­e en ee uu al niã o ã ngel del chapecoense 0hdsii6axe 4jzup4ibnt"
"2020-11-29","javierc47955625","josefer70039383 smazo16 tamaralejo jaime890812 ldsoficial pradoverde1999 nacionaloficial esos goles fueron hechos en medellã­n porque la critica que se les ha hecho es b quilla amilanan de todas formas gracias"
"2020-11-29","jengi_","pues si medellã­n llega a ser distrito que desde hace rato lo estã intentando me parece en efecto debe con todos los municipios del ã rea metropolitana como localidades f0ugfz9wr4"
"2020-11-29","jgiraldoreporta","mi atuendo de hoy en laredcaracoltv camisa velezforleatherlovers gafas santaluciaosl y estas hermosas flores son rosapurpuratallerfloral medellã­n antioquia nkux884ynb"
"2020-11-29","jhenao0123","revocatoriadq bernardoaguerra todosxmedellin medellincuenta1 concejomedellin quinterocalle xmimedellin mas_medellin masamorpormede jumajara danielduquev todos a pedir que retiren los datos por favor difundan como"
"2020-11-29","jhonathantw318","alvaroguti55 los huecos en las vã­as de medellã­n son una triste realidad"
"2020-11-29","jimmylong59","a este hijueputa medellin le quedã grande y ahora piensa en el ã rea metropolitana al fin mamerto"
"2020-11-29","johnnyscp1906","guida1906 o rabolho do calado atã soltou pinguinhos ao ver dono assim vestido quem ã que terã oferecido casaco orelhas medellin cali ou veio de sinaloa"
"2020-11-29","jorge49987024","recuerden que ã lvaro uribe fue formado en la entraã as del cartel de medellin y protegido sus capos el modus operandi los realizan las masacres lideres sociales desmovilizados opositores etc sea mismo utilizã no es coincidencia"
"2020-11-29","jorgebautistar2","mejora tu salud omnilife pedidos y entregas colombia bogota cali medellin tunja tibana has tus whasatpp gente que cuida la uxgwle3prg"
"2020-11-29","jotagarciah","lbpxtelecaribe gracias por la transmisiã n desde medellã­n pegado siempre a pantalla"
"2020-11-29","jottafre10","frases friends amigos bogota medellin compaã eros publicidad trabajo vida en norte de pia0onfmsj"
"2020-11-29","jruizdiaz","jaos72701634 politicapuntual claudialopez betomanizales11 de acuerdo jaos en cali que despierten ya medellã­n y bogotã arrancamos hay revocar esas bellezas alcaldes"
"2020-11-29","juanakax","desde casa museo inejo en medellã­n"
"2020-11-29","juanbedoya73","esa medellã­n veraniega decembrina ðÿ’š"
